index,url,brand,name,price,stars,num_ratings,num_reviews,reviews,platform,image,vader_score,final_score
56,http://flipkart.com/vebnor-men-printed-casual-pink-shirt/p/itm358618810be06?pid=SHTGHHQKFF2ZYSAF&lid=LSTSHTGHHQKFF2ZYSAFRJJ2VI&marketplace=FLIPKART&store=clo%2Fash%2Faxc%2Fmmk%2Fkp7&srno=b_1_17&otracker=browse&fm=organic&iid=eefc1ef4-eb75-4d8e-8288-6015d23c7a67.SHTGHHQKFF2ZYSAF.SEARCH&ppt=None&ppn=None&ssid=1azmxj5o680000001680018484890,VeBNoR ,Men Regular Fit Printed Spread Collar Casual Shirt,₹259,4.1,1291,130,awesome product it is stretchable cool best for fashion lovers must try i am happy size and quality is as per expectation good 👍🏻 suparb shirt 👕value for money 💰,Flipkart,https://rukminim1.flixcart.com/image/832/832/xif0q/shirt/h/d/2/s-st10-vebnor-original-imagmh4zcpkt9rgz.jpeg?q=70,3.1189999999999998,0.004712086285502242
104,https://www.snapdeal.com/product/urban-mark-navy-cotton-regular/654193640250#bcrumbLabelId:2946,UrbanMark Men 100% Cotton Half Sleeves Regular Fit Check Casual Shir,avy Blue & Yellow,699,4.3,38,1,,Snapdeal,https://n1.sdlcdn.com/imgs/k/k/2/UrbanMark-Navy-100-Cotton-Regular-SDL001591308-1-5386d.jpg,0.0,0.004028881706707274
111,https://www.snapdeal.com/product/urban-mark-beige-cotton-regular/8070451160181119269#bcrumbLabelId:2946,UrbanMark Men 100% Cotton Half Sleeves Regular Fit Solid Casual Shir,ight Blue,349,3.9,41,0,,Snapdeal,https://n1.sdlcdn.com/imgs/k/k/v/UrbanMark-Light-Blue-Cotton-Regular-SDL163096952-1-a5731.jpg,0.0,0.003942583750933251
114,https://www.snapdeal.com/product/yha-light-blue-cotton-regular/5764608148199679815#bcrumbLabelId:2946,YHA,Light Blue 100% Cotton Regular Fit Men's Casual Shirt ( Pack of 1 ),575,4.1,38,3,,Snapdeal,https://n2.sdlcdn.com/imgs/k/j/y/YHA-Light-Blue-Cotton-Regular-SDL304991683-1-f79c4.jpg,0.0,0.0038414918598836797
1,https://www.amazon.in/Lymio-Casual-Stylish-Printed-Karrey/dp/B0BRKJRS6Z/ref=zg_bs_1968094031_sccl_2/258-1229559-2740407?psc=1,Lymio,Casual Shirt for Men|| Shirt for Men|| Men Stylish Shirt || Men Printed Shirt (Karrey),₹499.,4.3,179,121,good product received the product as shown in the photo just a little faster delivery enjoy it has a classic look and fits true to size i appreciate the attention to detail in the design including the buttons and collar overall a great purchase comfort good i like this nice desigen or stuff or febric bottom is too long i like it fine quality and product good product value for money,Amazon,https://m.media-amazon.com/images/I/71dInK15s1L._UX425_.jpg,5.3108,0.0037107371551217748
13,https://www.amazon.in/Majestic-Man-Cotton-Casual-Check/dp/B0B3WZJC6K/ref=zg_bs_1968094031_sccl_14/258-1229559-2740407?psc=1,Majestic Man,Slim Fit Cotton Casual Check Shirt for Men,₹449,3.9,743,73,good good product nice cloth good fitting vnyc majestic man shirts are good in looks an fitted got 4 shirt of this brand cotton fabric is also very comfortable 🤗 i like it lovely❤❤❤❤ shirt quality is really good at this price material is nice but its not true to its size order one size high,Amazon,https://m.media-amazon.com/images/I/61uBH8gIIIL._UY550_.jpg,5.730300000000001,0.0035974102868106964
121,https://www.snapdeal.com/product/gritstones-black-cotton-blend-regular/5764608208163556962,Gritstones,Black Cotton Blend Regular Fit Men's Casual Shirt ( Pack of 1 ),469,4.2,33,1,very good,Snapdeal,https://n1.sdlcdn.com/imgs/k/k/g/Gritstones-Black-Cotton-Blend-Regular-SDL192018817-1-8603b.jpg,0.4404,0.003531547316987891
11,https://www.amazon.in/Lymio-Casual-Shirt-Stylish-Printed/dp/B0BRKJPYX4/ref=zg_bs_1968094031_sccl_12/258-1229559-2740407?psc=1,Lymio,"Casual Shirt for Men|| Shirt for Men|| Men Stylish Shirt || Men Printed Shirt (Beach Blue,Red,Rama)",₹349,4.4,202,147,comfortable fabric in reasonable price it’s a great shirt in this price range looking good as expected nice shirt value for money got got 399 i find it a bit large  but the cloth is made of good quality good product overallselect a size large from your usual size i like it quality of cotton is good,Amazon,https://m.media-amazon.com/images/I/71lKVTIW5QL._UY550_.jpg,4.0198,0.0035014839869041033
100,https://www.snapdeal.com/product/dillinger-olive-100-cotton-slim/672666654479#bcrumbLabelId:2946,Dillinger,Olive 100% Cotton Slim Fit Men's Casual Shirt ( Pack of 1 ),649,3.9,36,1,,Snapdeal,https://n3.sdlcdn.com/imgs/k/l/e/Dillinger-Olive-100-Cotton-Slim-SDL062417426-1-c365a.jpg,0.0,0.0034617808544779765
132,https://www.snapdeal.com/product/yha-black-cotton-regular-fit/6917529697708201387,YHA,Green 100% Cotton Regular Fit Men's Casual Shirt ( Pack of 1 ),575,4.4,30,0,,Snapdeal,https://n4.sdlcdn.com/imgs/k/h/e/YHA-Green-Cotton-Regular-Fit-SDL293489309-1-36f1e.jpg,0.0,0.0032546657606203197
6,https://www.amazon.in/GRECIILOOKS-Casual-Shirts-Printed-X-Large/dp/B0BWJMFXFK/ref=zg_bs_1968094031_sccl_7/258-1229559-2740407?psc=1,GRECIILOOKS,Casual Shirt for Men| Shirts for Men| Mens Shirt| Printed Shirts for Men| Casual Shirts for Men| Floral Shirts for Men| Printed Beach Wear Men,₹379,4.7,35,33,nice product quality fabric is also good this shirt has great prints i just loved the way it fits me and even best part is it is very comfortable and best for summers its my one of the best purchase from amazon as its quality is top notch and print is so beautiful\nit gives beachy vibes but can also wear it for any celebration\ni got a lot of compliment for this fabric is good very comfortable to wear\nlooks good to wear\nthank you amazon for listing this kind of reasonable products\nbest product in this range fabric quality is great\nalong with that design print is just same as shown in photo which is a good thing shirt looks awesome 👌 i love this shirt fully comfortable \nfabric of this shirt is awesome\ngood for summer it perfectly fits on me shirt is of very good material and quality i wore it on holi and it looked so cool and fitting is also very great if youre looking for damn cool look then you can definitelyy go for this one  amazing quality \nvery nice fitting and stuff love it  i really like the quality of this shirt fabric is too good best at this price looks amazing very nice shirt beautiful print with perfect fitting n good quality highly recommend this product,Amazon,https://m.media-amazon.com/images/I/51QlCU8cRWL._UX522_.jpg,18.402700000000006,0.0032292126826358285
16,https://www.amazon.in/Miraan-Sleeve-Casual-Light-blue-SIGLIGHTDENIML/dp/B0B2183N6C/ref=zg_bs_1968094031_sccl_17/258-1229559-2740407?psc=1,Miraan,Men's Long Sleeve Casual Denim Shirt (SIGDENIM),₹745,3.7,509,57,good product people who wants to buy xl size should rather go for xxl size since its not the right size as mentioned is chart likewise for other sizes also go for one size higher product is good at this price and looks cool go for it  good one fitting is good but not feel like like denim clothits good product not vry good and becareful with the size chart given size shown that s size measures on me but when i saw reviews i ordered m size this is not a denim clothe ita denim pattern colour clothe is very thin nice product i used it for 3 months febric is soft and nice comfortable fabric and looks and fits well good quality quality great\nlook feel great\nfitting very small\n\nissue the measurements given in the chart for this product is wrong i purchased an xl but received l size shirt with xl badging please order a size bigger i have reordered this item will update this review when i receive the recharged product\n\nupdate as of nov8 the xxl size fits perfectly request to the vendor to please update the size chart good quality and feel not quality,Amazon,https://m.media-amazon.com/images/I/81uTb5UwUgL._UY550_.jpg,7.446000000000001,0.003128851833759985
119,https://www.snapdeal.com/product/hangup-denim-blue-shirt/634949417365#bcrumbLabelId:2946,Hangup,Blue Denim Slim Fit Men's Casual Shirt ( Pack of 1 ),775,4.2,29,0,,Snapdeal,https://n3.sdlcdn.com/imgs/k/j/v/Hangup-Blue-Denim-Slim-Fit-SDL423154608-1-5a044.jpg,0.0,0.0030031688609360226
36,https://www.amazon.in/Lymio-Casual-Stylish-Printed-Sheded/dp/B0BWS5GCK7/ref=zg_bs_1968094031_sccl_37/258-1229559-2740407?psc=1,Lymio,Casual Shirt for Men|| Shirt for Men|| Men Stylish Shirt || Men Printed Shirt (Sheded Rose),₹399,4.4,33,29,i liked this product i like the product the quality is good its very comfortable to wear in summer amazing fabric quality print is also good i love this product the shirt is very soft and comfortable its perfect fit amazing quality the colour is also good fitting of this shirt and look is awesome haing great look after wearing great one material is good good product in this price would like to buy another product i love this product amazing shirt very comfortable to wearfabric quality is best  fits perfectly best for boys and mens  go for it must buy great fabric  love the colour i love this product amazing shirt the fabric quality is so good fit is perfect very comfortable to wear the print is looking so cool and the cloth quality is also good i really liked it great fabric must buy go for it,Amazon,https://m.media-amazon.com/images/I/71dHMIlgc5L._UY550_.jpg,18.80140000000001,0.0028980454404114314
153,https://www.snapdeal.com/product/yha-100-percent-cotton-red/8070451196189699587,YHA,Grey Cotton Regular Fit Men's Casual Shirt ( Pack of 1 ),575,4.5,25,2,,Snapdeal,https://n3.sdlcdn.com/imgs/k/j/u/YHA-Grey-Cotton-Regular-Fit-SDL105065020-1-aa051.jpg,0.0,0.0027738628641650453
32,https://www.amazon.in/OTUS-Cotton-Casual-Solid-Black/dp/B09WKKZ78W/ref=zg_bs_1968094031_sccl_33/258-1229559-2740407?psc=1,OTUS,Men's Cotton Casual/Formal Slim Fit Solid Shirt,₹438,3.6,685,50,i got it in good condition and its good meterial is cheap and low quality nice shirt and fitting also nice fitting very good good product good this product is good for the short time not for a long life product but if want you can buy it but best quality best shirt quality and best shirt at this cost,Amazon,https://m.media-amazon.com/images/I/41Aemtzsa3L._UX385_.jpg,5.200099999999999,0.0025638871158373414
37,https://www.amazon.in/UNIBLISS-Casual-Shirt-Printed-Halfsleeve/dp/B09SXWK37C/ref=zg_bs_1968094031_sccl_38/258-1229559-2740407?psc=1,UNIBLISS,Men's Casual Shirt Printed Rayon Halfsleeve,₹449,3.4,737,91,material is not good average rating material for the price it should have been more like color and quality smaller than expected 👎👎 this product is good but i would not recommend very good after the first wars buttons got losing and i have to be stitch the buttons once again however cloth quality is good but before wearing you have to do iron once at least light i am need to be done i ordered xl of this shirt bt its seems to be an l rather than xl okay it looked gpod when it came but it heavily shrunk after the 1st wash  cloth is excellent quality of this shirt is not up to the mark you can buy for daily usage,Amazon,https://m.media-amazon.com/images/I/61FleZG8eFL._UX425_.jpg,2.8018000000000005,0.0025573809368933526
108,https://www.snapdeal.com/product/urban-mark-green-linen-regular/5764608209170950438#bcrumbLabelId:2946,UrbanMark Men 100% Cotton Half Sleeves Regular Fit Tie Dye Casual Shir,reen,699,4.3,24,0,,Snapdeal,https://n1.sdlcdn.com/imgs/k/k/l/UrbanMark-Green-Cotton-Regular-Fit-SDL785680007-1-03c07.jpg,0.0,0.002544556867394068
105,https://www.snapdeal.com/product/dennis-lingo-grey-100-cotton/8070451176415169358#bcrumbLabelId:2946,Dennis Lingo,Olive 100% Cotton Slim Fit Men's Casual Shirt ( Pack of 1 ),809,4.5,22,0,,Snapdeal,https://n2.sdlcdn.com/imgs/k/l/n/Dennis-Lingo-Olive-100-Cotton-SDL348051812-1-2b66e.jpg,0.0,0.0024409993204652395
103,https://www.snapdeal.com/product/dillinger-maroon-100-cotton-slim/660948529144#bcrumbLabelId:2946,Dillinger,Maroon 100% Cotton Slim Fit Men's Casual Shirt ( Pack of 1 ),649,4.2,22,0,,Snapdeal,https://n1.sdlcdn.com/imgs/k/l/e/Dillinger-Maroon-100-Cotton-Slim-SDL104436921-1-96f53.jpg,0.0,0.002278266032434224
30,https://www.amazon.in/Majestic-Man-Solid-Casual-Medium/dp/B09VP7SL2M/ref=zg_bs_1968094031_sccl_31/258-1229559-2740407?psc=1,Majestic Man,Solid Slim Fit Casual Shirt for Men,₹449,3.8,672,52,the main problem with this shirt is that the collar is very small size so it is not for formal wearing the color is not pure white the most important thing is that the packaging was very cheap it had had one transparent cover wrapped with a pinni and i had a very difficult time carrying it home from my office good nice quality thank as expected best in this price range according to pirce it’s not bad मुझे आर्डर के अनुरूप ही उत्पाद प्राप्त हुआ\nपसंद आया फिटिंग बढिया रही its worth it quality is good more than my expectation well fit but i ordered maroon shirt it looks like red thats the only problem may be other colours can be get as expected worth for money nice looks nice fabric solid white color well fiting go for it worth buying shirt and this pant,Amazon,https://m.media-amazon.com/images/I/61mrsOlmVZL._UX522_.jpg,3.739200000000001,0.0022671983109874595
115,https://www.snapdeal.com/product/urban-mark-white-cotton-regular/648629410297#bcrumbLabelId:2946,UrbanMark Men 100% Cotton Full Sleeves Regular Fit Print Casual Shir,hite,799,4.0,22,0,,Snapdeal,https://n2.sdlcdn.com/imgs/k/k/v/UrbanMark-White-Cotton-Regular-Fit-SDL183263237-1-ff842.jpg,0.0,0.0021697771737468796
107,https://www.snapdeal.com/product/urban-mark-light-blue-cotton/656522410939#bcrumbLabelId:2946,UrbanMark Men Viscose Half Sleeves Regular Fit Tropical Beach Print Casual Shir,ight Blue,349,4.1,16,2,superb quality appreciate,Snapdeal,https://n4.sdlcdn.com/imgs/k/k/j/UrbanMark-Light-Blue-Cotton-Regular-SDL486450410-1-2b4eb.jpg,1.0268,0.002149747468091837
54,http://flipkart.com/woxen-men-solid-casual-black-shirt/p/itmdb73c70fd4631?pid=SHTGM4HVCTWYXZKP&lid=LSTSHTGM4HVCTWYXZKP6WCXZK&marketplace=FLIPKART&store=clo%2Fash%2Faxc%2Fmmk%2Fkp7&srno=b_1_15&otracker=browse&fm=organic&iid=eefc1ef4-eb75-4d8e-8288-6015d23c7a67.SHTGM4HVCTWYXZKP.SEARCH&ppt=None&ppn=None&ssid=1azmxj5o680000001680018484890,WOXEN ,Men Slim Fit Solid Slim Collar Casual Shirt,₹399,3.9,390,53,colour is very bright and sleek the design is also unique and good looking the fabric used is great which feels good on skin beutiful shirt very comfortable and softfitting very well price range affordablevalue for money nice product that looks very nice the material is very soft  and comfortable the size is also comfortable,Flipkart,https://rukminim1.flixcart.com/image/832/832/xif0q/shirt/d/h/o/m-wx-d-pocket-102-black-woxen-original-imagmb2f4ehhyhjn.jpeg?q=70,4.5941,0.0020122529570235207
112,https://www.snapdeal.com/product/dennis-lingo-green-100-cotton/7061644860802004111#bcrumbLabelId:2946,Dennis Lingo,Burgundy 100% Cotton Slim Fit Men's Casual Shirt ( Pack of 1 ),699,3.5,22,1,बहुत सुन्दर है,Snapdeal,https://n4.sdlcdn.com/imgs/k/l/j/Dennis-Lingo-Burgundy-100-Cotton-SDL960596162-1-ba669.jpg,0.0,0.0018985550270285197
140,https://www.snapdeal.com/product/gespo-cotton-blend-mustard-shirt/679003926404,GESPO,Mustard Cotton Blend Regular Fit Men's Casual Shirt (Pack of 1),499,3.9,19,0,,Snapdeal,https://n3.sdlcdn.com/imgs/k/i/6/GESPO-Mustard-Cotton-Blend-Regular-SDL631975096-1-8b88f.jpg,0.0,0.0018270510065300427
130,https://www.snapdeal.com/product/comey-blue-cotton-regular-fit/8070451213733431528,Comey,Black 100% Cotton Slim Fit Men's Casual Shirt ( Pack of 1 ),560,4.3,14,0,,Snapdeal,https://n3.sdlcdn.com/imgs/k/j/1/Comey-Black-Cotton-Regular-Fit-SDL180992179-1-06837.jpg,0.0,0.0014843248393132061
125,https://www.snapdeal.com/product/yha-100-percent-cotton-grey/8070451193647994503,YHA,Light Blue Cotton Regular Fit Men's Casual Shirt ( Pack of 1 ),575,4.3,13,1,shirt for men,Snapdeal,https://n2.sdlcdn.com/imgs/k/k/i/YHA-Light-Blue-Cotton-Regular-SDL784994235-1-db754.jpg,0.0,0.0013783016365051203
39,https://www.amazon.in/Classic-Polo-Regular-Collar-T-Shirt/dp/B095CN1PQB/ref=pd_rhf_d_ee_s_pd_crcd_sccl_1_2/258-1229559-2740407?pd_rd_w=1UIH6&content-id=amzn1.sym.dcf9b861-ea71-4cd9-870f-f1d20747f687&pf_rd_p=dcf9b861-ea71-4cd9-870f-f1d20747f687&pf_rd_r=3HHKWE70JKEG3EH54D3R&pd_rd_wg=KojdB&pd_rd_r=2975f770-6846-436e-b667-6275f55f9731&pd_rd_i=B09FX26J51&psc=1,Classic Polo,Men's Regular Fit Polo Collar Half Sleeve Solid Cotton Blend,₹799,4.0,391,28,t shirt lavender colour recd a shade darker than shown in product image packing extremely poor for a courier dispatch t shirt not ironed well\npriced a bit too high but i purchased it as i have used classic polo t shirts in the past and found them to be comfortable  durable value for money quality is not good for the price most disappointed pl dont try to buy it was not properly ironed ok i received this package without price tagplease accept my return request must buy the product is of different colour it is true lilac colour not this pale lilac but anyway my brother liked it he said its comfortable and he wore it the whole day it has bit higher prize but thats okay i guess like in pictures it is shown with pocket but received one doesnt have pocket,Amazon,https://m.media-amazon.com/images/I/71kFf-vl23S._UX522_.jpg,3.4671000000000003,0.0012744986173511392
137,https://www.snapdeal.com/product/gritstones-yellow-cotton-blend-regular/6917529693817842836,Gritstones,Yellow Cotton Blend Regular Fit Men's Casual Shirt ( Pack of 1 ),495,4.0,12,0,,Snapdeal,https://n1.sdlcdn.com/imgs/k/l/b/Gritstones-Yellow-Cotton-Blend-Regular-SDL804749825-1-1f1c9.jpg,0.0,0.0011835148220437526
124,https://www.snapdeal.com/product/codaisy-blue-denim-regular-fit/669186860234,codaisy,Blue Denim Regular Fit Men's Casual Shirt ( Pack of 1 ),749,4.1,11,0,,Snapdeal,https://n4.sdlcdn.com/imgs/k/m/l/codaisy-Blue-Denim-Regular-Fit-SDL223380000-1-6f5e3.jpg,0.0,0.0011120108015452755
67,http://flipkart.com/roadster-men-solid-casual-black-shirt/p/itm0dae4f91dbdc2?pid=SHTFRVP9TCEHAUSX&lid=LSTSHTFRVP9TCEHAUSXHAJ9IF&marketplace=FLIPKART&store=clo%2Fash%2Faxc%2Fmmk%2Fkp7&srno=b_1_28&otracker=browse&fm=organic&iid=en_67IMY6lkWg4MQ%2FLCPci9JRynXFwNcU1mPWolGpfVL5QJMJn0hKCEgSxdtHff%2Fmf3GvHA0SMXcBkN%2BQmIdZ9ejw%3D%3D&ppt=None&ppn=None&ssid=1azmxj5o680000001680018484890,Roadster ,Men Regular Fit Solid Casual Shirt  (Pack of 2),"₹1,154",4.0,266,31,clothes and colour is good but shirt coller very bad according to this price tag product are good but you should have to go for better option that my personal suggestion to us  nice shirt good fabric and same product thanku flipkart,Flipkart,https://rukminim1.flixcart.com/image/832/832/ka9ytu80/shirt/u/s/x/38-10863004-roadster-original-imafrvvkzxcdzpdh.jpeg?q=70,1.6408,0.0007883668135804166
33,https://www.amazon.in/GESPO-Mandarin-Collar-Sleeve-Casual/dp/B09WKCNF44/ref=zg_bs_1968094031_sccl_34/258-1229559-2740407?psc=1,GESPO,Men's Solid Multicolor Mandarin Collar Half Sleeve Casual Shirt,₹299,3.7,243,24,nice shirtperfect fittingworth buying fits perfectly if youre thinking of buying it then go forward size fits well and fabric is comfortable to wear bad product quality is very poor quality compramised nice cloth and fittings are perfect as shown in image decent quality but if you have big workout arms then it’s tight quality of fabric is good very poor product 😞,Amazon,https://m.media-amazon.com/images/I/71QioaNf72L._UY550_.jpg,1.3035999999999994,0.0006055580904572246
47,http://flipkart.com/blive-men-color-block-casual-white-black-shirt/p/itmdbd2168a07855?pid=SHTGHBHGW7BCGGEN&lid=LSTSHTGHBHGW7BCGGENDK90SQ&marketplace=FLIPKART&store=clo%2Fash%2Faxc%2Fmmk%2Fkp7&srno=b_1_8&otracker=browse&fm=organic&iid=en_67IMY6lkWg4MQ%2FLCPci9JRynXFwNcU1mPWolGpfVL5TT0h95MYXE08QpZblDbo8bh6Cs9a5SOCcIEpAWAJ5Fuw%3D%3D&ppt=None&ppn=None&ssid=1azmxj5o680000001680018484890,BLIVE ,Men Regular Fit Color Block Ribbed Collar Casual Shirt,₹399,4.0,217,14,nice like this product this product amazing thanks,Flipkart,https://rukminim1.flixcart.com/image/832/832/xif0q/shirt/q/x/3/xs-bblwthdshirtful-sr8-blive-original-imaghbhbqvcyjxub.jpeg?q=70,1.8089999999999997,0.0005593239207613923
63,http://flipkart.com/blive-men-color-block-casual-white-black-shirt/p/itm9cd32ea3c0bfe?pid=SHTGG8DWVGHGWTAX&lid=LSTSHTGG8DWVGHGWTAXTIBXPZ&marketplace=FLIPKART&store=clo%2Fash%2Faxc%2Fmmk%2Fkp7&srno=b_1_24&otracker=browse&fm=organic&iid=en_67IMY6lkWg4MQ%2FLCPci9JRynXFwNcU1mPWolGpfVL5TtGZlLHGnKerR%2FW9C6n3HxNx%2BieZE5nVCsH%2BpknGEHSA%3D%3D&ppt=None&ppn=None&ssid=1azmxj5o680000001680018484890,BLIVE ,Men Regular Fit Color Block Casual Shirt,₹314,3.7,142,13,awesome colour design fabric fantastic please take it and just try it good good,Flipkart,https://rukminim1.flixcart.com/image/832/832/l5ld8y80/shirt/6/p/q/l-bblwtshirtful-sr5-blive-original-imagg8ddhc3zrc8e.jpeg?q=70,2.3813,0.00041956689309249906
24,https://www.amazon.in/Lymio-Casual-Stylish-Printed-Big/dp/B0BWS5T97H/ref=zg_bs_1968094031_sccl_25/258-1229559-2740407?psc=1,Lymio,Casual Shirt for Men|| Shirt for Men|| Men Stylish Shirt || Men Printed Shirt (Big Pan),₹349.,4.2,11,8,the product color was not the same as shown in product description however it was still pretty good good fitting overall i would suggest you go with one size smaller than your actual size if you are aiming for a completely fit shirt nic fitting nal good quality its very nice\ni like it perfect shirt for beach and party wear product quality is good and i have loose so i return product but quality is good better than expected this is an amazing shirt and the fit is perfect best product nice product,Amazon,https://m.media-amazon.com/images/I/71b6grXX5sL._UY550_.jpg,7.0917,0.000316880852717568
133,https://www.snapdeal.com/product/surt-black-cotton-blend-slim/6917529657011673782,SU,- Blue Cotton Blend Slim Fit Men's Casual Shirt ( Pack of 1 ),699,3.7,3,0,,Snapdeal,https://n3.sdlcdn.com/imgs/k/m/k/SUR-T-Blue-Cotton-Blend-SDL915158772-1-0cf6f.jpeg,0.0,0.0002736878025976178
79,http://flipkart.com/flying-machine-men-solid-casual-blue-shirt/p/itm712846e76bb73?pid=SHTGFFHJNGD7GVKH&lid=LSTSHTGFFHJNGD7GVKHV7RQTY&marketplace=FLIPKART&store=clo%2Fash%2Faxc%2Fmmk%2Fkp7&srno=b_1_40&otracker=browse&fm=organic&iid=en_67IMY6lkWg4MQ%2FLCPci9JRynXFwNcU1mPWolGpfVL5RSc0bQm356Tspu6UNCdtGAZZHDmNvDqGS31QWikr6YDw%3D%3D&ppt=None&ppn=None&ssid=1azmxj5o680000001680018484890,FLYING MACHINE ,Men Regular Fit Solid Spread Collar Casual Shirt,₹859,4.0,182,9,worst of product money waste and my time cheap fabric loose collars worth buying go for it 🔥🔥🔥,Flipkart,https://rukminim1.flixcart.com/image/832/832/l41n2q80/shirt/0/d/w/l-fmsht0457-flying-machine-original-imagffhjuymqfspq.jpeg?q=70,-1.8734000000000002,0.0002715967579129748
59,http://flipkart.com/peter-england-university-men-printed-casual-blue-shirt/p/itmae6609e2bf0b2?pid=SHTGDTMKZJVD9Q3A&lid=LSTSHTGDTMKZJVD9Q3ATHHPNL&marketplace=FLIPKART&store=clo%2Fash%2Faxc%2Fmmk%2Fkp7&srno=b_1_20&otracker=browse&fm=organic&iid=en_67IMY6lkWg4MQ%2FLCPci9JRynXFwNcU1mPWolGpfVL5RVaHgKfGYE1vokv19kOzic1oL9SmlEBEhLyXJ7ufBFxA%3D%3D&ppt=None&ppn=None&ssid=1azmxj5o680000001680018484890,Peter England University ,Men Super Slim Fit Printed Spread Collar Casual Shirt,"₹1,049",4.1,147,11,color is very differentworst dull color good bad quality,Flipkart,https://rukminim1.flixcart.com/image/832/832/xif0q/shirt/8/m/d/40-pusfussfr74721-peter-england-university-original-imaghyhmtn3rrree.jpeg?q=70,-0.5038,0.00026848232710319756
71,http://flipkart.com/flying-machine-men-printed-casual-multicolor-shirt/p/itmdf5922e4d65ed?pid=SHTGHZ2RV92BTKNZ&lid=LSTSHTGHZ2RV92BTKNZK8C2SV&marketplace=FLIPKART&store=clo%2Fash%2Faxc%2Fmmk%2Fkp7&srno=b_1_32&otracker=browse&fm=organic&iid=en_67IMY6lkWg4MQ%2FLCPci9JRynXFwNcU1mPWolGpfVL5TPirtko6ASDQN6d%2F1f5V%2FgVBJK1%2BWh%2BS7ChEZEHqig3A%3D%3D&ppt=None&ppn=None&ssid=1azmxj5o680000001680018484890,FLYING MACHINE ,Men Regular Fit Printed Spread Collar Casual Shirt,₹639,4.3,85,8,good suprb quality must buy,Flipkart,https://rukminim1.flixcart.com/image/832/832/xif0q/shirt/d/a/j/m-fmshto0951-flying-machine-original-imagggresqczh4xb.jpeg?q=70,0.4404,0.00019850316770759544
123,https://www.snapdeal.com/product/maharaja-white-polyester-slim-fit/665357262457,Maharaja,White Polyester Slim Fit Men's Casual Shirt ( Pack of 1 ),625,5.0,1,0,,Snapdeal,https://n2.sdlcdn.com/imgs/k/l/h/Maharaja-White-Polyester-Slim-Fit-SDL078732123-1-a0e3a.jpg,0.0,0.0001232827939628909
102,https://www.snapdeal.com/product/urban-mark-navy-cotton-regular/677916418902#bcrumbLabelId:2946,UrbanMark Men 100% Cotton Full Sleeves Regular Fit Abstract Print Casual Shir,avy,349,5.0,1,0,,Snapdeal,https://n3.sdlcdn.com/imgs/k/k/v/UrbanMark-Navy-Cotton-Regular-Fit-SDL971002159-1-7b14e.jpg,0.0,0.0001232827939628909
143,https://www.snapdeal.com/product/made-in-the-shade-black/626384195080,Made In The Shade,Black Cotton Regular Fit Men's Casual Shirt ( Pack of 1 ),575,5.0,1,0,,Snapdeal,https://n1.sdlcdn.com/imgs/k/j/y/Made-In-The-Shade-Black-SDL124334547-1-f09ba.jpg,0.0,0.0001232827939628909
51,http://flipkart.com/tripr-men-solid-casual-black-shirt/p/itm41eff72acefd5?pid=SHTGMNDHFMZDQCXQ&lid=LSTSHTGMNDHFMZDQCXQEU9GZR&marketplace=FLIPKART&store=clo%2Fash%2Faxc%2Fmmk%2Fkp7&srno=b_1_12&otracker=browse&fm=organic&iid=en_67IMY6lkWg4MQ%2FLCPci9JRynXFwNcU1mPWolGpfVL5RRYEJD8wfMW1Yl8QMawL1EbCGrWK6paLbNXxYppg227A%3D%3D&ppt=None&ppn=None&ssid=1azmxj5o680000001680018484890,TRIPR ,Men Regular Fit Solid Mandarin Collar Casual Shirt,₹373,4.0,56,0,,Flipkart,https://rukminim1.flixcart.com/image/832/832/xif0q/shirt/v/a/7/xl-tblshirthenful-sh55-tripr-original-imagmndh5e9mgzwh.jpeg?q=70,0.0,0.00011046138339075024
