index,url,brand,name,price,stars,num_ratings,num_reviews,reviews,platform,image,vader_score,final_score
42,http://flipkart.com/surhi-men-checkered-casual-grey-shirt/p/itm0f168b89ba37a?pid=SHTFT97HQAMTKYJE&lid=LSTSHTFT97HQAMTKYJE32E0KC&marketplace=FLIPKART&store=clo%2Fash%2Faxc%2Fmmk%2Fkp7&spotlightTagId=BestsellerId_clo%2Fash%2Faxc%2Fmmk%2Fkp7&srno=b_1_3&otracker=browse&fm=organic&iid=eefc1ef4-eb75-4d8e-8288-6015d23c7a67.SHTFT97HQAMTKYJE.SEARCH&ppt=None&ppn=None&ssid=1azmxj5o680000001680018484890,Surhi ,Men Slim Fit Checkered Spread Collar Casual Shirt,₹349,3.8,176546,18580,very nice shirt happy nice as better as expected👍👍,Flipkart,https://rukminim1.flixcart.com/image/832/832/xif0q/shirt/o/p/0/5xl-pk19sh09g-surhi-original-imaft8vgvhmhbhsy.jpeg?q=70,1.8552999999999997,0.5095240593595862
46,http://flipkart.com/pepzo-men-striped-casual-red-shirt/p/itm841b09ef732d0?pid=SHTFYUQXZCFVDZUK&lid=LSTSHTFYUQXZCFVDZUKDXIJGV&marketplace=FLIPKART&store=clo%2Fash%2Faxc%2Fmmk%2Fkp7&srno=b_1_7&otracker=browse&fm=organic&iid=eefc1ef4-eb75-4d8e-8288-6015d23c7a67.SHTFYUQXZCFVDZUK.SEARCH&ppt=None&ppn=None&ssid=1azmxj5o680000001680018484890,Pepzo ,Men Regular Fit Striped Spread Collar Casual Shirt,₹279,3.8,161910,13717,nice shirt this product is super good,Flipkart,https://rukminim1.flixcart.com/image/832/832/kxxl9jk0/shirt/9/a/m/xl-vx-db-red-voroxy-original-imagaa4yshwvnhsm.jpeg?q=70,1.4613,0.40731127186509264
62,http://flipkart.com/vebnor-men-solid-casual-maroon-shirt/p/itm888dc158ad656?pid=SHTFXW9K9688TXCB&lid=LSTSHTFXW9K9688TXCBMMDIDT&marketplace=FLIPKART&store=clo%2Fash%2Faxc%2Fmmk%2Fkp7&srno=b_1_23&otracker=browse&fm=organic&iid=eefc1ef4-eb75-4d8e-8288-6015d23c7a67.SHTFXW9K9688TXCB.SEARCH&ppt=None&ppn=None&ssid=1azmxj5o680000001680018484890,VeBNoR ,Men Regular Fit Solid Spread Collar Casual Shirt,₹329,4.0,115501,12089,nice product nice product nice shirt,Flipkart,https://rukminim1.flixcart.com/image/832/832/l1pc3gw0/shirt/c/i/t/l-st2-vebnor-original-imagd7b7aeybhxvs.jpeg?q=70,1.2645,0.30707163330362214
50,http://flipkart.com/qlonz-store-men-solid-casual-white-shirt/p/itmfh6jvdpnja43f?pid=SHTFH66SFEXGQRRW&lid=LSTSHTFH66SFEXGQRRW3HJJPZ&marketplace=FLIPKART&store=clo%2Fash%2Faxc%2Fmmk%2Fkp7&srno=b_1_11&otracker=browse&fm=organic&iid=eefc1ef4-eb75-4d8e-8288-6015d23c7a67.SHTFH66SFEXGQRRW.SEARCH&ppt=None&ppn=None&ssid=1azmxj5o680000001680018484890,Qlonz store ,Men Regular Fit Solid Mandarin Collar Casual Shirt,₹289,3.9,56893,4242,excellent 😍 good product 😊😊 very good products 👌,Flipkart,https://rukminim1.flixcart.com/image/832/832/xif0q/shirt/h/2/a/s-double-shirt-foramal-qlonz-store-original-imafh87megng23cb-bb.jpeg?q=70,3.5412999999999997,0.18729000609838503
44,http://flipkart.com/tanip-men-checkered-casual-light-blue-shirt/p/itmea0b8aa531675?pid=SHTGGUZDTSGJWMVM&lid=LSTSHTGGUZDTSGJWMVMLJ7U4S&marketplace=FLIPKART&store=clo%2Fash%2Faxc%2Fmmk%2Fkp7&srno=b_1_5&otracker=browse&fm=organic&iid=eefc1ef4-eb75-4d8e-8288-6015d23c7a67.SHTGGUZDTSGJWMVM.SEARCH&ppt=None&ppn=None&ssid=1azmxj5o680000001680018484890,Tanip ,Men Slim Fit Checkered Spread Collar Casual Shirt,₹279,3.8,50264,4443,nice shirt thank you filipkart 🥰 its mor comfortable to this price rangethanks to flipkart for fasting delivery im very happy with flipkartthanks filpkart,Flipkart,https://rukminim1.flixcart.com/image/832/832/xif0q/shirt/h/m/a/3xl-dt-shirt1314-darkage-original-imagguzdmwp6wspz.jpeg?q=70,2.6726,0.15574448442720018
66,http://flipkart.com/try-men-color-block-casual-white-black-shirt/p/itm60628958d25f3?pid=SHTFNNJGGBMUHWJP&lid=LSTSHTFNNJGGBMUHWJP8RSFY2&marketplace=FLIPKART&store=clo%2Fash%2Faxc%2Fmmk%2Fkp7&srno=b_1_27&otracker=browse&fm=organic&iid=eefc1ef4-eb75-4d8e-8288-6015d23c7a67.SHTFNNJGGBMUHWJP.SEARCH&ppt=None&ppn=None&ssid=1azmxj5o680000001680018484890,Try This ,Men Slim Fit Color Block Spread Collar Casual Shirt,₹314,3.9,48747,4766,fantastic product its lovely ❤️😍😍 better,Flipkart,https://rukminim1.flixcart.com/image/832/832/xif0q/shirt/p/d/k/xl-bss-try-this-original-imafvvae4ghhy5pd-bb.jpeg?q=70,2.3021,0.15062695104187446
53,http://flipkart.com/fubar-men-striped-casual-maroon-shirt/p/itm2273aa6b645c3?pid=SHTFD6ZAFZZK2TQF&lid=LSTSHTFD6ZAFZZK2TQFXUAAR4&marketplace=FLIPKART&store=clo%2Fash%2Faxc%2Fmmk%2Fkp7&srno=b_1_14&otracker=browse&fm=organic&iid=eefc1ef4-eb75-4d8e-8288-6015d23c7a67.SHTFD6ZAFZZK2TQF.SEARCH&ppt=None&ppn=None&ssid=1azmxj5o680000001680018484890,FUBAR ,Men Slim Fit Striped Mandarin Collar Casual Shirt,₹399,3.9,55367,5071,osm quality nice productsthanks for flipkart nice shirt with good quality,Flipkart,https://rukminim1.flixcart.com/image/832/832/xif0q/shirt/k/n/i/l-skcsh-1106-mao-fubar-original-imafycz5hpfmhhyp-bb.jpeg?q=70,1.2833999999999999,0.14021954887552104
77,http://flipkart.com/icome-men-striped-casual-multicolor-shirt/p/itm8aa7cc55aaf80?pid=SHTGFBT8QZYTJACZ&lid=LSTSHTGFBT8QZYTJACZ85ITKZ&marketplace=FLIPKART&store=clo%2Fash%2Faxc%2Fmmk%2Fkp7&srno=b_1_38&otracker=browse&fm=organic&iid=eefc1ef4-eb75-4d8e-8288-6015d23c7a67.SHTGFBT8QZYTJACZ.SEARCH&ppt=None&ppn=None&ssid=1azmxj5o680000001680018484890,icome ,Men Regular Fit Striped Casual Shirt,₹289,4.1,35845,4048,cloth quality is good soft nd silky super shirtloved it ❤️ one of the most beautifull shirts i have  comfortable and the best fabric used  its bit shiny but that give it a very amoozing look  fabric is really up to the mark  nice dress fits very well👍,Flipkart,https://rukminim1.flixcart.com/image/832/832/xif0q/shirt/t/l/2/xl-men-regular-super-slim-fit-striped-casual-shirt-icome-original-imagf9q2epye5kks-bb.jpeg?q=70,2.8820000000000006,0.1329492549964536
48,http://flipkart.com/fubar-men-washed-casual-maroon-shirt/p/itmfb6zyffczwpyv?pid=SHTFB6HC6UQHHCSH&lid=LSTSHTFB6HC6UQHHCSHGBKGVH&marketplace=FLIPKART&store=clo%2Fash%2Faxc%2Fmmk%2Fkp7&srno=b_1_9&otracker=browse&fm=organic&iid=eefc1ef4-eb75-4d8e-8288-6015d23c7a67.SHTFB6HC6UQHHCSH.SEARCH&ppt=None&ppn=None&ssid=1azmxj5o680000001680018484890,FUBAR ,Men Slim Fit Washed Mandarin Collar Casual Shirt,₹399,3.8,56347,5544,decent quality at this price u can replace button to black for osm looks really nice product good quality,Flipkart,https://rukminim1.flixcart.com/image/832/832/ku4ezrk0/shirt/t/j/e/xl-sksh-bb110-xl-ma3-fubar-original-imag7baxs7pp5yuq.jpeg?q=70,0.8619,0.13035890539591743
12,https://www.amazon.in/Dennis-Lingo-Plain-Casual-C301_Black_Medium/dp/B0713QPGCF/ref=zg_bs_1968094031_sccl_13/258-1229559-2740407?psc=1,Dennis Lingo,Men's Solid Slim Fit Casual Shirt,₹599,3.9,11610,2006,overall its ok  cloth quality is good but talk about packaging its in bad shape packed and my shirts shoulder is tiny tite but its ok for me fabric 100 cotton colour and fitting is good at 460 it worth the money overall good\ndoesnt feel like 100cotton\ncompany should write 100 cotton inside shirtbut only on tag is mentioned  fabric is nice and comfortable good product the fitting and everything is best in the shirt as per the price range but this product isnt 100 cotton as mentioned above although it is a blend of polyester comfortable and fit\ngood product it was a gift for my dad n when he wore it it was looking good on him😍and he was happybut packaging was poor and should be packed decently they just rolled up the shirt n packed in one plastic n handed me the parcel definitely a worthy purchase i am not sure weather its 100 cotton as they say but feels quite comfortable and of decent quality even the fitting was precise as i order s size perfect body fit for me\nso this dennis lingo shirt is a good choice but choose the colour wisely it will fade after 2 or 3 regular washes  go for your regular wearing size fabric quality is nice at first look but very thin fabric and also non stretchable fit is ok but sleeve and angle size is bit low its tight for me all other chest and all ok nice fit i returned because of that sleeve is too much tight on rolledup,Amazon,https://m.media-amazon.com/images/I/61qcnAHZP3L._UX522_.jpg,10.251200000000003,0.12892859537212933
148,https://www.snapdeal.com/product/life-roads-100-percent-cotton/6341068894002727105,Life Roads,Black Cotton Slim Fit Men's Casual Shirt ( Pack of 1 ),675,3.9,775,28,quality nice product mast shirt nice shirt excellent perfect fit delivery was late product is ok great product and good deal super quality good shirt,Snapdeal,https://n1.sdlcdn.com/imgs/k/j/v/Life-Roads-Black-Cotton-Slim-SDL415131560-1-001fd.jpg,4.749099999999999,0.10899048698962263
52,http://flipkart.com/tanip-men-solid-casual-white-shirt/p/itmd7ac59f3558d1?pid=SHTG9UJFZUXZ7MKF&lid=LSTSHTG9UJFZUXZ7MKFYOJEYX&marketplace=FLIPKART&store=clo%2Fash%2Faxc%2Fmmk%2Fkp7&srno=b_1_13&otracker=browse&fm=organic&iid=eefc1ef4-eb75-4d8e-8288-6015d23c7a67.SHTG9UJFZUXZ7MKF.SEARCH&ppt=None&ppn=None&ssid=1azmxj5o680000001680018484890,Tanip ,Men Slim Fit Solid Spread Collar Casual Shirt,₹329,3.9,32399,2597,looking for good good product 👍 👍 looking awesome  delivery boy also good 😊 thanku flipkart 😊,Flipkart,https://rukminim1.flixcart.com/image/832/832/kxdl3m80/shirt/a/7/a/l-ts-shirt1083-tanip-original-imag9ugfzkdhprzn.jpeg?q=70,3.3829,0.10785223950571367
18,https://www.amazon.in/Dennis-Lingo-Solid-Casual-CC201_Dustypink_M_Dustypink_M/dp/B07HK6NT81/ref=zg_bs_1968094031_sccl_19/258-1229559-2740407?psc=1,Dennis Lingo,Men Casual Shirts,₹499,4.0,14631,2411,colour is slightly more pinkish than shown in the image its not the mauve colour like in the image good product quality of material is good colour is little bit faded but looks good the shirt is not properly stitched nearby chest area i am happy with the shirt as it was perfectly fit to the person i gifted also the quality of the product was also good hey folks if you ordering this product plz order one size smaller its biggy worth the money its not good for long run product quality is great but fit at waist area replaced with next size quality is not good,Amazon,https://m.media-amazon.com/images/I/61YQd1wdQBL._UY550_.jpg,5.863200000000001,0.10213975098740646
0,https://www.amazon.in/Dennis-Lingo-Solid-Casual-C301_Dustypink_M_Dustypink_M/dp/B07HK7B2PQ/ref=zg_bs_1968094031_sccl_1/258-1229559-2740407?psc=1,Dennis Lingo,Men's Solid Slim Fit Cotton Casual Shirt with Spread Collar & Full Sleeves,₹575,3.8,29879,3025,it s a bit difficult to iron gets wrinkled but worth the money 100 cotton as expected good colour and well fitted black and bottle green—460₹ each but the dusty orange one 414₹ is not made of 100 cotton its fabric was bad so i returned that one very good product value for money my height us 5qq and weight is 68 so i ordered size l and i think it is proper for me only thing i felt bad is its apple cut doesnt match at buttons part and also last button is not given as per shirts lenght gud nice quality\ngood product quality is good but its not cotton its polyester cloth nice looking and comfortable shirt only con is that it looks wrinkled after being worn for few hours good product,Amazon,https://m.media-amazon.com/images/I/618Wek95laS._UY550_.jpg,2.3985,0.09360140580907106
20,https://www.amazon.in/Dennis-Lingo-Plain-Casual-C201_Black_Medium/dp/B0158FJW4G/ref=zg_bs_1968094031_sccl_21/258-1229559-2740407?psc=1,Dennis Lingo,Men's Solid Chinese Collar Casual Shirt,₹575,3.9,15074,3223,play video good soft nice shirt ❤️ good worth for money its so comfortable to wear value for money xl is very large 44 size right fit very good,Amazon,https://m.media-amazon.com/images/I/514KfWLx9wL._UX522_.jpg,3.5208,0.08781437238211377
60,http://flipkart.com/plus91-men-graphic-print-casual-black-shirt/p/itm7dd7bcdaad809?pid=SHTG4DVYREGVGFYH&lid=LSTSHTG4DVYREGVGFYHAHCGBP&marketplace=FLIPKART&store=clo%2Fash%2Faxc%2Fmmk%2Fkp7&srno=b_1_21&otracker=browse&fm=organic&iid=eefc1ef4-eb75-4d8e-8288-6015d23c7a67.SHTG4DVYREGVGFYH.SEARCH&ppt=None&ppn=None&ssid=1azmxj5o680000001680018484890,Plus91 ,Men Slim Fit Graphic Print Ribbed Collar Casual Shirt,₹379,4.0,35545,2142,good products very nice very nice 👍,Flipkart,https://rukminim1.flixcart.com/image/832/832/xif0q/shirt/5/f/u/s-p1-sht-hood-geographical-plus91-original-imag4dvycrmpz22p-bb.jpeg?q=70,1.2833999999999999,0.08436400253548526
5,https://www.amazon.in/Amazon-Brand-Inkast-S-02C_Medium-Grey_Medium/dp/B07GSL2C7V/ref=zg_bs_1968094031_sccl_6/258-1229559-2740407?psc=1,Amazon Brand - Inkast Denim Co.,Men Casual Shirt,₹700,4.0,15995,1909,shirt is good fit as per expectation and quality is also upto the mark as per the price also color is not very dull and gives good contrast with white pants quality is good but color could be little bright value for money very good quantity like nice little bit fitting issues material is good rest depend after wash about colour excellent👍 overall this shirt is good good,Amazon,https://m.media-amazon.com/images/I/71ssF1s7V1L._UY550_.jpg,5.1771,0.08278290833533798
2,https://www.amazon.in/Allen-Solly-Geometric-Regular-ASSFWMOFO48848_White_44/dp/B07DMQRD6H/ref=zg_bs_1968094031_sccl_3/258-1229559-2740407?psc=1,Allen Solly,Men's Slim Fit Shirt,₹759,3.7,12278,1788,it gives comfort the quality is good and really it is value for money it fits well  but the quality could have given better too large good product quality material but sleeve circumference is a bit big if you are slim i brought it to gift my friend he really likes it like product was good but the packaging was very very bad blue is my favorite color i liked this shirt very much in this price range shirt is made of cotton material good to wear and good for casual wearing to put on this clothes size is little bit smaller,Amazon,https://m.media-amazon.com/images/I/71T3EQknkBL._UY550_.jpg,5.874100000000001,0.0768476175796112
45,http://flipkart.com/surhi-men-checkered-casual-grey-shirt/p/itm371e267caab8a?pid=SHTGAHWHMZUQZYCC&lid=LSTSHTGAHWHMZUQZYCCI7LP8J&marketplace=FLIPKART&store=clo%2Fash%2Faxc%2Fmmk%2Fkp7&srno=b_1_6&otracker=browse&fm=organic&iid=eefc1ef4-eb75-4d8e-8288-6015d23c7a67.SHTGAHWHMZUQZYCC.SEARCH&ppt=None&ppn=None&ssid=1azmxj5o680000001680018484890,Surhi ,Men Slim Fit Checkered Spread Collar Casual Shirt,₹349,3.7,30349,1781,excellent 🔥nice product 👌🏻🔥 excellent product ❤️❤️✨,Flipkart,https://rukminim1.flixcart.com/image/832/832/l2z26q80/shirt/b/v/w/m-pk19sh786e-surhi-original-image77wzjmhwyty.jpeg?q=70,2.0385999999999997,0.07419556865244283
61,http://flipkart.com/vebnor-men-solid-casual-light-green-shirt/p/itm2dbe1675ce9df?pid=SHTFZH58WTMMUHQD&lid=LSTSHTFZH58WTMMUHQDPSHFQS&marketplace=FLIPKART&store=clo%2Fash%2Faxc%2Fmmk%2Fkp7&srno=b_1_22&otracker=browse&fm=organic&iid=eefc1ef4-eb75-4d8e-8288-6015d23c7a67.SHTFZH58WTMMUHQD.SEARCH&ppt=None&ppn=None&ssid=1azmxj5o680000001680018484890,VeBNoR ,Men Regular Fit Solid Mandarin Collar Casual Shirt,₹329,4.0,17532,1820,awesome looks great and i really liked it shirt fabric is really awsm fitting,Flipkart,https://rukminim1.flixcart.com/image/832/832/xif0q/shirt/4/o/m/xl-st1-vebnor-original-imagn6btezzsp5uf.jpeg?q=70,1.6713,0.05035034676882928
57,http://flipkart.com/voroxy-men-solid-casual-dark-green-shirt/p/itm619a316d45389?pid=SHTGBYE4QNPZ6WFB&lid=LSTSHTGBYE4QNPZ6WFBN9YJNY&marketplace=FLIPKART&store=clo%2Fash%2Faxc%2Fmmk%2Fkp7&srno=b_1_18&otracker=browse&fm=organic&iid=eefc1ef4-eb75-4d8e-8288-6015d23c7a67.SHTGBYE4QNPZ6WFB.SEARCH&ppt=None&ppn=None&ssid=1azmxj5o680000001680018484890,Voroxy ,Men Regular Fit Solid Spread Collar Casual Shirt,₹279,3.7,18726,1675,good product 👍🏻👍🏻👍🏻 nice average stitching quality is not all good,Flipkart,https://rukminim1.flixcart.com/image/832/832/kzogn0w0/shirt/x/1/j/xl-monikat-bottlegreen-voroxy-original-imagbmryqugyygnf.jpeg?q=70,1.3023,0.04547497866895768
117,https://www.snapdeal.com/product/vee-bee-collection-cotton-blend/635125584570#bcrumbLabelId:2946,vee bee collection,Blue Cotton Blend Regular Fit Men's Casual Shirt (Pack of 1),575,3.8,400,7,,Snapdeal,https://n2.sdlcdn.com/imgs/k/i/6/vee-bee-collection-Blue-Cotton-SDL626283735-1-faa15.jpg,0.0,0.03747796936471883
146,https://www.snapdeal.com/product/vida-loca-100-percent-cotton/5188147411741241134,Vida Loca,Mehandi 100% Cotton Slim Fit Men's Casual Shirt ( Pack of 1 ),640,4.1,155,28,excellent good fabric quality shirt excellent shirt 5 stars mind blowing experience comfortable for me 👍 as expected 😍 go for it thanku vida loca jabardast nice fitting and quality fabric,Snapdeal,https://n4.sdlcdn.com/imgs/k/l/3/Vida-Loca-Mehandi-100-Cotton-SDL711263314-1-c9dfd.jpg,2.9751000000000003,0.03726068354771171
19,https://www.amazon.in/Amazon-Brand-Symbol-Regular-AW17MFS21_42_Royal/dp/B073ZJNMFV/ref=zg_bs_1968094031_sccl_20/258-1229559-2740407?psc=1,Amazon Brand - Symbol,Men's Regular Shirt,₹410,3.9,5469,757,the material is soft and comfortable to wear the colour fades away quickly after first or second wash the shirt starts to look old after that maybe other better quality items can be purchased  not entirely happy but if budget is low then this is the quality you will get ok tight in chest material is very good perfect stitching\nfitting also too good👌👌👌 superb quality and perfect fitting\nstitching also too good pls dont cell local items great fit good well done amazon for this product very worst item,Amazon,https://m.media-amazon.com/images/I/91QQX4CQU2L._UY550_.jpg,6.490300000000001,0.03598708935043302
81,http://flipkart.com/moonvelly-men-solid-casual-black-shirt/p/itm86ced1b0213aa?pid=SHTG5M2QVANDNHUR&lid=LSTSHTG5M2QVANDNHUR5QIPTZ&marketplace=FLIPKART&store=clo%2Fash%2Faxc%2Fmmk%2Fkp7&srno=b_2_42&otracker=browse&fm=organic&iid=b9deb022-bd3e-40e8-a8d6-c884435df903.SHTG5M2QVANDNHUR.SEARCH&ppt=None&ppn=None&ssid=uvp7jirsw00000001680018485970,MOONVELLY ,Men Slim Fit Solid Casual Shirt,₹349,3.9,13259,1100,best quality in this price nice quality at at cheap price best quality,Flipkart,https://rukminim1.flixcart.com/image/832/832/xif0q/shirt/w/x/x/m-srt-001-black-moonvelly-original-imaghzu2jqwfw7ap.jpeg?q=70,1.6953,0.035166852209411
17,https://www.amazon.in/Amazon-Brand-Symbol-Regular-AW-SY-MCS-1146_Black/dp/B08JQWD91H/ref=zg_bs_1968094031_sccl_18/258-1229559-2740407?psc=1,Amazon Brand - Symbol,Men Casual Shirt,₹549,3.9,6507,703,cloth quality not good but in this price shirt is good good good i like it only issue i saw when i wear it first time it was tonred from back side and could not returned as i used it  product is too good perfect fitting and good quality make sure of selecting size i assume to place a size more what u generally buys i booked the s size shirt it just perfectly suitable for me the quality of the material is better than any other shirt brands in this price range and just the problem is with its length\ni bought l size which fits perfect with chest area just the shoulder portion is then loose fit seems little bigger good fiting,Amazon,https://m.media-amazon.com/images/I/71K4ZJCCdzL._UY550_.jpg,6.083200000000001,0.03468299729844247
21,https://www.amazon.in/Amazon-Brand-Symbol-Regular-AW-SY-MCS-1127_White/dp/B08JQYLFVK/ref=zg_bs_1968094031_sccl_22/258-1229559-2740407?psc=1,Amazon Brand - Symbol,Men's Regular Casual Shirt,₹559,3.8,6475,745,summer shirt light weight wet quickly by rain excellent the shirt is good and all like it should be but the thing is its collar doesnt stay crisp no matter how much you iron it not a deal breaker exactly but more of an annoyance nice quality comfort to wear good shirt in this price point good at this price rate product is good just wow excellent quality 👌 👏 👍 material is very good but it is so tight it should have mentioned as slim instead of regular good quality and fitting,Amazon,https://m.media-amazon.com/images/I/7140vZ9d5EL._UY550_.jpg,5.657300000000001,0.03398178476407099
14,https://www.amazon.in/Lyriq-Casual-Shirt-Stylish-Printed/dp/B0BRJT2WWN/ref=zg_bs_1968094031_sccl_15/258-1229559-2740407?psc=1,Lyriq,Casual Shirt for Men|| Shirt for Men|| Men Stylish Shirt || Men Printed Shirt,₹398,4.6,623,442,so let me get started on this amazingly simple yet very interesting shirts from lyriq\ni have ordered 45 casual printed shirts from lyriq out of which 3 were amazing and got lots of compliments wearing them and best part is no body believed i got them for under 400₹\nwe’ll remaining 2 out of which one of them was damaged and different product that i originally ordered and the other print quality was terrible but i returned them and got exchanged and refunded for them without any hassle\n\nbest thing is the owner had sent me a handwritten note which was quite touching yet thoughtful for which i am gonna be a customer for life and advise my friends to do so\n\nso please buy from them and share with your friends trust me you won’t regret i really liked the product and the texture im really satisfied with the style but i am not really a huge fan of hard collar when it comes to floral shirts\nother than that im really satisfied and thanks for the note too that was really a good gesture from your side 🙂🙂 i received this damaged sewing beside this im satisfied with the product good product worth it good packaging and good quality shirt is coolworth buyingonly thing its little bit long🤦\n\none more thingthey are sending one letter with cashback if we submit review for their productsbt i havent git that kindly do not do these type of works jst to increase ur reviews🙏🙏 great designs good colours\n\nfabric is smooth and thin need to be careful\nsize fits small in the size mentioned\noverall value for money product\n\nthe handwritten note from the budding entrepreneur raises eyebrows for many packing has impressed me quality looks good rest i need to explore later😂😂❤️ i ordered l size for 42 as per the size chart\nbut still it was somewhere between perfect and too small\nso order one size extra unfortunately amazon did not ship the product properly and this only had one piece in the size i ordered so had to return it but i ordered 4 more different patterns its cool man go to a beach or activity in sun its perfect\n\ni ordered one size larger for a loose fit which is how this should be worn so keep an eye on that xl seems to be the last size wish they had xxl would gift it to my plus sized friends,Amazon,https://m.media-amazon.com/images/I/710Axs3ouUL._UY550_.jpg,14.0108,0.03351559419025585
34,https://www.amazon.in/U-TURN-Cotton-Solid-Sleeve-Shirt/dp/B07HP37T6G/ref=zg_bs_1968094031_sccl_35/258-1229559-2740407?psc=1,U-TURN,Men's Cotton Solid Half Sleeve Shirt,₹378,3.6,5612,669,very gud update\njust make sure u dont wash it too much the shirt looked good fitted okay though it was a bit tight around the armpits but the shock came when it was washed the fabric is made of material that brns under an electric iron its collar ends up as if there is paper or cardboard inside one does not iron it well for fear of burning the fabric good very nice product\ncomfort level is good\ni ordered brown it looks like maroon and looks nice very nice product  quality of cloth is good and stiching is also nice i bought three shirts of different colours all r fine comfort value for money this shirt doesnt look exactly like in the image but it is cotton lot of wrinkles after one wash fabric is fine stitching is class fits comfortably well cost is much less than its value half sleeves gracefully decorated with flap and button however missing front pocket takes away half of its dash does it cost too much advise your supplier for its addition in the future batch,Amazon,https://m.media-amazon.com/images/I/718rD4AqFJL._UY550_.jpg,6.042800000000001,0.030919211936354406
10,https://www.amazon.in/Allen-Solly-Geometric-Regular-ASSFWMOFI31587_White_42/dp/B07DMVHSQ1/ref=zg_bs_1968094031_sccl_11/258-1229559-2740407?psc=1,Allen Solly,Men's Slim Fit Shirt,₹726,3.9,5826,672,perfect in size quality is also good good one 800 rupee k hisab se thik h fabric full cotton h kalaaf lag kar thodi better lagegi its good very good shirt and fitting is appsolute no need to do anything extra just unpack wear and go\n\ndrawback  cotton shirt get very much frizzy mark and need to wash after every single use only little tight perfect size and quality of cloth is super good comfortable in wearing looks classy good stitching i lke that it is soft cotton but fabric quite thin and see through hence not as per my linking\n\nalso seems that their size run is on lower side to me it was tight mind blowing value for money at this price range good product,Amazon,https://m.media-amazon.com/images/I/71PnNitKnwL._UY550_.jpg,5.625400000000001,0.0308009584631495
70,http://flipkart.com/combraided-men-checkered-casual-red-blue-shirt/p/itm47aad3179e46e?pid=SHTG6BX7ZP4SFATW&lid=LSTSHTG6BX7ZP4SFATWKNHZ7J&marketplace=FLIPKART&store=clo%2Fash%2Faxc%2Fmmk%2Fkp7&srno=b_1_31&otracker=browse&fm=organic&iid=eefc1ef4-eb75-4d8e-8288-6015d23c7a67.SHTG6BX7ZP4SFATW.SEARCH&ppt=None&ppn=None&ssid=1azmxj5o680000001680018484890,COMBRAIDED ,Men Slim Fit Checkered Slim Collar Casual Shirt,₹329,3.7,12369,809,super prodact wonder full so nice i love this product,Flipkart,https://rukminim1.flixcart.com/image/832/832/xif0q/shirt/z/j/8/s-600-combraided-original-imagasqbdwrnghfx-bb.jpeg?q=70,1.6578000000000002,0.0295206628866641
