index,url,brand,name,price,stars,num_ratings,num_reviews,reviews,platform,image,vader_score,final_score
22,https://www.amazon.in/Dennis-Lingo-Checkered-Casual-C442_Olive_L/dp/B082G9MWVV/ref=zg_bs_1968094031_sccl_23/258-1229559-2740407?psc=1,Dennis Lingo,"Men's Cotton Buffalo Check Slim Fit Casual Shirt with Pocket, Full Sleeve Shirt for Formal & Casual Wear",₹649,4.1,5389,383,on an honest not i am not happy with the packing it was not up to mark but yes product is good its as shown in the picture thankyou for the timely delivery it fits well nice quality\noverall good product office use as well as party nice one after 2 to 3 wash color will shade 5star i like good quality shirt please go for it shirt quality nd design was awesome the quality of the cloth is good the shirt was little smaller in length  other things are ok if you like to wear a slim fit shirt go for this shirt without any hesitation i would have given 5 star if it was not slim fit,Amazon,https://m.media-amazon.com/images/I/61X9WBQlceL._UX522_.jpg,7.448000000000001,0.025683037508901555
7,https://www.amazon.in/LookMark-Cotton-Digital-Printed-Stitched/dp/B094J7DD35/ref=zg_bs_1968094031_sccl_8/258-1229559-2740407?psc=1,LookMark,Men's Poly Cotton Digital Printed Stitched Half Sleeve Shirt,₹349,3.5,2823,303,shirt is overall good quality is also ok at this price size is also correct but stitching and finishing is not good this needs to be improved threads and multiple stitches seen overall stitching is not great and if this is taken care then it’s a great buy material is good but needed in long sleevestill good product like texture but stitching work not proper the fitting is good i like the product good good the shirt looks really good havent tested if the color will fade so cant comment on that the finishing is not good the threads are hanging from collar sleeves and other parts i guess it wouldnt last long maybe a couple of wears thats it stitching quality can be improved shirt sleeves are too large quality is good but bit loose from shoulders lovely design awesome material cool funky looking and vibrant colours trust me it’s too under priced i would recommend you buy this as soon as you see it in stock before it stocks out  amazing product love it and would definitely buy again from this brand ❤️😍,Amazon,https://m.media-amazon.com/images/I/71cFpnm0b6S._UX522_.jpg,12.709600000000002,0.024835415547072148
68,http://flipkart.com/allan-peter-men-printed-casual-light-blue-shirt/p/itm6d141034dc977?pid=SHTGAK5MQMTYT4DV&lid=LSTSHTGAK5MQMTYT4DVWWMBOO&marketplace=FLIPKART&store=clo%2Fash%2Faxc%2Fmmk%2Fkp7&srno=b_1_29&otracker=browse&fm=organic&iid=eefc1ef4-eb75-4d8e-8288-6015d23c7a67.SHTGAK5MQMTYT4DV.SEARCH&ppt=None&ppn=None&ssid=1azmxj5o680000001680018484890,allan peter ,Men Regular Fit Printed Casual Shirt,₹399,3.9,13473,960,good 👍 nice shart after 2nd wash this shirt became discolour very bad quality dont waste money i am very much disappointed superp quality,Flipkart,https://rukminim1.flixcart.com/image/832/832/xif0q/shirt/0/0/o/l-sws5104-allan-peter-original-imagak5hghdp59yn-bb.jpeg?q=70,-0.5786,0.02303203185121043
96,http://flipkart.com/combraided-men-striped-casual-blue-shirt/p/itm7822071390b6f?pid=SHTG74RYQ8YWSKMZ&lid=LSTSHTG74RYQ8YWSKMZIGUPNU&marketplace=FLIPKART&store=clo%2Fash%2Faxc%2Fmmk%2Fkp7&srno=b_2_57&otracker=browse&fm=organic&iid=b9deb022-bd3e-40e8-a8d6-c884435df903.SHTG74RYQ8YWSKMZ.SEARCH&ppt=None&ppn=None&ssid=uvp7jirsw00000001680018485970,COMBRAIDED ,Men Slim Fit Striped Slim Collar Casual Shirt,₹299,3.8,9907,611,good it was awsm super thank you flipkart,Flipkart,https://rukminim1.flixcart.com/image/832/832/xif0q/shirt/n/j/h/m-200-combraided-original-imagavxewfgzhbb6-bb.jpeg?q=70,1.401,0.023002140522953508
101,https://www.snapdeal.com/product/gritstones-100-percent-cotton-pink/680408447105#bcrumbLabelId:2946,Gritstones,Multicolor Cotton Regular Fit Men's Casual Shirt (Pack of 1 ),329,4.1,227,13,,Snapdeal,https://n3.sdlcdn.com/imgs/k/i/5/Gritstones-Multicolor-Cotton-Regular-Fit-SDL328705855-1-7fd10.jpg,0.0,0.02294785926825251
25,https://www.amazon.in/Amazon-Brand-Inkast-Casual-S-34A_White_Large/dp/B07HH861LQ/ref=zg_bs_1968094031_sccl_26/258-1229559-2740407?psc=1,Amazon Brand - Inkast Denim Co.,Men Casual Shirt,₹629,3.9,3787,438,good clothes fabrics and fitting i got this in 549\nexact size which is written in description\ngreen shirt is good but fitting issue i am of xl but shirt was tight and exchanged the same with 2xl the chest part is not ok otherwise it is good for s size 5 stars i liked this shirt as material color fittings are all awesome and especially the price tag like the fit the fabric is just ok the olive color is actually a shade of dark green  not too pleasant thanks amazon nice product in denim at reasonable price a little tip for average built person not to go for medium size small will be a good fit without getting it fit from tailor gd,Amazon,https://m.media-amazon.com/images/I/71hiYw-SQNL._UY550_.jpg,6.395200000000001,0.02180365824651644
29,https://www.amazon.in/Dennis-Lingo-Checkered-Casual-C415_TEALBLUE_M_Teal/dp/B07D9WDR3X/ref=zg_bs_1968094031_sccl_30/258-1229559-2740407?psc=1,Dennis Lingo,Men's Shirt,₹499,4.0,2733,481,very nice product budget friendly thanks to amazon shirt is good as expected its design  cloth quality also good also good the product was damaged i like it looks good its very delicate to wear good fit good quality materials comfortable and fitting is ok exchange process is delayed while original delivery was fast amazon should take care to enhance the exchange process product is good but colour is not that showed in picture,Amazon,https://m.media-amazon.com/images/I/61GCysaiXgL._UY550_.jpg,6.520400000000001,0.021649067572196208
9,https://www.amazon.in/Lyriq-Casual-Shirt-Stylish-Printed/dp/B0BPMR9TSR/ref=zg_bs_1968094031_sccl_10/258-1229559-2740407?psc=1,Lyriq,Casual Shirt for Men|| Shirt for Men|| Men Stylish Shirt || Men Printed Shirt,₹499,4.4,639,432,typical look but its fine so keeping it\nnot bad as return good fit and good quality overall this product is good but i have to return due to size small but i would love to wear it if its fit on me beautiful and comfortable shirt at this price range shirt quality is nice but i returned as the size was not correcti ordered s but i guess l fits me you need to update the size chart its a bit confusing as per chart i ordered s but actually with your making l fits mei hope good product as advertised fitting and value for money according to price this product is good design and colour combination of strips is awesome which is enhancing look of shirt have used the shirtit has good designgood quality texture and material used \noverall value for the price nice product it has good fitting worth the money,Amazon,https://m.media-amazon.com/images/I/41K8J6J3fUL._UY500_.jpg,8.718000000000002,0.02090976048644465
35,https://www.amazon.in/Amazon-Brand-Shields-Checkered-SS20-HS-RR-01-H_Blue/dp/B084MZXSM8/ref=zg_bs_1968094031_sccl_36/258-1229559-2740407?psc=1,Amazon Brand - House & Shields,Men's Regular Casual Shirt,₹689,3.8,2760,298,just ok have purchased a lot of shirts from house and shields use to lve their quality shirts but recent shirts that i purchased with same size are weird because each 3xl shirt from same brand has size issues like one shirt is tight at the corner and hip one shirt has too long and night sleeves nice color and attractive material also good buttons are not good nice colour cotton shirt at competitive prices online but its not wrinkle free amazon brand house  shields cotton shirt is good comfortable fitting ok colour does not dissipated after 1st wash lemgth is ok stiching also okprice affordable overall good thanks amazon ⭐️⭐️⭐️⭐️⭐️ nice product not so good product amazon return  exchange policy is the best i got exactly what i was looking for black colour shirt didnt fit me well so i exchanged to this navymaroon shirt and it turned out to be better than the previous one,Amazon,https://m.media-amazon.com/images/I/812X4h3Qu+L._UY550_.jpg,8.863100000000001,0.018863551057250877
43,http://flipkart.com/clinch-fashion-men-checkered-casual-grey-shirt/p/itme2a420e04725d?pid=SHTGGCXMBYHCNFYV&lid=LSTSHTGGCXMBYHCNFYVW8LDNR&marketplace=FLIPKART&store=clo%2Fash%2Faxc%2Fmmk%2Fkp7&srno=b_1_4&otracker=browse&fm=organic&iid=eefc1ef4-eb75-4d8e-8288-6015d23c7a67.SHTGGCXMBYHCNFYV.SEARCH&ppt=None&ppn=None&ssid=1azmxj5o680000001680018484890,clinch fashion ,Men Regular Fit Checkered Slim Collar Casual Shirt,₹499,3.8,6409,386,very comfortable and nice quality feeting is awesome gud awesome product ❤️❤️🥰,Flipkart,https://rukminim1.flixcart.com/image/832/832/xif0q/shirt/8/q/n/xl-capkin-collections-clinch-fashion-original-imagmfgxzczh6mkb.jpeg?q=70,2.9892999999999996,0.017991297551582103
97,http://flipkart.com/kuki-men-solid-casual-white-shirt/p/itmf6b56713c83d7?pid=SHTG9Q2AFZKWY9BW&lid=LSTSHTG9Q2AFZKWY9BWVT8ASJ&marketplace=FLIPKART&store=clo%2Fash%2Faxc%2Fmmk%2Fkp7&srno=b_2_58&otracker=browse&fm=organic&iid=b9deb022-bd3e-40e8-a8d6-c884435df903.SHTG9Q2AFZKWY9BW.SEARCH&ppt=None&ppn=None&ssid=uvp7jirsw00000001680018485970,Kuki ,Men Regular Fit Solid Spread Collar Casual Shirt,₹345,3.8,4660,474,beautiful 🥰product always good👍100 very nice😍 good quality,Flipkart,https://rukminim1.flixcart.com/image/832/832/xif0q/shirt/c/c/2/xxl-vh-brother-kuki-original-imag9q2fyezpfyz8-bb.jpeg?q=70,2.6393,0.01521750322302393
141,https://www.snapdeal.com/product/gritstones-turquoise-cotton-blend-regular/4899917061771956028,Gritstones,Grey Melange Cotton Blend Regular Fit Men's Casual Shirt ( Pack of 1 ),469,4.1,97,6,gritstones cotton casual shirt and color is very good and good product excellent exllent nice shirt super good product,Snapdeal,https://n2.sdlcdn.com/imgs/k/h/1/Gritstones-Grey-Melange-Cotton-Blend-SDL997452768-1-5acd9.jpg,3.1163,0.01465223834484934
4,https://www.amazon.in/Lymio-Casual-Shirt-Stylish-Printed/dp/B0BRKHCC5Q/ref=zg_bs_1968094031_sccl_5/258-1229559-2740407?psc=1,Lymio,Casual Shirt for Men|| Shirt for Men|| Men Stylish Shirt || Men Printed Shirt (Patta),₹349,4.4,411,282,it fits perfectly provides plenty of movement and is comfortable to wear all day the fabric is soft and lightweight making it ideal for summer days the color is also beautiful its a good product just the fabric is synthetic based the quality of the product is upto the mark everything was good finishing is to be more attractive product quality is good as expected value for money the material is soft and comfortable and the stitching is well done the fit is just right too i would definitely recommend this shirt to anyone looking for a great wardrobe staple overall the shirt price is reasonable and the quality of the cloth is also fine the stitches could be more better so that for longevity of clothes overall looks good when wore over tshirt👍🏻 very soft and comfortable nice quality 🙂,Amazon,https://m.media-amazon.com/images/I/71On2XSPuRL._UY550_.jpg,9.3267,0.014525961729539166
86,http://flipkart.com/eviqe-men-solid-casual-black-shirt/p/itm7238a2a3a9322?pid=SHTG89X4KMUACGMD&lid=LSTSHTG89X4KMUACGMDBGNZTT&marketplace=FLIPKART&store=clo%2Fash%2Faxc%2Fmmk%2Fkp7&spotlightTagId=TrendingId_clo%2Fash%2Faxc%2Fmmk%2Fkp7&srno=b_2_47&otracker=browse&fm=organic&iid=b9deb022-bd3e-40e8-a8d6-c884435df903.SHTG89X4KMUACGMD.SEARCH&ppt=None&ppn=None&ssid=uvp7jirsw00000001680018485970,EVIQE ,"Men Regular, Slim Fit Solid Spread Collar Casual Shirt",₹359,3.9,5878,374,nice shirt very nice 👌 local shirt,Flipkart,https://rukminim1.flixcart.com/image/832/832/xif0q/shirt/o/t/8/m-classic-formal-eviqe-original-imagfkwpbqqxt3cu-bb.jpeg?q=70,1.5727,0.014353722493610145
88,http://flipkart.com/vebnor-men-printed-casual-light-blue-shirt/p/itm05a8d2551f5be?pid=SHTGJMJJ5JXFGNB3&lid=LSTSHTGJMJJ5JXFGNB3MQCSNT&marketplace=FLIPKART&store=clo%2Fash%2Faxc%2Fmmk%2Fkp7&srno=b_2_49&otracker=browse&fm=organic&iid=b9deb022-bd3e-40e8-a8d6-c884435df903.SHTGJMJJ5JXFGNB3.SEARCH&ppt=None&ppn=None&ssid=uvp7jirsw00000001680018485970,VeBNoR ,Men Regular Fit Printed Spread Collar Casual Shirt,₹259,4.1,3651,379,suparb shirt 👕value for money 💰 superb and nice products thnx flipkart awesome 😎 shirtbest quality,Flipkart,https://rukminim1.flixcart.com/image/832/832/xif0q/shirt/o/r/v/s-st10-vebnor-original-imagmyr8fefzqcbu.jpeg?q=70,2.1301,0.01156668895798285
156,https://www.snapdeal.com/product/life-roads-100-percent-cotton/5764608144136486776,Life Roads,White Cotton Slim Fit Men's Casual Shirt ( Pack of 1 ),675,3.9,103,1,quality good,Snapdeal,https://n2.sdlcdn.com/imgs/k/e/u/Life-Roads-100-Cotton-Slim-SDL653209069-1-98863.jpg,0.4404,0.010018687935315209
152,https://www.snapdeal.com/product/life-roads-100-percent-cotton/652674226757,Life Roads,White Cotton Slim Fit Men's Casual Shirt ( Pack of 1 ),675,4.0,98,5,superrrrr quality it good  confertable quality waste of money,Snapdeal,https://n3.sdlcdn.com/imgs/k/e/z/Life-Roads-100-Cotton-Slim-SDL758891286-1-79cfc.jpg,0.018900000000000028,0.0096898647146239
106,https://www.snapdeal.com/product/yha-100-percent-cotton-orange/6052838574506050940#bcrumbLabelId:2946,YHA,Navy Cotton Regular Fit Men's Casual Shirt ( Pack of 1 ),575,4.2,93,14,,Snapdeal,https://n3.sdlcdn.com/imgs/k/j/f/YHA-Navy-Cotton-Regular-Fit-SDL371787999-1-6caa0.jpg,0.0,0.009630851864381037
74,http://flipkart.com/blive-men-color-block-casual-white-black-shirt/p/itmf7c3c31307d91?pid=SHTGFPPFHUKZENF2&lid=LSTSHTGFPPFHUKZENF2AACS5E&marketplace=FLIPKART&store=clo%2Fash%2Faxc%2Fmmk%2Fkp7&srno=b_1_35&otracker=browse&fm=organic&iid=eefc1ef4-eb75-4d8e-8288-6015d23c7a67.SHTGFPPFHUKZENF2.SEARCH&ppt=None&ppn=None&ssid=1azmxj5o680000001680018484890,BLIVE ,Men Regular Fit Color Block Casual Shirt,₹319,3.7,4105,319,nice shirt 👍 nice good one,Flipkart,https://rukminim1.flixcart.com/image/832/832/xif0q/shirt/h/m/b/s-bwtblshirttfull-sr2-blive-original-imagm8yyhhez2pdh.jpeg?q=70,1.2833999999999999,0.009612212879817493
93,http://flipkart.com/try-men-solid-casual-black-shirt/p/itmb01a8e8c7a320?pid=SHTGG4WYUZAHHVPA&lid=LSTSHTGG4WYUZAHHVPAVDR2FR&marketplace=FLIPKART&store=clo%2Fash%2Faxc%2Fmmk%2Fkp7&srno=b_2_54&otracker=browse&fm=organic&iid=b9deb022-bd3e-40e8-a8d6-c884435df903.SHTGG4WYUZAHHVPA.SEARCH&ppt=None&ppn=None&ssid=uvp7jirsw00000001680018485970,Try This ,Men Slim Fit Solid Mandarin Collar Casual Shirt,₹369,3.5,4720,164,nice quality good product ❤❤ complete disappoinment wander full products ❤️,Flipkart,https://rukminim1.flixcart.com/image/832/832/l5h2xe80/shirt/7/s/h/xs-juhg-try-this-original-imagg4wyccyjm3jf.jpeg?q=70,1.7174,0.009606575649534542
98,http://flipkart.com/allan-peter-men-checkered-casual-light-blue-shirt/p/itmdebcee04194ef?pid=SHTG4TKNCNPGXW8F&lid=LSTSHTG4TKNCNPGXW8FIT9RQU&marketplace=FLIPKART&store=clo%2Fash%2Faxc%2Fmmk%2Fkp7&srno=b_2_59&otracker=browse&fm=organic&iid=b9deb022-bd3e-40e8-a8d6-c884435df903.SHTG4TKNCNPGXW8F.SEARCH&ppt=None&ppn=None&ssid=uvp7jirsw00000001680018485970,allan peter ,Men Regular Fit Checkered Mandarin Collar Casual Shirt,₹399,3.8,5000,332,poor good product after 1st wash  shirt is looking like this  worst quality product,Flipkart,https://rukminim1.flixcart.com/image/832/832/kqwobrk0/shirt/f/6/o/xxl-pink-sws4125-allan-peter-original-imag4tkbpzf6zzxf.jpeg?q=70,-0.3,0.008853181372681934
8,https://www.amazon.in/Lymio-Casual-Stylish-Printed-Shed/dp/B0BRKKGVK3/ref=zg_bs_1968094031_sccl_9/258-1229559-2740407?psc=1,Lymio,Casual Shirt for Men|| Shirt for Men|| Men Stylish Shirt || Men Printed Shirt (Shed Floral),₹349,4.3,438,280,well the design is super cool and funky but i am little disappointed with the stitchings the treads you guys have used is ruining the designing of this amazingly beautiful and unique shirt and most of the shirts are little bigger in size\nplease fix it and see how customers will make your brand boom in the market i’m quite a fan of your product and designs soon you will get plenty of orders for me and my friends\nhope you will get better by these honest reviews shirt is gd material is gd nice colour texture and printbuy a size above than your usual size good shirt in reasonable price i like it nice shirt quite good but color is not that much bright ordered for my brother fabric is too good,Amazon,https://m.media-amazon.com/images/I/7181NjMrq-L._UX425_.jpg,5.195800000000001,0.008470345469789649
94,http://flipkart.com/majestic-man-men-checkered-casual-maroon-shirt/p/itmee4f0a92742db?pid=SHTGAB8FXHYWGSBJ&lid=LSTSHTGAB8FXHYWGSBJJPPZR7&marketplace=FLIPKART&store=clo%2Fash%2Faxc%2Fmmk%2Fkp7&srno=b_2_55&otracker=browse&fm=organic&iid=b9deb022-bd3e-40e8-a8d6-c884435df903.SHTGAB8FXHYWGSBJ.SEARCH&ppt=None&ppn=None&ssid=uvp7jirsw00000001680018485970,Majestic Man ,Men Slim Fit Checkered Casual Shirt,₹449,4.1,2756,245,good quality it is really amazing shirt which is very comfortable to wear it is cotton shirt 👔 very nice,Flipkart,https://rukminim1.flixcart.com/image/832/832/kxz0pe80/shirt/1/0/e/m-st325mn-majestic-man-original-imagab8fqy2qshj5.jpeg?q=70,1.9584000000000001,0.008059435367714373
157,https://www.snapdeal.com/product/gritstones-100-percent-cotton-white/620925187456,Gritstones,White Cotton Regular Fit Men's Casual Shirt ( Pack of 1 ),469,4.0,79,2,,Snapdeal,https://n4.sdlcdn.com/imgs/k/j/f/Gritstones-White-Cotton-Regular-Fit-SDL786997251-1-fe8b8.jpg,0.0,0.007791472578454705
3,https://www.amazon.in/Lymio-Casual-Stylish-Printed-Mistry/dp/B0BRKJFW2G/ref=zg_bs_1968094031_sccl_4/258-1229559-2740407?psc=1,Lymio,Casual Shirt for Men|| Shirt for Men|| Men Stylish Shirt || Men Printed Shirt (Mistry),₹349,4.4,353,223,product quality was okaish but it was value for many but please order one size bigger shirt then your regular size because its to tight in fitting rest shirt quality can be improved rest thing is good color is different from what i ordered but fabric is nice i have ordered 2 of these shirt is good so much comfortable\nnice and beautiful colour\nanyone who is willing to buying this go for it without any hesitation  its a good shirt lookwise unless you want a cotton fabric nice product awesome material though all good good product worth the purchasefull on value for money,Amazon,https://m.media-amazon.com/images/I/71MaGTXl7ML._UY550_.jpg,5.774500000000001,0.007441238614748891
31,https://www.amazon.in/Amazon-Brand-Regular-AZ-SY-RR-12A-X-Large/dp/B0822PW6N9/ref=zg_bs_1968094031_sccl_32/258-1229559-2740407?psc=1,Amazon Brand - Symbol,Men's Solid Regular Fit Casual Shirt,₹509,3.9,1507,140,minus the shape of collar the other tailoring and cloth quality is exceptional nice quality but little big i get excellent product and comfort and value for money  very nice product and very nice service also i hope you will be do nice service the button area wrinkles are dissatisfied\neven though slightly loose i feel comfortable\ncloth is somewhat suitable for summer of chennai nice quality shirt looking good 👍 the actual color is actually more purplish than burgundy shown here the beautiful dark red shown here is the reason i purchased this shirt but the real color is more dull and has a more bluish purplish color overall bit disappointing but the color is still good on its own and shirt is comfortable too overall product is very good good product good quality good half sleeve shirt too costly\nvery poor packing never did imagine\ntransparent packing  untidy clumsy\npacking sorry,Amazon,https://m.media-amazon.com/images/I/71yrLOqja-L._UY550_.jpg,5.805500000000001,0.007111553613506446
15,https://www.amazon.in/Dennis-Lingo-Checkered-D-Blue-AZ751_D-Blue_L/dp/B08YNWS34Y/ref=zg_bs_1968094031_sccl_16/258-1229559-2740407?psc=1,Dennis Lingo,Men's Checkered Slim Fit Cotton Casual Shirt,₹610,3.9,2461,164,will order more soon ok shirt is good you won’t complain but be careful with size i generally wear m but this shirt m is not my cup of tea colour was dull nice but colour is light compared to photo good but after washing littlebit sink but light color than showed in picture very nice 👌 good fabricmust buy product,Amazon,https://m.media-amazon.com/images/I/61DGAlvxRLL._UY550_.jpg,2.5799,0.006926327221650447
26,https://www.amazon.in/HammerSmith-Printed-Regular-Casual-1103-a_I-Blue/dp/B08DYWWSWC/ref=zg_bs_1968094031_sccl_27/258-1229559-2740407?psc=1,HammerSmith,Men Casual Shirt,₹559,3.8,1863,154,material and fitting is good overall good product shirt found tight in chest \norder was given xxxl eqal to 53\nbut it is found much less than 53\nothewise overall it is good fit  fabric ok i liked the shirt donot hesitate it is very comfortable  button fit can be improved received l\nbut looks like xl\nnot cotton felt like ruf cloth product large,Amazon,https://m.media-amazon.com/images/I/81b3FY+wejL._UY550_.jpg,4.1976,0.0068420678853838325
84,http://flipkart.com/voroxy-men-solid-casual-red-shirt/p/itm5614d4a38c2c7?pid=SHTGB9FG6XS7GPAK&lid=LSTSHTGB9FG6XS7GPAKJ5MOLE&marketplace=FLIPKART&store=clo%2Fash%2Faxc%2Fmmk%2Fkp7&srno=b_2_45&otracker=browse&fm=organic&iid=b9deb022-bd3e-40e8-a8d6-c884435df903.SHTGB9FG6XS7GPAK.SEARCH&ppt=None&ppn=None&ssid=uvp7jirsw00000001680018485970,Voroxy ,Men Regular Fit Solid Casual Shirt,₹279,3.9,2659,163,buy it this is awesome in this price  you can buy it good product,Flipkart,https://rukminim1.flixcart.com/image/832/832/khavrm80-0/shirt/i/j/c/xxl-db-red-vtexx-original-imafxct85xj8ahgy.jpeg?q=70,1.0653000000000001,0.0060139626808221
85,http://flipkart.com/icome-men-striped-casual-multicolor-shirt/p/itmbca9d412054be?pid=SHTGEZWZDWHHHZCJ&lid=LSTSHTGEZWZDWHHHZCJL6FZOB&marketplace=FLIPKART&store=clo%2Fash%2Faxc%2Fmmk%2Fkp7&srno=b_2_46&otracker=browse&fm=organic&iid=b9deb022-bd3e-40e8-a8d6-c884435df903.SHTGEZWZDWHHHZCJ.SEARCH&ppt=None&ppn=None&ssid=uvp7jirsw00000001680018485970,icome ,Men Regular Fit Striped Casual Shirt,₹289,4.1,1982,109,very nice shirt and good product 👍 i love this superb quality good prodect,Flipkart,https://rukminim1.flixcart.com/image/832/832/l3lx8cw0/shirt/c/v/r/s-men-regular-fit-striped-ribbed-collar-casual-shirt-icome-original-imagezwnh7gxb7kd.jpeg?q=70,2.5641000000000003,0.005456099348568835
27,https://www.amazon.in/Diverse-Mens-Solid-Shirt-DCMCF99SC22L38-4448_Olive/dp/B099MN4VCH/ref=zg_bs_1968094031_sccl_28/258-1229559-2740407?psc=1,Diverse,Men Casual Shirt,₹729,3.6,1135,113,good fit lovey colour  play video everything is okbut when i wash it colour gayab good but go for a bigger size effective as a casual wear in walmart season good product best quality but colour change hoke aya hai brown order diya tha camel colur aya hai i think amazon has mistakenly send me the 42size one because i ordered the 44 size one but no offense the shirt is fitting me perfect 💯 satisfied looks like purely unbranded pockets are tilting not comfortable fitting while wearing cloth is ok its good but the quality of cloth need to improve,Amazon,https://m.media-amazon.com/images/I/512pBZ7L-JL._UX522_.jpg,5.7162000000000015,0.0053633381378261555
28,https://www.amazon.in/XPIOR-Funky-Printed-Shirt-Men/dp/B0B9YDGQRK/ref=zg_bs_1968094031_sccl_29/258-1229559-2740407?psc=1,XPIOR,Funky Printed Shirt for Men,₹499,3.9,451,100,this material is so so and stitchings are non reliable the fabrics don’t hold up the stitches properly and it’s only once usable product well apart from that design is good and fitting is actually perfect 😍 the product is good the black and white color of the shirt makes it more adorable to wear best wear for party the price is also affordable to go for  i saw the same shirt in zudio for 699 material is good but the size is smaller unless you want tight fit please order next size to your original size good quality with good looks very confort and dashing fine as per price range i like the fabric design and colour combination stitching quality could have been better colour is same as shown in the pictureand it is also comfortable good one can be used product is fine with the price,Amazon,https://m.media-amazon.com/images/I/51FNFmM459L._UY550_.jpg,8.270600000000002,0.005154719324861627
38,https://www.amazon.in/Van-Heusen-Regular-T-Shirt-VSKCURGBH06145_Multicolor/dp/B08XQW2PMD/ref=pd_rhf_d_ee_s_pd_crcd_sccl_1_1/258-1229559-2740407?pd_rd_w=1UIH6&content-id=amzn1.sym.dcf9b861-ea71-4cd9-870f-f1d20747f687&pf_rd_p=dcf9b861-ea71-4cd9-870f-f1d20747f687&pf_rd_r=3HHKWE70JKEG3EH54D3R&pd_rd_wg=KojdB&pd_rd_r=2975f770-6846-436e-b667-6275f55f9731&pd_rd_i=B09RTVZ2NT&psc=1,Van Heusen,Men's Regular T-Shirt,₹549,4.1,1374,76,good perfect size and perfect color is same in the picture quality of cloth is awesome but this is actually slim fit as written in description  regular fit you must take one size bigger alas i ordered 2xl but 3xl is not available  must buy just a awsm quality all of very nice product 19th oct good product original from india fits as expected but if you got a belly go for two or three size bigger depending on your belly size follow the instructions on the label cold wash only but now ill use it and wash it several times than update you if needed the quality is not original after 2 months im writing this reviewquality of material is cheapthinnot pure cotton bt good for wearing in summer its fabric is international level and branded one dont go for any local brand this is indian brand aditya birla group cloth quality is good print wont fade away if washed by washing machine fitting is really good  writing this review after 2 months of usage so you can go for it nice look i washed it four to five times  but its not faded and cloth is too superior,Amazon,https://m.media-amazon.com/images/I/71y2enCiPkS._UY550_.jpg,6.020100000000001,0.0051497573575127
