index,url,brand,name,price,stars,num_ratings,num_reviews,reviews,platform,image,vader_score,final_score
103,https://www.snapdeal.com/product/sky-heights-peach-lehenga-choli/655291599210#bcrumbLabelId:808,Sky Heights Peach Lehenga Choli S,Sky Heights Peach Lehenga Choli Set,725,4.1,213,19,excellent all the best good quality awesome thanks sanpdel perfect orion awsm i loved it thank you so much five stars awesome,Snapdeal,https://n3.sdlcdn.com/imgs/k/i/e/Sky-Heights-Peach-Lehenga-Choli-SDL041548119-1-a9b36.jpg,4.8719,0.5178122949507271
39,http://flipkart.com/curly-tales-girls-festive-party-wedding-kurta-dhoti-pant-set/p/itm7ba5a5586d1ea?pid=KETG5ZHEZPN9ZGCZ&lid=LSTKETG5ZHEZPN9ZGCZLIEAIQ&marketplace=FLIPKART&store=clo%2Fcfv&srno=b_1_4&otracker=browse&fm=organic&iid=030a4d3f-4e63-456c-a346-21166f0188fb.KETG5ZHEZPN9ZGCZ.SEARCH&ppt=None&ppn=None&ssid=4364ngaaps0000001679481532319,Curly Tales ,"Girls Festive & Party, Wedding Kurta and Dhoti Pant Set  (Pink Pack of 1)",₹495,4.1,14549,1420,very good loved the dress worth buying it❤️ good,Flipkart,https://rukminim1.flixcart.com/image/832/832/xif0q/kids-ethnic-set/o/4/f/7-8-years-k-6-curly-tales-original-imag5zhdhk88dnty-bb.jpeg?q=70,1.7065000000000001,0.4865871235627509
41,http://flipkart.com/ftc-fashions-girls-festive-party-kurta-dhoti-pant-set/p/itmbafc28cc579db?pid=KPBFPDPS6BCJX8BV&lid=LSTKPBFPDPS6BCJX8BVEGLHRC&marketplace=FLIPKART&store=clo%2Fcfv&srno=b_1_6&otracker=browse&fm=organic&iid=030a4d3f-4e63-456c-a346-21166f0188fb.KPBFPDPS6BCJX8BV.SEARCH&ppt=None&ppn=None&ssid=4364ngaaps0000001679481532319,FTC FASHIONS ,Girls Festive & Party Kurta and Dhoti Pant Set  (White Pack of 1),₹325,4.0,10119,996,😍😍 nice nice one mind blowing,Flipkart,https://rukminim1.flixcart.com/image/832/832/kdnf98w0hlty2aw-0/kids-apparel-combo/e/q/m/8-9-years-rayondhoti01-ftc-fashions-original-imafumnjv9uwkmar.jpeg?q=70,1.5614,0.3251263826441754
4,https://www.amazon.in/Stanwells-kids-Tissue-Lehenga-AG008D_14/dp/B07L31VJ8N/ref=zg_bs_3659020031_sccl_5/257-0329217-1454160?psc=1,Stanwells Kids,Baby Girl's Net Readymade Lehenga Choli,₹795,4.2,2977,667,value for money i like this colour and design it suits my granddaughter very much she is a pretty kid of our family nice fitting proper expected colour as shown in picture very good quality completely satisfied 😊 worth it gifted to my niece she looks so prettyso nice choice cloth quality very nice and the color was as in the picture if given elastic for the waist instead of rope finish then for toddlers it will be easy to wear and carry got them for my neighbours baby it can be used by one year but the quality and stitching was amazing finish hats off to seller to make it affordable  size which i asked is properly fitted to my daughter and she look very pretty in that excellent service and product as always,Amazon,https://m.media-amazon.com/images/W/IMAGERENDERING_521856-T2/images/I/515iAvnFyaL._UX679_.jpg,6.3583,0.3133660573050161
100,https://www.snapdeal.com/product/fashion-dream-girls-peplum-style/8070451161365098901#bcrumbLabelId:808,Fashion Dream Girl's Peplum Style Lehenga Cho,Fashion Dream Girl's Peplum Style Lehenga Choli,539,4.0,182,7,beautiful product superb product out standing dress nice quality nice product jordar lehenga chholicolor same to same good quality,Snapdeal,https://n2.sdlcdn.com/imgs/k/i/u/Fashion-Dream-Girl-s-Peplum-SDL009794261-1-5bdc5.jpg,2.5077,0.26289392660328287
27,https://www.amazon.in/Stanwells-Kids-Kerala-Lehenga-Golden/dp/B07V9N17ZP/ref=zg_bs_3659020031_sccl_30/257-0329217-1454160?psc=1,Stanwells Kids,Girl's Net Readymade Lehenga Choli,₹941,4.4,2227,432,looks awesome just loved it value for money good qualityreceived as expectedgives a grand look drees is so good looks very good good good i have ordered this dress for my niece she is 4 yrs old but i ordered size for 56 years that will be suitable for her height so go for a next size quality is satisfied with my expectation recommended to all best price good quality 👌 value for money and comfortable one for kids good,Amazon,https://m.media-amazon.com/images/W/IMAGERENDERING_521856-T2/images/I/71Gs1b+xvmL._UX522_.jpg,7.946900000000001,0.2517787473614682
105,https://www.snapdeal.com/product/mirrow-trade-girls-indo-western/5764608195157701457#bcrumbLabelId:808,Mirrow Trade Girl’s Indo Western Style Lehenga Cho,Mirrow Trade Girl’s Indo Western Style Lehenga Choli,649,4.3,132,8,excellent 👍 my daughter looks like princess beautiful everything excellent good collection excellent mirror trade girls western style lehenga choli so good product,Snapdeal,https://n1.sdlcdn.com/imgs/j/s/u/Mirrow-Trade-Girl-s-Indo-SDL183893149-1-0978a.jpg,3.5570999999999997,0.24678743661777522
38,http://flipkart.com/tik-tok-wears-legging-girls/p/itm149f96859d21b?pid=KLGG5W328KPMPSZQ&lid=LSTKLGG5W328KPMPSZQFELDB2&marketplace=FLIPKART&store=clo%2Fcfv&srno=b_1_3&otracker=browse&fm=organic&iid=030a4d3f-4e63-456c-a346-21166f0188fb.KLGG5W328KPMPSZQ.SEARCH&ppt=None&ppn=None&ssid=4364ngaaps0000001679481532319,Tik Tok WEARS ,Legging For Girls  (Multicolor Pack of 5),₹436,4.0,7751,736,quality super good product all is good,Flipkart,https://rukminim1.flixcart.com/image/832/832/ksaoqkw0/kids-legging/q/z/w/2-3-years-printed-105-104-103-102-101-tik-tok-wears-original-imag5w2yuwdujqhh.jpeg?q=70,1.4802,0.24327789508967876
81,http://flipkart.com/ftc-fashions-girls-festive-party-kurta-pallazo-set/p/itmf3b71316d0c2b?pid=KETFWJFSPQEUYTHQ&lid=LSTKETFWJFSPQEUYTHQCU2HIW&marketplace=FLIPKART&store=clo%2Fcfv&srno=b_2_47&otracker=browse&fm=organic&iid=570ab4a0-28bc-4749-8254-2d4f78a88a31.KETFWJFSPQEUYTHQ.SEARCH&ppt=None&ppn=None&ssid=e68stowhow0000001679481533751,FTC FASHIONS ,Girls Festive & Party Kurta and Pallazo Set  (Black Pack of 1),₹347,4.0,6188,743,thanks flipkart my daughter happy beautiful suit look how pretty she looksthnk u flipkartluv u alws,Flipkart,https://rukminim1.flixcart.com/image/832/832/kg9qbgw0/kids-ethnic-set/w/z/d/9-10-years-kidsblackkurtiset-ftc-fashions-original-imafwjhtgpurvfz4.jpeg?q=70,2.1056,0.23355685146161564
7,https://www.amazon.in/Fashion-Dream-Readymade-Lehenga-Set_Yellow_5-6/dp/B081T6CBVH/ref=zg_bs_3659020031_sccl_9/257-0329217-1454160?psc=1,Fashion Dream,Girl's Ethnic Wear Jacquard Silk Embroidered Western Style Full Stitched Lehenga Choli Set (Readymade),₹639,4.0,4828,537,nice dress same as shown in the picture dress reached corrct time but skirt to design dont have very simple looking material and design are same as shown in the picture liking the product the skirt colour was faded and the design was hardly visible perfect and beautiful dress material and the pattern is as shown is pic fit perfectly i liked the color and cloth softness texture can be better intenal belt rope can be given to tight ghaghara one hook can be fixed for the bottom,Amazon,https://m.media-amazon.com/images/W/IMAGERENDERING_521856-T2/images/I/81EPvZvOv3L._UX425_.jpg,3.9574000000000003,0.23344024631793475
20,https://www.amazon.in/Fashion-Dream-Lehenga-NAZARA-Choli_Pink_2-3/dp/B07Z5SZB8L/ref=zg_bs_3659020031_sccl_22/257-0329217-1454160?psc=1,Fashion Dream,Girl's Satin Readymade Lehenga Choli (NZ2_BLUE LC 10-11 Years_Blue_10-11 Years),₹559,3.9,2824,314,considering the price this item is absolutely amazing\npros  looks superbly fancy and expensive the satin looking fabric is shiny too that adds on to the charm of the dress the dress have got a cotton lining inside so its skin friendly for kids comes with a net dupatta with jari work at borders good finishing work of stitches the embroidery on the top looks beautiful and nit very glittery  safe for children\n\ncons  dupatta looks cheap but kids dont really carry the dupatta no sleeve option provided the dress is little bigger than the expected size but still manageable the packing is too small and the fabric gets creased making it less presentable but if you iron it its beautiful again i like very much good 👍 excellent the product is packed in a transparent plastic cover it would be better if packed in a fine amazon paper cover atleast \nexcept the packing the dress is so nice with soft and beautiful quality of the cloth nyc dress quality is good1112 year girls size is perfectly fit product is good\nquality and clothe are comfortable😊 item received as per the order comfortable dress good service by the seller looks good,Amazon,https://m.media-amazon.com/images/W/IMAGERENDERING_521856-T2/images/I/9167db35b7L._UX425_.jpg,9.3381,0.2305321287642226
130,https://www.snapdeal.com/product/dwiden-rohini-tafetta-sattin-semistitched/686063096664,DWIDEN ROHINI Tafetta Sattin Sem,titched girl's Lehenga Choli,605,3.9,194,4,,Snapdeal,https://n1.sdlcdn.com/imgs/k/i/2/DWIDEN-ROHINI-Tafetta-Sattin-Semi-SDL374466402-1-9e76e.jpg,0.0,0.22157273888036363
49,http://flipkart.com/new-gen-baby-girls-wedding-kurta-pallazo-set/p/itm1982d5219394e?pid=KETGA6S7XZMKZSHB&lid=LSTKETGA6S7XZMKZSHBGZKBQW&marketplace=FLIPKART&store=clo%2Fcfv&srno=b_1_14&otracker=browse&fm=organic&iid=030a4d3f-4e63-456c-a346-21166f0188fb.KETGA6S7XZMKZSHB.SEARCH&ppt=None&ppn=None&ssid=4364ngaaps0000001679481532319,new gen ,Baby Girls Wedding Kurta and Pallazo Set  (Pink Pack of 1),₹238,4.0,5870,539,very nice beautiful dress excellent product thanks for dress,Flipkart,https://rukminim1.flixcart.com/image/832/832/kxtaxzk0/kids-ethnic-set/a/v/i/2-3-years-ng-227-pink-20-new-gen-original-imaga6s6epmhayvn.jpeg?q=70,2.0332,0.19957555203921223
76,http://flipkart.com/negup-girls-festive-party-kurta-pallazo-set/p/itmd65e351160c6b?pid=KETG74MPH7QCXTHB&lid=LSTKETG74MPH7QCXTHBRWUSQI&marketplace=FLIPKART&store=clo%2Fcfv&srno=b_2_42&otracker=browse&fm=organic&iid=570ab4a0-28bc-4749-8254-2d4f78a88a31.KETG74MPH7QCXTHB.SEARCH&ppt=None&ppn=None&ssid=e68stowhow0000001679481533751,NEGUP ,Girls Festive & Party Kurta and Pallazo Set  (Yellow Pack of 1),₹226,3.9,5870,465,niceee 👍🏻 very very nice good quality go for it,Flipkart,https://rukminim1.flixcart.com/image/832/832/xif0q/kids-ethnic-set/y/k/r/8-9-years-kdg56-32-negup-original-imag74mexrqrgmyg-bb.jpeg?q=70,0.8619,0.1567789082696571
152,https://www.snapdeal.com/product/mirrow-trade-girls-peplum-style/6917529663795519717,Mirrow Trade Girl's Peplum Style Lehenga Cho,Mirrow Trade Girl's Peplum Style Lehenga Choli,625,3.9,98,4,very good very nice good product excellent,Snapdeal,https://n2.sdlcdn.com/imgs/k/i/x/Mirrow-Trade-Girl-s-Peplum-SDL371686255-1-dc79a.jpg,1.8742,0.13315266320218583
46,http://flipkart.com/tik-tok-wears-legging-girls/p/itm9a765de0c1988?pid=KLGFPHQ2E73AGFYV&lid=LSTKLGFPHQ2E73AGFYVEVJDUH&marketplace=FLIPKART&store=clo%2Fcfv&srno=b_1_11&otracker=browse&fm=organic&iid=030a4d3f-4e63-456c-a346-21166f0188fb.KLGFPHQ2E73AGFYV.SEARCH&ppt=None&ppn=None&ssid=4364ngaaps0000001679481532319,Tik Tok WEARS ,Legging For Girls  (Multicolor Pack of 5),₹414,3.9,3759,414,nice product ☺️👍 wonderful good quality and siz,Flipkart,https://rukminim1.flixcart.com/image/832/832/k7dnonk0/kids-legging/g/j/d/5-6-years-ttwkl-002-tik-tok-wears-original-imafpmyzt7ybesgf.jpeg?q=70,1.8925999999999998,0.13023049432931422
110,https://www.snapdeal.com/product/mirrow-trade-girls-long-tulle/5764608209899400515#bcrumbLabelId:808,Mirrow Trade Girl’s Long Tulle Bridesmaid Skirt/Lehenga Cho,Mirrow Trade Girl’s Long Tulle Bridesmaid Skirt/Lehenga Choli,599,4.3,83,4,it is wonderful awesome superb how is it,Snapdeal,https://n3.sdlcdn.com/imgs/j/s/u/Mirrow-Trade-Girl-s-Long-SDL932808348-1-8b6bd.jpg,1.8217,0.12514894666164011
115,https://www.snapdeal.com/product/fashion-dream-girls-birthdayspecial-occasion/8070451167018497052,Fashion Dream Girl’s Birthday/special occasion Lehenga Cho,Fashion Dream Girl’s Birthday/special occasion Lehenga Choli,649,4.3,76,5,good product too good 👍😊 good thank you snapdeal awesome selection bad bad,Snapdeal,https://n2.sdlcdn.com/imgs/j/s/n/Fashion-Dream-Girl-s-Birthday-SDL275882092-1-6a031.jpeg,1.9411000000000005,0.1231816387829785
9,https://www.amazon.in/Stanwells-Kids-Readymade-Lehenga-AM031-O16_Orange_1-2/dp/B08QFTWD7G/ref=zg_bs_3659020031_sccl_11/257-0329217-1454160?psc=1,Stanwells Kids,Orange and Magenta combo south indian Baby girls mirror work net Lehenga Choli set (3months to 8Years),₹950,4.4,1277,200,my daughter looks so pretty wearing this dress quality of the dress is good worth buying for the given offer go for it very nice qualitycolor design and all just go for it my daughter looks like a pretty little princess good quality dress bought this for my kids and we all loved it the pink and orange are lovely together the skirt is long and touches the floor for my 7 year old  we bought 78 years as size so i think it’s expected good best in category very beautiful looks same like image too good  value for money 100\nquality 100\nbeautiful 100\nmeet up expectations 100\nsuggestions  1 should provide option of sleeves 2 should provide such beautiful dress for women also i bought this dress for my daughter and liked it so much that if option available i would have purchased it for myself,Amazon,https://m.media-amazon.com/images/W/IMAGERENDERING_521856-T2/images/I/716U8J0O4WL._UX522_.jpg,7.902100000000001,0.12239611140231497
10,https://www.amazon.in/Stanwells-Kids-Sequins-Readymade-6month-1/dp/B091HX5B5G/ref=zg_bs_3659020031_sccl_12/257-0329217-1454160?psc=1,Stanwells Kids,Red and Green combo Baby Girls Sequins Net Readymade Lehenga Choli (6months-8 years),₹912,4.3,960,136,suoerb good fit nice colour perfect fit for my daughterits very good looking dress it exactly as in the picture quality is very good looking grand and beautiful definitely one can buy without a second thought material is too good\ni m happy buying this amazon product\namazon shopping is really best cloth super very beautiful and brightly coloured lehanga choli bought for my 2yr oldthe product is same as the pic shown\nthe only drawback i feel for smaller kids as minewish the skirt had elastic instead of drawstringfor little kids the skirt keeps coming down good to fit material is nice and comfortable blouse is avarage and lower is really good 👍,Amazon,https://m.media-amazon.com/images/W/IMAGERENDERING_521856-T2/images/I/81UsqiC9C+S._UX522_.jpg,9.321900000000003,0.09596202762620488
56,http://flipkart.com/fashion-dream-girls-wedding-festive-party-dhoti-kurta-set/p/itm3fa0134b73fab?pid=KETFXDNUDAUZMSZN&lid=LSTKETFXDNUDAUZMSZNCHGYZ4&marketplace=FLIPKART&store=clo%2Fcfv&srno=b_1_21&otracker=browse&fm=organic&iid=030a4d3f-4e63-456c-a346-21166f0188fb.KETFXDNUDAUZMSZN.SEARCH&ppt=None&ppn=None&ssid=4364ngaaps0000001679481532319,Fashion Dream ,"Girls Wedding, Festive & Party Dhoti & Kurta Set  (Yellow Pack of 1)",₹419,4.0,1905,216,very nice product my daughter very happy to got it thank you flipkart  and delivery lady also very decent person nice product the dress is so pretty and fit perfectly to my 5 years daughter made her raksha bandhan day more beautiful 💓,Flipkart,https://rukminim1.flixcart.com/image/832/832/khcb7gw0/kids-ethnic-set/f/f/h/7-8-years-gdk01-kalki-fashion-dream-original-imafxdr5bxxgzzap.jpeg?q=70,4.163500000000001,0.09555184164335401
17,https://www.amazon.in/Fashion-Dream-Printed-Readymade-Psta_5-6/dp/B08PKR4ZVH/ref=zg_bs_3659020031_sccl_19/257-0329217-1454160?psc=1,Fashion Dream,Girl's Satin Readymade Lehenga Choli,₹519,3.6,1933,133,its good the model was good quality is good worthy very nice products 👍👍 looks good in picture but the stitching and fitting is not good in reality didnt liked it i dont have any word to say it was fabulous i had bought this for a dance performance and when it came in the opening is too small and her head couldn’t get through even with the side zip open\nthe dress looks cute i altered it with a slit and button closure on the back\nif the dress makers change the neck size or add some kind of opening at the back it would be good good ok as expected after viewing reviewsit is really good,Amazon,https://m.media-amazon.com/images/W/IMAGERENDERING_521856-T2/images/I/81TUPjiillL._UY550_.jpg,6.614800000000002,0.09057232784770869
140,https://www.snapdeal.com/product/fashion-dream-girls-ethnic-wear/5764608142596044239,Fashion Dream Girl’s Ethnic Wear Floral Lehenga Choli with Dupat,Fashion Dream Girl’s Ethnic Wear Floral Lehenga Choli with Dupatta,675,4.0,64,2,great deal super products but  blouse quality was not good,Snapdeal,https://n4.sdlcdn.com/imgs/j/s/o/Fashion-Dream-Girl-s-Ethnic-SDL837510709-1-a7779.jpeg,1.6646999999999998,0.08439627540143926
18,https://www.amazon.in/Preethi-Dresses-Cotton-Pdnbb3_01_Blue-Red_0-3/dp/B07SSYKHVB/ref=zg_bs_3659020031_sccl_20/257-0329217-1454160?psc=1,Preethi Dresse's,Girl's Cotton Silk Readymade Lehenga Choli,₹599,4.2,1092,159,this is the cutest piece i ordered 3m size for my baby girl and size was spot on colour is just as shown in picture looks very stylish\nbest part\n1 its onepiece ethnic dress very thoughtful and easy to put on an infant\n2 its cotton which is good but keep in mind its not like very soft cotton its more on a stiff cotton side but its no problem and still gentle on baby skin good bought for my 2 months old daughter\ngreat quality fit and color  good onebt little bit costly very nice dress same as picture shown bought this frock for my 5 month old daughter its beautiful summer festive frock great fitting purchased for my daughterworth money go for it the fabric quality is good and fitting is fine too could have been better quality in this price hence 2 stars less its very good dress but after 1hr of dresses its torn frm one side also its little bit costly as i feel,Amazon,https://m.media-amazon.com/images/W/IMAGERENDERING_521856-T2/images/I/61pCtkAZKpL._UY550_.jpg,6.366900000000002,0.0841833250866493
122,https://www.snapdeal.com/product/fashion-dream-girls-ethnic-wear/6917529706228166962,Fashion Dream Girl's Ethnic Wear Western Style Lehenga Choli S,Fashion Dream Girl's Ethnic Wear Western Style Lehenga Choli Set,625,4.4,63,2,,Snapdeal,https://n2.sdlcdn.com/imgs/j/r/c/Fashion-Dream-Girl-s-Ethnic-SDL556432469-1-eff11.jpg,0.0,0.08117890988321015
52,http://flipkart.com/tik-tok-wears-indi-legging-girls/p/itm5838d41f9a888?pid=KLGFZ254NHGT9QX2&lid=LSTKLGFZ254NHGT9QX2FU7YPN&marketplace=FLIPKART&store=clo%2Fcfv&srno=b_1_17&otracker=browse&fm=organic&iid=030a4d3f-4e63-456c-a346-21166f0188fb.KLGFZ254NHGT9QX2.SEARCH&ppt=None&ppn=None&ssid=4364ngaaps0000001679481532319,Tik Tok WEARS ,Legging For Girls  (White Pack of 2),₹208,3.8,2103,188,good wow is very nice super   💕,Flipkart,https://rukminim1.flixcart.com/image/832/832/xif0q/kids-legging/x/n/t/6-7-years-combo-white-black-28-tik-tok-wears-original-imafz27m3pxmdb9g-bb.jpeg?q=70,2.6958,0.07550272858623748
1,https://www.amazon.in/White-Button-pavadai-Jecquard-Lehenga/dp/B09BKVTJ4F/ref=zg_bs_3659020031_sccl_2/257-0329217-1454160?psc=1,White Button,Baby Girls Lehenga Choli Set,₹913,4.1,1024,119,superb looking very good product fabric and design are good but we got big size dress colour not dark yellow its light golden colour so small disappointing  bt overall good nd very soft material go for it 👍 very nice and wonderful good material iam very happy excellent dress worth to buy it go for it my daughter is six years old and i have taken 78years old lehenga just to avoid size issues as she is bit tall and it was perfect fit for her i recommend to buy one size plus than regular ones\ncloth n lining is soft and not irritable expecting more varietiesthank you amazon colour is so much different and not like advertised image worthable amount and quality is too good our daughter like it a lot thank you 😊 colour and fabric,Amazon,https://m.media-amazon.com/images/W/IMAGERENDERING_521856-T2/images/I/71FaxT3+I4L._UX522_.jpg,7.198000000000001,0.0730904965356243
96,https://www.snapdeal.com/product/mirrow-trade-girls-ethnic-wear/5764608149014283344#bcrumbLabelId:808,Mirrow Trade Girl’s Ethnic Wear Floral Lehenga Choli with Dupat,Mirrow Trade Girl’s Ethnic Wear Floral Lehenga Choli with Dupatta,649,4.1,51,3,great quality awsome great product,Snapdeal,https://n3.sdlcdn.com/imgs/j/s/w/Mirrow-Trade-Girl-s-Ethnic-SDL186063934-1-d8d1c.jpg,1.2498,0.07185052048248383
0,https://www.amazon.in/White-Button-Polyester-Readymade-Choli_Wine_4/dp/B0B49G51YG/ref=zg_bs_3659020031_sccl_1/257-0329217-1454160?psc=1,White Button,New south Indian traditional pattu pavadai Jecquard Lehenga choli for girls dress,"₹1,054",3.8,1283,140,very nice dress cloth also good and currectly time in delivered lehenga length is small to my kid she is 3 yrs old i have order 3 4 years size but lentha of the lehenga is smaller to her same as it is as shown in picture dress is awesome good one cloth quality is not good but looks good on my daughter worth for the money nice drive quality is very good my daughter very comfortable with this dress i searched in local but no design likt this not available average nice,Amazon,https://m.media-amazon.com/images/W/IMAGERENDERING_521856-T2/images/I/71PN7SbSUXL._UY550_.jpg,4.532299999999999,0.0644833944801086
146,https://www.snapdeal.com/product/kids-fashion-king-gulab-tafetta/5764608163878667899,Kids Fashion king Gulab Tafetta Sattin Sem,"titched girl's Lehenga Choli in Various Size, Refer size chart",599,3.9,56,2,,Snapdeal,https://n3.sdlcdn.com/imgs/k/i/x/Kids-Fashion-king-Gulab-Tafetta-SDL092676843-1-a77cc.jpg,0.0,0.06395914112010495
13,https://www.amazon.in/Wommaniya-Impex-pavadai-Jecquard-Lehenga/dp/B09RN7BWMB/ref=zg_bs_3659020031_sccl_15/257-0329217-1454160?psc=1,Wommaniya Impex,Girl's Pattu Pavadai Readymade Jacquard Lehenga Choli,"₹1,079",4.2,691,81,nice dress as like in pic  size getting exact for my baby  wrothable for price  thanks amazon its just lovely my little one will love it and provided the elastic for bottom wear is brilliant very easy to carry for kids this dress is same as shown in the image it’s worth the money quality and fit is also good good producti recommend to buy nice one good the cloth is very soft and the dress is exactly as shown in pic my baby girl looked like a doll in that however plz wash before u use this l even though it didnt look dirty as soon as its washed the water became black in color no color bleedshrinkage after wash colour combination is good and the product is also good nice dress good for this price red lil bright than pic overall nice,Amazon,https://m.media-amazon.com/images/W/IMAGERENDERING_521856-T2/images/I/71jW9LMWCSL._UX522_.jpg,9.106900000000003,0.05876604627326666
87,http://flipkart.com/lenam-indi-legging-baby-girls/p/itm4b091bbc0f1b4?pid=KLGG3PH4J4EAPT2S&lid=LSTKLGG3PH4J4EAPT2SMUDCAQ&marketplace=FLIPKART&store=clo%2Fcfv&srno=b_2_53&otracker=browse&fm=organic&iid=570ab4a0-28bc-4749-8254-2d4f78a88a31.KLGG3PH4J4EAPT2S.SEARCH&ppt=None&ppn=None&ssid=e68stowhow0000001679481533751,Lenam ,Legging For Baby Girls  (Multicolor Pack of 7),₹338,4.3,1397,141,gd best product go and buy awesome awesome awesome 👍👍👍 must buy really really good,Flipkart,https://rukminim1.flixcart.com/image/832/832/xif0q/kids-legging/u/b/l/0-3-months-baby-leggings-0-3-lenam-original-imagh2zszt6t7dcf.jpeg?q=70,2.952,0.05875183177618566
141,https://www.snapdeal.com/product/guddiya-baby-doll-tafetta-sattin/6917529698346838079,GUDDIYA Baby Doll Tafetta Sattin Sem,"titched Party, Wedding, Ethnic wear girl's Lehenga Choli",679,3.8,49,0,,Snapdeal,https://n2.sdlcdn.com/imgs/k/i/x/GUDDIYA-Baby-Doll-Tafetta-Sattin-SDL111060191-1-5910f.jpg,0.0,0.05452926774983307
111,https://www.snapdeal.com/product/meczzon-gulab-tafetta-sattin-semistitched/5764608144859791213#bcrumbLabelId:808,MecZZON Gulab Tafetta Sattin Sem,"titched girl's Lehenga Choli in Various Size, Refer size chart",649,4.0,46,0,,Snapdeal,https://n1.sdlcdn.com/imgs/k/i/x/MecZZON-Gulab-Tafetta-Sattin-Semi-SDL319250316-1-a0976.jpg,0.0,0.05388499068726792
121,https://www.snapdeal.com/product/mirrow-trade-girls-ethnic-wear/8070451177822921456,Mirrow Trade Girl's Ethnic Wear Western Style Lehenga Choli S,Mirrow Trade Girl's Ethnic Wear Western Style Lehenga Choli Set,625,4.1,44,3,,Snapdeal,https://n4.sdlcdn.com/imgs/k/i/u/Mirrow-Trade-Girl-s-Ethnic-SDL419494320-1-df5cb.jpg,0.0,0.052830719130343096
92,http://flipkart.com/link-kwality-garments-baby-girls-festive-party-kurta-trouser-set/p/itm65d11473227a4?pid=KETG84A2FMEQHSKD&lid=LSTKETG84A2FMEQHSKDY3AVQC&marketplace=FLIPKART&store=clo%2Fcfv&srno=b_2_58&otracker=browse&fm=organic&iid=570ab4a0-28bc-4749-8254-2d4f78a88a31.KETG84A2FMEQHSKD.SEARCH&ppt=None&ppn=None&ssid=e68stowhow0000001679481533751,LINK KWALITY GARMENTS ,Baby Girls Festive & Party Kurta and Trouser Set  (Pink Pack of 1),₹240,3.8,1226,127,lovely dress just amazing 😍😍 best product nice dress with good 👍 quality cloth i really i it,Flipkart,https://rukminim1.flixcart.com/image/832/832/kv5kfww0/kids-ethnic-set/j/z/r/3-4-years-top-pant-link-kwality-garments-original-imag84a29sbm4v5v.jpeg?q=70,3.389,0.051657141554069606
95,https://www.snapdeal.com/product/fashion-dream-girls-patola-printed/5764608175521568055#bcrumbLabelId:808,Fashion Dream Girl's Patola Printed Rajastani Lehenga Cho,Fashion Dream Girl's Patola Printed Rajastani Lehenga Choli,625,4.0,43,0,,Snapdeal,https://n3.sdlcdn.com/imgs/k/i/x/Fashion-Dream-Girl-s-Patola-SDL158991205-1-d14f8.jpg,0.0,0.050370752164185226
