index,url,brand,name,price,stars,num_ratings,num_reviews,reviews,platform,image,vader_score,final_score
1,https://www.amazon.in/Allen-Solly-Regular-AMKP317G04249_Jet-Black_X-Large/dp/B06Y2CH63N/ref=zg_bs_1968120031_sccl_2/257-0329217-1454160?psc=1,Allen Solly,Men's Regular Fit Polo,₹590,4.1,60136,8933,ordered bottle green one  the colour is similar as shown  the packaging of the product is below than average as it came wrapped in plastic bag  moreover the quality of the product is good at this price and the another plus point is the fit is perfect as expected  neither the colour fade after wash nor the quality of the product was compromised  overall its good   this product is value for money best in this price range i ordered two tshirts from same brand but different colour surprisingly both had different packaging\nhowever keeping that aside product quality is great the colour didnt fade during the wash and neither the quality of the cloth was compromised\noverall satisfied very good nice👌👌👌 good average quality first of all i thought that it’s fake allen then got to know that yeah it’s original but the material is bit of cheap quality so yeah according to price point of view it’s okay deal not a great but from my pov if it’s price would be around 450 k then it would be great recommend allen solly products on amazon they are genuine the tshirts i ordered are of good quality and fit perfectly been using them for almost 3 months now and they have not degraded,Amazon,https://m.media-amazon.com/images/W/IMAGERENDERING_521856-T2/images/I/71eUwDk8z+L._UY550_.jpg,9.444500000000001,0.7894629647348487
95,http://flipkart.com/tripr-printed-men-hooded-neck-red-t-shirt/p/itm945f2c551636d?pid=TSHG4U95NHNJHV8N&lid=LSTTSHG4U95NHNJHV8NWY9HAG&marketplace=FLIPKART&store=clo%2Fash%2Fank&srno=b_2_55&otracker=browse&fm=organic&iid=21092790-7e41-413e-9573-facd6ed135b7.TSHG4U95NHNJHV8N.SEARCH&ppt=None&ppn=None&ssid=3v9mz9l50w0000001679480076415,TRIPR ,Men Printed Hooded Neck Red T-Shirt,₹279,4.1,93798,8026,best t shirt nice good,Flipkart,https://rukminim1.flixcart.com/image/832/832/xif0q/t-shirt/v/h/u/xxl-trdhdfulmask-lion-tripr-original-imagjhhhfhgzgyng.jpeg?q=70,1.4988000000000001,0.3453793541676135
64,http://flipkart.com/blive-graphic-print-men-round-neck-white-t-shirt/p/itm2ebe957b5cd08?pid=TSHGEWHZH3NADJBQ&lid=LSTTSHGEWHZH3NADJBQKWAIZP&marketplace=FLIPKART&store=clo%2Fash%2Fank&srno=b_1_18&otracker=browse&fm=organic&iid=2ab0b4a3-c077-43b9-9e75-6b60fb27171b.TSHGEWHZH3NADJBQ.SEARCH&ppt=None&ppn=None&ssid=8wi3xv8uwg0000001679480069493,BLIVE ,Men Graphic Print Round Neck White T-Shirt,₹259,3.8,81496,4392,nice product good this product is very good yaar 🥰🥰🤗❤️🦸🙋🏻,Flipkart,https://rukminim1.flixcart.com/image/832/832/xif0q/t-shirt/f/m/k/4xl-bwtrnful-z55-blive-original-imagnjmycmget8h9.jpeg?q=70,2.2689,0.280184995903478
52,http://flipkart.com/ftx-solid-men-round-neck-silver-blue-black-grey-t-shirt/p/itm39275afebb5b2?pid=TSHGEMGVQKQFYMPY&lid=LSTTSHGEMGVQKQFYMPYESG18N&marketplace=FLIPKART&store=clo%2Fash%2Fank&srno=b_1_3&otracker=browse&fm=organic&iid=2ab0b4a3-c077-43b9-9e75-6b60fb27171b.TSHGEMGVQKQFYMPY.SEARCH&ppt=None&ppn=None&ssid=8wi3xv8uwg0000001679480069493,FTX ,"Pack of 4 Men Solid Round Neck Silver, Blue, Black, Grey T-Shirt",₹449,4.1,60323,5328,good in this price it’s awesome thank you ftx and flipkart team🤗🤗 awesome product,Flipkart,https://rukminim1.flixcart.com/image/832/832/l3j2cnk0/t-shirt/2/w/p/l-723-2-5-7-8-ftx-original-imagemgrpafdug8v.jpeg?q=70,2.7321999999999997,0.2726631502874497
7,https://www.amazon.in/Scott-International-SS20-3RN-BU-GR-CH-L_Navy-Charcoal-Grey_Large/dp/B084L9DK9H/ref=zg_bs_1968120031_sccl_8/257-0329217-1454160?psc=1,Scott International,Men's Regular Fit T-Shirt (Pack of 3),₹523,3.7,36780,4097,definitely worth for money buy one size extra than your requirement to get the proper size shirts a little thick good for winter  i tried many t shirts online there are bad fabrics and there are non standard sizes colour variations in viewing online and realistic but here i dont feel that i lost my money or i got cheated its worth buying for this money i am using this for daily jogging or gym activity these tshirts are good but not very good just because of its clothe quality i would say its not that bad but clothe material is thin so gentle wash is recommended from my side also i ordered 3xl for my father but he then refused to wear them so i thought i should return them but its good that i didnt return these tshirts because now im wearing these and believe me these are very soft and im loving 3xl its loose but very comfortable so whoever looking to buy this item you got my recommendation decision upon you as always overall happy with the purchase quality is good good the clothes quality doesnt mett as i expected good it does the job its just a tshirt nice products for daily uses 👌 😊 👍🏻,Amazon,https://m.media-amazon.com/images/W/IMAGERENDERING_521856-T2/images/I/71HBNT3R66L._UX466_.jpg,5.603899999999999,0.26080602632759503
5,https://www.amazon.in/Jockey-2714-0105-WHITE-White-T-Shirt-2714-0105-WHITE_White_M/dp/B012STP7EO/ref=zg_bs_1968120031_sccl_6/257-0329217-1454160?psc=1,Jockey,2714 Men's Super Combed Cotton Rich Solid Round Neck Half Sleeve T-Shirt,₹549,4.3,20263,2734,the tshirts are comfortable cheap good fit nice colours and lasts long has been using for more than a year and have reordered now value for money nice fabric and very comfertable nice t shirt but a bit loose ausome quality and doesnt spoil after wash worth it nice tshirt original product very good material and original jockey t shirt great as always nothing has fit me better nice product from jockey but slightly big in size i have purchased it in 350 rs if you find this t shirt under 500 rs thn it is definitely worth it but size is bigger buy 2 size smaller than yours if you wear xl then for perfect fit buy medium size😊👍,Amazon,https://m.media-amazon.com/images/W/IMAGERENDERING_521856-T2/images/I/71DaKKQ93ZL._UY550_.jpg,8.450800000000003,0.22926413273496182
59,http://flipkart.com/blive-printed-men-round-neck-yellow-t-shirt/p/itm578071f5ac354?pid=TSHGBKQG6BKGUPC8&lid=LSTTSHGBKQG6BKGUPC8UFAIES&marketplace=FLIPKART&store=clo%2Fash%2Fank&srno=b_1_11&otracker=browse&fm=organic&iid=2ab0b4a3-c077-43b9-9e75-6b60fb27171b.TSHGBKQG6BKGUPC8.SEARCH&ppt=None&ppn=None&ssid=8wi3xv8uwg0000001679480069493,BLIVE ,Men Printed Round Neck Yellow T-Shirt,₹199,3.7,71657,5434,very bad😫😫 i like you 🤗 🎽 good quality🤎awesome fitting ✨amazing design for females as well✨,Flipkart,https://rukminim1.flixcart.com/image/832/832/xif0q/t-shirt/s/9/f/l-bylrn-z31-blive-original-imaggcfx6mshgcsp.jpeg?q=70,0.8978999999999999,0.21281186250712386
17,https://www.amazon.in/Jockey-2726-0105-BLACK-Black-T-Shirt-2726-0105-BLACK_Black_M/dp/B00W05Z1L6/ref=zg_bs_1968120031_sccl_18/257-0329217-1454160?psc=1,Jockey,2726 Men's Super Combed Cotton Rich Solid V Neck Half Sleeve T-Shirt,₹549,4.3,15684,2740,this is jockey so always good quality overall good superb quality very comfortable thickness of the material is perfect and breathable stuff packaging was not done properly it didnt come in amazon packet rather in plastic button cover like jockey provide amazon brand should make such mistake comfortable wearing good fit and quality material i bought 1 black t shirt overall very nice extremly comfortable good fitting value for money good nice fitting comfortable t shirt good feel after use,Amazon,https://m.media-amazon.com/images/W/IMAGERENDERING_521856-T2/images/I/71sGfOZcpwL._UY550_.jpg,7.802800000000002,0.20336369674800192
2,https://www.amazon.in/Amazon-Brand-Symbol-Mens-AW17MPCP6_L_Pomegranate/dp/B073X4H6BJ/ref=zg_bs_1968120031_sccl_3/257-0329217-1454160?psc=1,Amazon Brand - Symbol,Men's Regular Polo Shirt,₹359,3.9,21424,2827,shirt is so nice material is good\nbut i m so dissapointed due to delivery agent hi is so rude\nnot satisfied good enough cutting one star for not receiving dark green i am 510 and i ordered m size which i found perfectly fit from all angles chest and length i couldnt ask for anything more at this price fabric is fine wrt price i bought it at 369 per piece good quality good looking with good comfort the product is good and exact size need price reduce good fabric and fitting also good but colour faded dont expect muchfor the price range its ok\n\nhavent washed itbut looking at the texture have no more expectations\n\ni purchased black color and it is best vaccum cleaner for dust easily catch the dust\n\nif you are six feet and have little belly go for xl xxl if u are big  good quality product at this price,Amazon,https://m.media-amazon.com/images/W/IMAGERENDERING_521856-T2/images/I/71rzKMArJZL._UY550_.jpg,6.658600000000001,0.19516026998884473
0,https://www.amazon.in/Van-Heusen-Solid-Regular-VSKP517S011419_Nautical_X-Large/dp/B076CNJ1YN/ref=zg_bs_1968120031_sccl_1/257-0329217-1454160?psc=1,Van Heusen,Men's Regular Fit Polo Shirt,₹550,4.0,28790,3173,product is good but the problem is size mentioned is totally inaccurate amazing product fitting is good\noverall value for money the product quality is very nice the color is also exactly the same as shown the fitting is also perfect ok quality is good very nice fit its nice product nice tshirt got for 560 but its over sized buy one size small value for money,Amazon,https://m.media-amazon.com/images/W/IMAGERENDERING_521856-T2/images/I/71ISzvgAl2L._UY550_.jpg,4.6599,0.18629712505903423
86,http://flipkart.com/tripr-printed-men-round-neck-black-t-shirt/p/itm67874a0b18802?pid=TSHG9HZCAT7BZMSZ&lid=LSTTSHG9HZCAT7BZMSZQ827BA&marketplace=FLIPKART&store=clo%2Fash%2Fank&srno=b_2_41&otracker=browse&fm=organic&iid=21092790-7e41-413e-9573-facd6ed135b7.TSHG9HZCAT7BZMSZ.SEARCH&ppt=None&ppn=None&ssid=3v9mz9l50w0000001679480076415,TRIPR ,Men Printed Round Neck Black T-Shirt,₹199,3.7,46267,3195,good its good perfect 🥰 💞,Flipkart,https://rukminim1.flixcart.com/image/832/832/xif0q/t-shirt/a/t/r/xl-tblrn-d45-tripr-original-imaggcgyfmm8s4ew.jpeg?q=70,2.9087,0.18292732537051176
10,https://www.amazon.in/AMERICAN-CREW-Burgundy-T-Shirt-Applique/dp/B01LB53X3I/ref=zg_bs_1968120031_sccl_11/257-0329217-1454160?psc=1,AMERICAN CREW,Men's Polo Collar Half Sleeve T-Shirt,₹699,3.9,17309,2980,fabric is nice  comfortable but 700 is too much for it this is a great product to buy nice product the product was delivered in a neat and sturdy packing and the actual product was also a clean and neat piece of t shirt delivered thanks very good product fit was as expected will update revirw after few washes material good not fit good  nice one,Amazon,https://m.media-amazon.com/images/W/IMAGERENDERING_521856-T2/images/I/61-i8j1PHAL._UY550_.jpg,6.203500000000001,0.1819667515636215
13,https://www.amazon.in/Chromozome-Regular-T-Shirt-OS-10_White-Grey_XL/dp/B07CQN23VG/ref=zg_bs_1968120031_sccl_14/257-0329217-1454160?psc=1,Chromozome,Men Mens Tshirts,₹399,3.9,15491,3278,go for it if want to wear them as under shirts or at home not a good option to wear these outside especially when high sweating the brand is reputed and you get good quality vests at low price i bought this because i needed black and white tshirt for daily use unfortunately it cant be used outside except for gym or playing outside the quality is good and this is not thick as expected its like vests but with a little heavy fabric i like the feel except it itches at the collar i have used it as inner layering good one good shoulder length is small so this is a good set of tees product is sort of inline with the price tag dont expect life from these material is nice somehow fit differed from tee to tee black one fits nice for me but the grey ine doesnt overall 4 star purchase can recommend if you are ok with uts shorter lifespan nice produt hate the cloth quality and fitting ok very good product,Amazon,https://m.media-amazon.com/images/W/IMAGERENDERING_521856-T2/images/I/71X7pa5hBTL._UY550_.jpg,5.530100000000001,0.17458406666010057
83,http://flipkart.com/try-printed-men-polo-neck-blue-t-shirt/p/itm832f60ffa1be3?pid=TSHFSB2PDFWYEKVG&lid=LSTTSHFSB2PDFWYEKVGRAV4EO&marketplace=FLIPKART&store=clo%2Fash%2Fank&srno=b_1_38&otracker=browse&fm=organic&iid=2ab0b4a3-c077-43b9-9e75-6b60fb27171b.TSHFSB2PDFWYEKVG.SEARCH&ppt=None&ppn=None&ssid=8wi3xv8uwg0000001679480069493,Try This ,Men Printed Polo Neck Blue T-Shirt,₹299,3.9,34209,3545,best quality awesome producti just love it😍 best products according to 💰,Flipkart,https://rukminim1.flixcart.com/image/832/832/katyzrk0/t-shirt/z/y/w/xxl-ds01-try-this-original-imafsb8ju76qqhqw.jpeg?q=70,2.9943999999999997,0.16755459473237655
69,http://flipkart.com/3bros-solid-men-polo-neck-orange-t-shirt/p/itmdcdac1ea5565d?pid=TSHGBAWVHMMEFFKS&lid=LSTTSHGBAWVHMMEFFKSFJOIJY&marketplace=FLIPKART&store=clo%2Fash%2Fank&srno=b_1_23&otracker=browse&fm=organic&iid=2ab0b4a3-c077-43b9-9e75-6b60fb27171b.TSHGBAWVHMMEFFKS.SEARCH&ppt=None&ppn=None&ssid=8wi3xv8uwg0000001679480069493,3BROS ,Men Solid Polo Neck Orange T-Shirt,₹299,4.1,34638,2746,just loved it good quality 😍 very good product nice tshirt 🥰,Flipkart,https://rukminim1.flixcart.com/image/832/832/kz8qsnk0/t-shirt/z/g/u/l-db1024-12-3bros-original-imagbawkr4vxfa6u.jpeg?q=70,3.1679,0.15908656269547272
88,http://flipkart.com/eyebogler-striped-men-polo-neck-white-green-blue-t-shirt/p/itm07b4115ef6413?pid=TSHGA4MHYZHYUQGZ&lid=LSTTSHGA4MHYZHYUQGZGZAY9J&marketplace=FLIPKART&store=clo%2Fash%2Fank&srno=b_2_43&otracker=browse&fm=organic&iid=21092790-7e41-413e-9573-facd6ed135b7.TSHGA4MHYZHYUQGZ.SEARCH&ppt=None&ppn=None&ssid=3v9mz9l50w0000001679480076415,EyeBogler ,"Men Striped Polo Neck White, Green, Blue T-Shirt",₹299,4.0,39202,3343,good quality product nice product👌 good product 💯💯nice,Flipkart,https://rukminim1.flixcart.com/image/832/832/kzegk280/t-shirt/r/o/t/s-t285hs-as7whdngr-eyebogler-original-imagbfygwtubscjw.jpeg?q=70,2.032,0.1548181413877937
79,http://flipkart.com/tqh-solid-men-round-neck-white-black-t-shirt/p/itm2d2b512a67319?pid=TSHFKYCDNZKH8A76&lid=LSTTSHFKYCDNZKH8A761HMSWH&marketplace=FLIPKART&store=clo%2Fash%2Fank&srno=b_1_34&otracker=browse&fm=organic&iid=2ab0b4a3-c077-43b9-9e75-6b60fb27171b.TSHFKYCDNZKH8A76.SEARCH&ppt=None&ppn=None&ssid=8wi3xv8uwg0000001679480069493,TQH ,"Pack of 2 Men Solid Round Neck White, Black T-Shirt",₹259,4.1,25523,2885,pros    1 if you are looking for t shirts which you can whereas a layering under shirts or jackets look nowhere else this is the perfect product you are looking for just go with black white and grey or other as your choice and you are good to go    2 one of the most bang for buck t shirt combo across the two online shopping giants ive crosschecked it    3 have you ever listen about popping colour these tshirts are made of shopping colour threads    4 i was more than happy when i good product very nice fiting and product superb  i like it 😃,Flipkart,https://rukminim1.flixcart.com/image/832/832/k05ljm80/t-shirt/k/w/r/xl-poly-510-11-tqh-original-imafkygaynurrcyj.jpeg?q=70,3.8449999999999998,0.15192436689357525
34,https://www.amazon.in/Amazon-Brand-Symbol-T-Shirt-AW17PLPO5-2_XXL_Multicolor2/dp/B073X4YH55/ref=zg_bs_1968120031_sccl_35/257-0329217-1454160?psc=1,Amazon Brand - Symbol,Men's Solid Regular fit T-Shirt,"₹1,199",4.1,14471,2194,i bought these tshirts in offer for about 439 its a worth it deal but for 1100 its not that much better in my opinion wait for offers as always amazon has delivered the product up to my expectations the tshirts are well fitting and comfortable good material have been using it for a while best quality for least price good comfortable home wear and totally worth the money you pay for them thank you nice product in just rs648\nthank you amazon good not 100 cotton as mentioned\ni think its 60 cotton  40 polister\nnot too comfortable fabric but so so type super,Amazon,https://m.media-amazon.com/images/W/IMAGERENDERING_521856-T2/images/I/719yggosnuL._UY550_.jpg,6.2913000000000014,0.1418160819928872
4,https://www.amazon.in/Amazon-Brand-Symbol-T-Shirt-AW17PLPO3-6_XL_Multicolor6/dp/B073X4H5VV/ref=zg_bs_1968120031_sccl_5/257-0329217-1454160?psc=1,Amazon Brand - Symbol,Men's Regular Fit T-Shirt,₹499,4.0,16224,2363,tighter at chest area but perfect at length and waist size\nbetter to order 2 inches bigger one while ordering for people like me who exercises product is good but white black is little small reasonable price pure cotton bt the colour of dark colour clothes dissolves in water on wash worth the money spent material is good and size is perfect fit need to observe shrinkage after washing best clothes in 499 cloth is really good\nfitting is also perfect\nthanks the quality of t shirt is impressive product very nice but packing is not gud simply put inside of transparency cover  i feel little bad about packaging excellent packing isnt good also the quality of clothes isnt as expected ill prefer other tshirt at this range than this colour isnt bright as shown in the product picture,Amazon,https://m.media-amazon.com/images/W/IMAGERENDERING_521856-T2/images/I/71eWZpgtFiL._UY550_.jpg,5.031200000000001,0.13133796052388352
57,http://flipkart.com/try-color-block-men-round-neck-white-t-shirt/p/itm728167a4958a8?pid=TSHGYSUTGCFXBFXZ&lid=LSTTSHGYSUTGCFXBFXZOTWVSX&marketplace=FLIPKART&store=clo%2Fash%2Fank&srno=b_1_9&otracker=browse&fm=organic&iid=2ab0b4a3-c077-43b9-9e75-6b60fb27171b.TSHGYSUTGCFXBFXZ.SEARCH&ppt=None&ppn=None&ssid=8wi3xv8uwg0000001679480069493,Try This ,Men Color Block Round Neck White T-Shirt,₹229,3.9,33119,2744,thik is a unique tshirt and very comfortable and this look is uniquei like this type of tshirt so wonderful ❤️❤️❤️❤️ its nice but colour is slightly different as shown in image worth of money,Flipkart,https://rukminim1.flixcart.com/image/832/832/xif0q/shopsy-t-shirt/x/g/8/xl-skb-try-this-original-imag6hqngemxvfst-bb.jpeg?q=70,2.0915000000000004,0.12858946191534587
141,https://www.snapdeal.com/product/veirdo-multi-half-sleeve-tshirt/647815866925,Veirdo,Multicolor Cotton Regular Fit Men's T-Shirt ( Pack of 1 ),389,4.1,923,18,,Snapdeal,https://n4.sdlcdn.com/imgs/k/f/x/Veirdo-100-Cotton-Regular-Fit-SDL933679151-1-94e71.jpg,0.0,0.1260734886206375
55,http://flipkart.com/try-color-block-men-round-neck-white-black-t-shirt/p/itme7eb0664937f4?pid=TSHGYCHZYUEHX5TX&lid=LSTTSHGYCHZYUEHX5TXKCSGEN&marketplace=FLIPKART&store=clo%2Fash%2Fank&srno=b_1_7&otracker=browse&fm=organic&iid=2ab0b4a3-c077-43b9-9e75-6b60fb27171b.TSHGYCHZYUEHX5TX.SEARCH&ppt=None&ppn=None&ssid=8wi3xv8uwg0000001679480069493,Try This ,"Men Color Block Round Neck White, Black T-Shirt",₹199,4.1,25444,2132,good🥰❤️🎉 nice product👌👌 good product 👍,Flipkart,https://rukminim1.flixcart.com/image/832/832/kl6wx3k0/t-shirt/y/n/i/s-bbt-try-this-original-imagydarhsryeahn.jpeg?q=70,2.6843,0.1119165027909472
65,http://flipkart.com/blive-solid-men-henley-neck-black-t-shirt/p/itmf2b3327b8000a?pid=TSHFVPFKY4Y8GZWU&lid=LSTTSHFVPFKY4Y8GZWUCDZMTH&marketplace=FLIPKART&store=clo%2Fash%2Fank&srno=b_1_19&otracker=browse&fm=organic&iid=2ab0b4a3-c077-43b9-9e75-6b60fb27171b.TSHFVPFKY4Y8GZWU.SEARCH&ppt=None&ppn=None&ssid=8wi3xv8uwg0000001679480069493,BLIVE ,Men Solid Henley Neck Black T-Shirt,₹279,3.8,26806,1858,perfect 🤗🤗🤗 nice nice product👍🏻❤❤❤,Flipkart,https://rukminim1.flixcart.com/image/832/832/xif0q/t-shirt/n/f/b/m-bblhenful-z14-blive-original-imaghau6sru9ggnn.jpeg?q=70,3.1549,0.11130811429027626
72,http://flipkart.com/eyebogler-striped-men-polo-neck-blue-t-shirt/p/itm186f6204480bb?pid=TSHGB2RY9C8Y2GKH&lid=LSTTSHGB2RY9C8Y2GKHM7WIC4&marketplace=FLIPKART&store=clo%2Fash%2Fank&srno=b_1_26&otracker=browse&fm=organic&iid=2ab0b4a3-c077-43b9-9e75-6b60fb27171b.TSHGB2RY9C8Y2GKH.SEARCH&ppt=None&ppn=None&ssid=8wi3xv8uwg0000001679480069493,EyeBogler ,Men Striped Polo Neck Blue T-Shirt,₹299,3.8,29438,2120,very very nice product quality is good as value of item quality of fabric  is good its this so you wear in summer feel relaxy a1 mohit good product,Flipkart,https://rukminim1.flixcart.com/image/832/832/l1grgcw0/t-shirt/x/o/5/m-t428hs-tm5p-eyebogler-original-imagdf2egzjxeqgk.jpeg?q=70,2.0827,0.10725343830324008
121,https://www.snapdeal.com/product/veirdo-multi-round-tshirt/653590341630,Veirdo,Multicolor Cotton Regular Fit Men's T-Shirt ( Pack of 1 ),399,4.1,656,8,,Snapdeal,https://n3.sdlcdn.com/imgs/k/e/z/Veirdo-100-Cotton-Regular-Fit-SDL804966523-1-efdbf.jpg,0.0,0.08960369288747366
63,http://flipkart.com/moonvelly-solid-men-polo-neck-green-t-shirt/p/itm3f860aa725c5b?pid=TSHGGKPH6BPPEGUG&lid=LSTTSHGGKPH6BPPEGUGKOU2SU&marketplace=FLIPKART&store=clo%2Fash%2Fank&srno=b_1_17&otracker=browse&fm=organic&iid=2ab0b4a3-c077-43b9-9e75-6b60fb27171b.TSHGGKPH6BPPEGUG.SEARCH&ppt=None&ppn=None&ssid=8wi3xv8uwg0000001679480069493,MOONVELLY ,Men Solid Polo Neck Green T-Shirt,₹279,3.7,23479,1729,liked it size l osm product 👍 good quality tshirt nice value of money,Flipkart,https://rukminim1.flixcart.com/image/832/832/xif0q/t-shirt/k/o/9/xxl-ts-658-rama-moonvelly-original-imaggkphvfes4gx8.jpeg?q=70,2.0822,0.08456046152723516
70,http://flipkart.com/young-trendz-printed-men-round-neck-black-orange-t-shirt/p/itmf3ywyfutdtt6f?pid=TSHEW39G7G2VGB7N&lid=LSTTSHEW39G7G2VGB7NGHRBBT&marketplace=FLIPKART&store=clo%2Fash%2Fank&srno=b_1_24&otracker=browse&fm=organic&iid=en_oMacTQNugFqdnMJuVQBMjh5E3fHP8De5Bbp00da6qwWyND3eIwtCCdXjxc7QIURX%2B0dqqQXp4raD56OH2RnIJA%3D%3D&ppt=None&ppn=None&ssid=8wi3xv8uwg0000001679480069493,Young trendz ,"Men Printed Round Neck Black, Orange T-Shirt",₹245,3.9,21931,2525,value for money 👍👍 tshirt is nice but ultimately it depends on person who wear it that how it looks awesome product,Flipkart,https://rukminim1.flixcart.com/image/832/832/xif0q/t-shirt/u/h/l/m-hs-omm-trisul-orange-young-trendz-original-imagadgkyhfkdrye-bb.jpeg?q=70,1.3864,0.0829296426809981
99,http://flipkart.com/trends-tower-solid-men-round-neck-maroon-t-shirt/p/itmf7fvxehz7raar?pid=TSHF7FPGS8GUKYZH&lid=LSTTSHF7FPGS8GUKYZH4IDXRA&marketplace=FLIPKART&store=clo%2Fash%2Fank&srno=b_2_59&otracker=browse&fm=organic&iid=21092790-7e41-413e-9573-facd6ed135b7.TSHF7FPGS8GUKYZH.SEARCH&ppt=None&ppn=None&ssid=3v9mz9l50w0000001679480076415,Trends Tower ,Men Solid Round Neck Maroon T-Shirt,₹280,4.0,21695,2088,fabulousmust buy good clothes nic and very comfortable but low price i am satisfied this t shirt nice product,Flipkart,https://rukminim1.flixcart.com/image/832/832/kcgk1ow0/t-shirt/d/i/z/xl-hsb11-mrn-trends-tower-original-imaftkustrjqthgy.jpeg?q=70,1.5208,0.08135189633588333
14,https://www.amazon.in/Max-Mens-Solid-Slim-AMPSP2001HSCNAVY_Navy/dp/B08353M893/ref=zg_bs_1968120031_sccl_15/257-0329217-1454160?psc=1,Max,Men Tshirt,₹399,4.0,12106,873,fit is fine and comfort is okay with budget good product a good quality t shirt ie wearing comfort and value for money after washing also the product retained its quality i purchased xl a person wearing 40 or 42 shirt must select xl or xxl l and m will be much smaller the purchasing price was 350 rs colour is same as shown in picture quality of product is good small in size want to buy bigger size osm product 👍😊😊 good product nice fit good the quality is okay but not great as the material is bit on softer side and is bit thinner when compared to other polo tshirts from alan jones classic polo jack and jones peter england etc value for money,Amazon,https://m.media-amazon.com/images/W/IMAGERENDERING_521856-T2/images/I/81vHlgI1+dL._UY550_.jpg,7.490000000000001,0.08071843001295195
157,https://www.snapdeal.com/product/the-million-club-polyester-green/628134545303,The Million Club,Green Polyester Regular Fit Men's T-Shirt ( Pack of 1 ),359,4.1,579,12,,Snapdeal,https://n2.sdlcdn.com/imgs/k/d/7/The-Million-Club-Polyester-Green-SDL989146745-1-ff979.jpg,0.0,0.07908618625281592
24,https://www.amazon.in/Amazon-Brand-Striped-Regular-AW17MPCSP4_Pomegrante/dp/B08FBYVDDR/ref=zg_bs_1968120031_sccl_25/257-0329217-1454160?psc=1,Amazon Brand - Symbol,Men's Regular Fit Polo Shirt,₹429,3.9,10738,1158,good quality tshirt product is as expected but packaging was very bad  i mean there wasnt any packging at allthats bad atleast non transparent paper bag would be good स्वयं के लिए किया loved it\n\ncant imagine how i got such high quality material at low prize im lucky\n\nnice fabrics look nice super comfortable\nno issue with products 100 percent satisfaction in all aspects nice 👍 good 👍 fully satisfied i brought this product for really cheap at some sale here in amazon i expected the quality to be decent since the price was not much and there were 9 reviews for the product but then since i have already brought clothing from symbol i guess it would be decent or atleast great for what i paid for but then it turned out to be great and the color and design looked exactly as shown in the pic and the cloth type is good very light weight too i regret to have brought only one when i got it for such a competitive price nice tshirtvery comfortable,Amazon,https://m.media-amazon.com/images/W/IMAGERENDERING_521856-T2/images/I/71rjzNln29L._UY550_.jpg,5.934300000000001,0.07882568554540292
