index,url,brand,name,price,stars,num_ratings,num_reviews,reviews,platform,image,vader_score,final_score
6,https://www.amazon.in/Billford-Mens-Jeans-2_BFD-JJ3_Light-Blue_32/dp/B0B86GR5MK/ref=zg_bs_1968076031_sccl_7/257-0329217-1454160?psc=1,Billford,Men Jeans,₹629,3.5,266,70,best jeans at affordable price quality not at par  vantage be recommend good looking only length issue 41 inch other wise all good  if u have 57 inch hight go for it but if  this dont buy become white after two wash\ndo not wash keep on wearing till it smells then this away clothes quality kuch khas nahi hai length bada hai my west size 34 hai par 32 fit aya hai price is reasonable considering the moderate quality exellent product as per cost i did not like the product it was looking so cheap so i returned it worth item,Amazon,https://m.media-amazon.com/images/W/IMAGERENDERING_521856-T2/images/I/71a3OycnGYL._UY550_.jpg,3.3043000000000005,0.008024776491556645
89,http://flipkart.com/levi-s-511-slim-men-blue-jeans/p/itm5afe3cd937139?pid=JEAGDWFPSVYBFZGC&lid=LSTJEAGDWFPSVYBFZGCEB8UKR&marketplace=FLIPKART&store=clo%2Fvua%2Fk58%2Fi51&srno=b_2_54&otracker=browse&fm=organic&iid=6d051f10-010e-4737-ac1b-4cefe8b77e4c.JEAGDWFPSVYBFZGC.SEARCH&ppt=None&ppn=None&ssid=homar62vgg0000001679480291644,LEVI'S ,511 Men Slim Mid Rise Blue Jeans,"₹1,928",4.0,469,37,good very good product levis 511 is best pair of jeans u ever get the fitting of 511 is very classy love the way its looks on my body,Flipkart,https://rukminim1.flixcart.com/image/832/832/xif0q/jean/v/3/4/32-18298-1273-levi-s-original-imaghfku7grahk6p.jpeg?q=70,2.5949999999999998,0.007765002126334606
55,http://flipkart.com/levi-s-511-slim-men-blue-jeans/p/itm2198ade129c2c?pid=JEAGDWYYQ2M6Z9FG&lid=LSTJEAGDWYYQ2M6Z9FGTZMROJ&marketplace=FLIPKART&store=clo%2Fvua%2Fk58%2Fi51&srno=b_1_11&otracker=browse&fm=organic&iid=36d2601a-dec5-4170-987b-110e79c39c2b.JEAGDWYYQ2M6Z9FG.SEARCH&ppt=None&ppn=None&ssid=mgoz6165hs0000001679480290475,LEVI'S ,511 Men Slim Mid Rise Blue Jeans,"₹1,904",3.9,484,35,good quality super good super super product,Flipkart,https://rukminim1.flixcart.com/image/832/832/xif0q/jean/b/0/3/32-18298-1229-levi-s-original-imagj6ww3njskjzh.jpeg?q=70,2.6790000000000003,0.007748427642210672
97,https://www.snapdeal.com/product/urbanmark-black-cotton-blend-regular/664417763237#bcrumbLabelId:194,UrbanMark Men Slim Fit Mid Rise Black Stretchable Jea,UrbanMark Men Slim Fit Mid Rise Black Stretchable Jeans,899,3.6,14,0,,Snapdeal,https://n1.sdlcdn.com/imgs/k/l/m/UrbanMark-Black-Cotton-Blend-Regular-SDL347335533-1-7f513.jpg,0.0,0.0075012055508921075
98,https://www.snapdeal.com/product/urban-mark-dark-blue-denim/680524084300#bcrumbLabelId:194,UrbanMark Men Slim Fit Light Wash Dark Blue Stretchable Jea,UrbanMark Men Slim Fit Light Wash Dark Blue Stretchable Jeans,799,3.6,14,0,,Snapdeal,https://n4.sdlcdn.com/imgs/k/k/i/Urban-Mark-Dark-Blue-Denim-SDL532868691-1-5bc4b.jpg,0.0,0.0075012055508921075
24,https://www.amazon.in/Amazon-Brand-Inkast-Jogger-INK-SB-CL-JG-218_Blue-2_30/dp/B09CH3Y67D/ref=zg_bs_1968076031_sccl_25/257-0329217-1454160?psc=1,Amazon Brand - Inkast Denim Co.,Men Jeans,₹709,4.0,354,27,ive ordered 38size the fitz goods cloth quality is quite good for this price range looks premium and good fit  अलग colour चाहीये7 good product nice fit very good fabric quality like every bit of it perfectly fits  very much stylish i rarely give 5star this deserve 5 but maine ise tight kiya lekin mast product excellent product  material good,Amazon,https://m.media-amazon.com/images/W/IMAGERENDERING_521856-T2/images/I/91pHAuhY-oL._UY550_.jpg,4.915900000000001,0.007229619701247688
61,http://flipkart.com/levi-s-513-slim-men-blue-jeans/p/itm7c48de3d25414?pid=JEAG525XGYBTZVAR&lid=LSTJEAG525XGYBTZVARKWLZOW&marketplace=FLIPKART&store=clo%2Fvua%2Fk58%2Fi51&srno=b_1_20&otracker=browse&fm=organic&iid=en_As4UQsenXSGAygZ%2BEiykADI4hxqWHYoNgbN6%2F5JlbGojcwl%2F%2Fj8HxlihnvjbD54STktjihLgTpBtAAATDGNxSg%3D%3D&ppt=None&ppn=None&ssid=mgoz6165hs0000001679480290475,LEVI'S ,513 Men Slim Mid Rise Blue Jeans,"₹1,049",4.0,267,30,looks not at all beautiful pair of jeans nice shade of blue not clean look nor distressed some what different from my earlier ones without faded look inseam is 32 slim from hip to knee and straight from there is 513 fit sits above waist the leg opening is slightly wider than the 511 overall happy get a 2021 stock happy with the purchase thank you flipkart nice,Flipkart,https://rukminim1.flixcart.com/image/832/832/xif0q/jean/f/k/7/-original-imagnu3zqbwfzg4j.jpeg?q=70,3.5153,0.0055743535435811755
141,https://www.snapdeal.com/product/hj-hasasi-olive-denim-slim/623118513476,HJ HASASI,Olive Denim Slim Fit Men's Jeans ( Pack of 1 ),1075,4.1,8,1,,Snapdeal,https://n4.sdlcdn.com/imgs/k/l/7/HJ-HASASI-Olive-Denim-Slim-SDL420008128-1-d55a7.jpg,0.0,0.004881736945818673
57,http://flipkart.com/levi-s-511-slim-men-grey-jeans/p/itm5a28cd3f4672f?pid=JEAGDWFNKS7C6G8K&lid=LSTJEAGDWFNKS7C6G8KE8PKCV&marketplace=FLIPKART&store=clo%2Fvua%2Fk58%2Fi51&srno=b_1_14&otracker=browse&fm=organic&iid=36d2601a-dec5-4170-987b-110e79c39c2b.JEAGDWFNKS7C6G8K.SEARCH&ppt=None&ppn=None&ssid=mgoz6165hs0000001679480290475,LEVI'S ,511 Men Slim Mid Rise Grey Jeans,"₹1,919",3.9,350,29,full comfortable pant average quality awesome look and quality of febric,Flipkart,https://rukminim1.flixcart.com/image/832/832/xif0q/jean/d/o/h/32-18298-1250-levi-s-original-imaggecycdfhhtph.jpeg?q=70,1.1355,0.004811074783784192
21,https://www.amazon.in/KARGEENS-Mens-Slim-Jeans-k70014d_Pista_34/dp/B0BBPBDMD7/ref=zg_bs_1968076031_sccl_22/257-0329217-1454160?psc=1,KARGEENS,Men Jeans,₹599,3.3,192,28,apane liye nice jean pant with stretchable  slim with less weight jeans\nless weight jeans good for summer season satisfied its a cheap quality product bought 3 but you know what to expect with this budget friendly brand my buckle got damaged on the very first day sr quality and size is perfect but disappointed after opening the packet the colour is not as ordered please care the customers choice first good fabric and stretchable also ankle length material was good size was as expected good quality and nice colour jeans this product is worth for money,Amazon,https://m.media-amazon.com/images/W/IMAGERENDERING_521856-T2/images/I/81CCu7aiqXL._UY550_.jpg,4.2132,0.004565439581534584
2,https://www.amazon.in/Levis-Mens-Jeans-18298-1253_Solid-Black_32/dp/B09Z781TTL/ref=zg_bs_1968076031_sccl_3/257-0329217-1454160?psc=1,Levi's,Men's 511 Styled Slim Fit Jeans,"₹1,884",4.0,291,33,the name is enough levisgo for it its a genuine one\ni got under 1500rs reasonable price only concern about price is high quality  color all good one can go for it only thing is that its is not slim fit its somewhat straight… i bought size 36 but its a bit loose but its manageable colour size and fit as per description snugly fits at your thighs stretchable material comfortable to wear outside at any weather but prefer to use it at colder climates for a price of ₹699 its a steal go for it genuine levis 1 number for use like as expected,Amazon,https://m.media-amazon.com/images/W/IMAGERENDERING_521856-T2/images/I/61squlDBu2L._UY550_.jpg,1.2997000000000003,0.004438997647112416
65,http://flipkart.com/levi-s-512-regular-men-blue-jeans/p/itm15e287b07f61f?pid=JEAGDWFHHESRPFBN&lid=LSTJEAGDWFHHESRPFBNPE5MIR&marketplace=FLIPKART&store=clo%2Fvua%2Fk58%2Fi51&srno=b_1_25&otracker=browse&fm=organic&iid=36d2601a-dec5-4170-987b-110e79c39c2b.JEAGDWFHHESRPFBN.SEARCH&ppt=None&ppn=None&ssid=mgoz6165hs0000001679480290475,Levi's ,512 Men Regular Mid Rise Blue Jeans,"₹1,928",4.0,255,17,not upto mark quality good product levis this one pant made me forget all the brands i wore till date  awesome 👍😎 quality  thanks levis and flipkart 💯💯💯,Flipkart,https://rukminim1.flixcart.com/image/832/832/xif0q/jean/p/a/e/32-36087-0603-levi-s-original-imagj6wwhknv6dqu.jpeg?q=70,1.7382,0.0037073524239496516
58,http://flipkart.com/flying-machine-skinny-men-blue-jeans/p/itm1c1806dda0bcd?pid=JEAFN2CJGH4VJTGX&lid=LSTJEAFN2CJGH4VJTGXM50N0N&marketplace=FLIPKART&store=clo%2Fvua%2Fk58%2Fi51&srno=b_1_16&otracker=browse&fm=organic&iid=en_As4UQsenXSGAygZ%2BEiykADI4hxqWHYoNgbN6%2F5JlbGoGKc9wGvvW1TEMSHLA2%2BRBFhPjOnkxVfzgKGnzXx2Ejg%3D%3D&ppt=None&ppn=None&ssid=mgoz6165hs0000001679480290475,FLYING MACHINE ,Men Skinny Mid Rise Blue Jeans,"₹1,299",4.2,231,19,not good this product is not good nice,Flipkart,https://rukminim1.flixcart.com/image/832/832/klphn680/jean/n/m/d/32-fmjn9669-flying-machine-original-imagyrhwx9z2kgga.jpeg?q=70,1.3023,0.0034499633194319734
14,https://www.amazon.in/Levis-Mens-Jeans-18298-1061_Mid-Indigo_34/dp/B09RSN2824/ref=zg_bs_1968076031_sccl_15/257-0329217-1454160?psc=1,Levi's,Men's 511 Slim Fit Jeans,"₹1,399",3.8,138,14,the fit was all great snug fit the colour is also good pretty unique looser fitting than expected but comfortable as always up to the mark jeans by levis only have to order a size smaller as it fits loose as for 32 you have to order a 30 brought it for my father it looks good and nice fitting product is more then value for money dull color  dont buy just ok cloth material fit was more like 512 the fitting is ok but the item weight is very less it is just 220 gms whereas in the product description its mentioned 650 gms though it looks like levis product its not the real jeans i would not recommend to purchase this product as its made in early 2021 and seems like too old and dirty \nrust mark everywhere\npics are attached looks not original brand,Amazon,https://m.media-amazon.com/images/W/IMAGERENDERING_521856-T2/images/I/71uN6fEmReL._UY550_.jpg,5.5498,0.0033256876044646284
94,http://flipkart.com/killer-slim-men-grey-jeans/p/itm348a9f57f12ee?pid=JEAGF5MGJV2R9HFS&lid=LSTJEAGF5MGJV2R9HFSD0GWQR&marketplace=FLIPKART&store=clo%2Fvua%2Fk58%2Fi51&srno=b_2_59&otracker=browse&fm=organic&iid=6d051f10-010e-4737-ac1b-4cefe8b77e4c.JEAGF5MGJV2R9HFS.SEARCH&ppt=None&ppn=None&ssid=homar62vgg0000001679480291644,KILLER ,Men Slim Mid Rise Grey Jeans,"₹1,704",3.9,189,23,very good nice product 👌 not good quality,Flipkart,https://rukminim1.flixcart.com/image/832/832/xif0q/jean/u/g/v/32-9484-slm-slmft-gry-killer-original-imaggjfgryzgshdy.jpeg?q=70,2.032,0.0032556089377996558
48,http://flipkart.com/levi-s-512-regular-men-blue-jeans/p/itm0be85cf0ee612?pid=JEAGDWFRYHJP872M&lid=LSTJEAGDWFRYHJP872MVUNNZO&marketplace=FLIPKART&store=clo%2Fvua%2Fk58%2Fi51&srno=b_1_4&otracker=browse&fm=organic&iid=36d2601a-dec5-4170-987b-110e79c39c2b.JEAGDWFRYHJP872M.SEARCH&ppt=None&ppn=None&ssid=mgoz6165hs0000001679480290475,LEVI'S ,512 Men Regular Mid Rise Blue Jeans,"₹1,759",3.9,300,24,fabric is not expected worst product i had ever seen very poor quality,Flipkart,https://rukminim1.flixcart.com/image/832/832/l4zxn680/jean/z/f/4/32-36087-0596-levi-s-original-imagfrvhpuvc9g8r.jpeg?q=70,-1.1016,0.002882211980307021
77,http://flipkart.com/flying-machine-tapered-fit-men-blue-jeans/p/itm06b46bc3c8f2e?pid=JEAGDQETH3FKZ7KP&lid=LSTJEAGDQETH3FKZ7KPCSSZSG&marketplace=FLIPKART&store=clo%2Fvua%2Fk58%2Fi51&srno=b_1_40&otracker=browse&fm=organic&iid=en_As4UQsenXSGAygZ%2BEiykADI4hxqWHYoNgbN6%2F5JlbGrqfrLeEfIjFZ%2FEdEqeYF%2BDABb1gO9GF7%2FWkPOVZjJ9Dg%3D%3D&ppt=None&ppn=None&ssid=mgoz6165hs0000001679480290475,FLYING MACHINE ,Men Tapered Fit Low Rise Blue Jeans,"₹1,299",4.2,154,18,nice product 👍👍👍👍 five star ✴️✴️✴️✴️✴️ great quality 👌 like thik products and fast delivery boy 👍,Flipkart,https://rukminim1.flixcart.com/image/832/832/l44hyfk0/jean/s/a/r/32-fmjno2214-flying-machine-original-imagf3fsz8qtt4uz.jpeg?q=70,2.1373,0.0027991033740339625
32,https://www.amazon.in/Levis-Mens-Jeans-18298-1224_Dark-Indigo_34/dp/B09Z77CN73/ref=zg_bs_1968076031_sccl_33/257-0329217-1454160?psc=1,Levi's,Men's 511 Slim Fit Jeans,"₹1,884",4.2,109,9,product quality good need to customise according to your choice amazing quality genuine product fit is good when it comes to jeans and all my first choice is always levis and specifically the 511 segment as usual i just loved it 511 has good fit for a person like me  denim colour is good  got it in deal under 1500  material is a bit heavy perfect in all sense just rush for it good material and excellent fittings clothing quality good too rough a material unlike levis i am a big fan of levis  have been wearing since 15years but this product doesnt feel authentic though fitting is good,Amazon,https://m.media-amazon.com/images/W/IMAGERENDERING_521856-T2/images/I/81FKzPIml5L._UY550_.jpg,6.8137000000000025,0.002755544028853604
81,http://flipkart.com/levi-s-512-regular-men-blue-jeans/p/itm75a0a4c03e6f3?pid=JEAGDWFGTGHVGT5E&lid=LSTJEAGDWFGTGHVGT5E2SKSUY&marketplace=FLIPKART&store=clo%2Fvua%2Fk58%2Fi51&srno=b_2_46&otracker=browse&fm=organic&iid=6d051f10-010e-4737-ac1b-4cefe8b77e4c.JEAGDWFGTGHVGT5E.SEARCH&ppt=None&ppn=None&ssid=homar62vgg0000001679480291644,LEVI'S ,512 Men Regular Mid Rise Blue Jeans,"₹1,884",3.8,245,18,the product is tinted and colour coming offfabric is not too much good as expected than price horrible product poor quality cloth,Flipkart,https://rukminim1.flixcart.com/image/832/832/l4zxn680/jean/o/g/f/32-36087-0626-levi-s-original-imagfrv6khzcr26g.jpeg?q=70,-0.5786,0.002534729248892885
91,http://flipkart.com/wrogn-regular-men-grey-jeans/p/itmbc6ce32c0186d?pid=JEAFUQFHDG5VFHZQ&lid=LSTJEAFUQFHDG5VFHZQRBZ3LC&marketplace=FLIPKART&store=clo%2Fvua%2Fk58%2Fi51&srno=b_2_56&otracker=browse&fm=organic&iid=en_fkSh4knKDQ3THAEiHHAZIniT%2BzVs5iOAUNwQQNS5KmbnyazmSVe4W%2FgdsutXTIqiPmVaNIwxltmEfmw6drGDUQ%3D%3D&ppt=None&ppn=None&ssid=homar62vgg0000001679480291644,WROGN ,Men Regular Mid Rise Grey Jeans,"₹1,429",3.7,297,34,dont buy it its dull within one hour ear very good very bad product useless after one wash look like old one and and quality of cloth is also very bad,Flipkart,https://rukminim1.flixcart.com/image/832/832/kfh5ifk0-0/jean/y/v/5/32-wijn0752-wrogn-original-imafvxdczkkfaume.jpeg?q=70,-1.1064,0.0024166596762409433
123,https://www.snapdeal.com/product/halogen-white-denim-skinny-fit/644706159504,HALOGEN,White Denim Skinny Fit Men's Jeans ( Pack of 1 ),1149,5.0,3,0,,Snapdeal,https://n4.sdlcdn.com/imgs/k/l/o/HALOGEN-White-Denim-Skinny-Fit-SDL204084537-1-3b8a5.jpg,0.0,0.0022325016520512225
145,https://www.snapdeal.com/product/realize-blue-cotton-slim-fit/644743230209,Re,ize - Blue Cotton Slim Fit Men's Jeans ( Pack of 1 ),875,5.0,3,0,,Snapdeal,https://n4.sdlcdn.com/imgs/k/k/l/Rea-lize-Blue-Cotton-Slim-SDL982664071-1-efd4e.JPG,0.0,0.0022325016520512225
64,http://flipkart.com/flying-machine-slim-men-dark-blue-jeans/p/itm6bec24651bd5e?pid=JEAGDQETZHGYEFEP&lid=LSTJEAGDQETZHGYEFEP7SONXS&marketplace=FLIPKART&store=clo%2Fvua%2Fk58%2Fi51&srno=b_1_24&otracker=browse&fm=organic&iid=en_As4UQsenXSGAygZ%2BEiykADI4hxqWHYoNgbN6%2F5JlbGqyet%2Bm1J78chGkpS%2FjKz4xDPL8Ze1rx0PJNJU0gKRT0w%3D%3D&ppt=None&ppn=None&ssid=mgoz6165hs0000001679480290475,FLYING MACHINE ,Men Slim Mid Rise Dark Blue Jeans,"₹1,299",4.0,127,13,jeans is soo good and lightweight and soft cotton and slim fit color is same as given in photo thank you flipkart for right choice go for it good product comfortable jeans,Flipkart,https://rukminim1.flixcart.com/image/832/832/l47cu4w0/jean/a/k/q/32-fmjno2210-flying-machine-original-imagf5zamzdgpsgh.jpeg?q=70,2.1138000000000003,0.0021362824272477426
76,http://flipkart.com/killer-slim-men-dark-blue-jeans/p/itm5f20f42503be7?pid=JEAGEDQETGBZF5CF&lid=LSTJEAGEDQETGBZF5CFDDIROG&marketplace=FLIPKART&store=clo%2Fvua%2Fk58%2Fi51&srno=b_1_39&otracker=browse&fm=organic&iid=36d2601a-dec5-4170-987b-110e79c39c2b.JEAGEDQETGBZF5CF.SEARCH&ppt=None&ppn=None&ssid=mgoz6165hs0000001679480290475,KILLER ,Men Slim Mid Rise Dark Blue Jeans,"₹1,224",3.7,172,18,awesome 😎👍 bad quality not expected,Flipkart,https://rukminim1.flixcart.com/image/832/832/xif0q/jean/6/o/b/-original-imaggjcyncmauhhg.jpeg?q=70,0.5413999999999999,0.002115693033327753
86,http://flipkart.com/wrangler-slim-men-dark-blue-jeans/p/itm589277449122e?pid=JEAGEHB6QZUZGNEQ&lid=LSTJEAGEHB6QZUZGNEQPDENEG&marketplace=FLIPKART&store=clo%2Fvua%2Fk58%2Fi51&srno=b_2_51&otracker=browse&fm=organic&iid=6d051f10-010e-4737-ac1b-4cefe8b77e4c.JEAGEHB6QZUZGNEQ.SEARCH&ppt=None&ppn=None&ssid=homar62vgg0000001679480291644,Wrangler ,Men Slim Low Rise Dark Blue Jeans,"₹1,399",3.9,151,8,too bad good but not as expect nice product,Flipkart,https://rukminim1.flixcart.com/image/832/832/xif0q/jean/6/8/x/32-wmjn003585-wrangler-original-imaghydzehyp8akz.jpeg?q=70,0.3196,0.0018110324331041293
16,https://www.amazon.in/Levis-Skinny-Jeans-65504-0582_Dark-Indigo_34/dp/B09PVLW9ZB/ref=zg_bs_1968076031_sccl_17/257-0329217-1454160?psc=1,Levi's,Men's Skinny Jeans,"₹1,289",3.7,99,12,play video size chart for most of the levis products are not correct needs correction this is original jeans check videos how to identify duplicate happy with my purchase at levi’s store the same jeans is 15k more levi s jeans is very bad product amazon is not good garment to provide  fabric quality and colour and stretch osm 👌👌 my order dark indigo received black colour packing very bad pic dekhkar mat lena fabric is very thin  cheap quality  this jeans was special to me for it was comparatively a little expensive but did not meet the expectations bound to return the same to amazon shall perhaps order a new one next,Amazon,https://m.media-amazon.com/images/W/IMAGERENDERING_521856-T2/images/I/71HXhUz1FCL._UY550_.jpg,2.2491,0.001703354624523305
82,http://flipkart.com/wrangler-skinny-men-dark-blue-jeans/p/itmeea3f8e107952?pid=JEAGEYCWMDZQ9P85&lid=LSTJEAGEYCWMDZQ9P85CFDEFC&marketplace=FLIPKART&store=clo%2Fvua%2Fk58%2Fi51&srno=b_2_47&otracker=browse&fm=organic&iid=6d051f10-010e-4737-ac1b-4cefe8b77e4c.JEAGEYCWMDZQ9P85.SEARCH&ppt=None&ppn=None&ssid=homar62vgg0000001679480291644,Wrangler ,Men Skinny Low Rise Dark Blue Jeans,"₹1,399",3.7,107,13,excellent product cheap material  not worth it great,Flipkart,https://rukminim1.flixcart.com/image/832/832/l41n2q80/jean/4/l/a/32-wmjn003546-wrangler-original-imagff7wrbhpbhfy.jpeg?q=70,1.4231,0.0015986571728713484
53,http://flipkart.com/levi-s-slim-men-blue-jeans/p/itm0434b7a910f31?pid=JEAGJYT3QX64KRJJ&lid=LSTJEAGJYT3QX64KRJJ5FIZYD&marketplace=FLIPKART&store=clo%2Fvua%2Fk58%2Fi51&srno=b_1_9&otracker=browse&fm=organic&iid=36d2601a-dec5-4170-987b-110e79c39c2b.JEAGJYT3QX64KRJJ.SEARCH&ppt=None&ppn=None&ssid=mgoz6165hs0000001679480290475,LEVI'S ,Men Slim Mid Rise Blue Jeans,"₹1,919",4.2,113,5,perfect fit go for it actually do buy 512 slim if you like some loose fit then go for 511 size mismatch very loose very bad experience good product but colour is fade,Flipkart,https://rukminim1.flixcart.com/image/832/832/xif0q/jean/s/0/w/32-36087-0697-levi-s-original-imagkgv9rgnsjgkh.jpeg?q=70,0.9171999999999999,0.0015168880338799016
170,https://www.snapdeal.com/product/apricorn-black-cotton-blend-skinny/638678360811,Apricorn,Black Cotton Blend Skinny Fit Men's Jeans ( Pack of 1 ),999,5.0,2,0,,Snapdeal,https://n3.sdlcdn.com/imgs/k/l/6/Apricorn-Black-Cotton-Blend-Skinny-SDL763455423-1-e603e.png,0.0,0.001488334434700815
47,http://flipkart.com/flying-machine-skinny-men-blue-jeans/p/itm0ccd12d265255?pid=JEAGFAYYN8ZJF4G2&lid=LSTJEAGFAYYN8ZJF4G2FUSQQ3&marketplace=FLIPKART&store=clo%2Fvua%2Fk58%2Fi51&srno=b_1_2&otracker=browse&fm=organic&iid=en_As4UQsenXSGAygZ%2BEiykADI4hxqWHYoNgbN6%2F5JlbGo49%2BwYz1KZWuL3fhp1b%2F9snRv9F970poBh9HbOddRKpA%3D%3D&ppt=None&ppn=None&ssid=mgoz6165hs0000001679480290475,FLYING MACHINE ,Men Skinny Mid Rise Blue Jeans,"₹1,124",3.9,106,9,great nice product average,Flipkart,https://rukminim1.flixcart.com/image/832/832/xif0q/jean/o/1/u/-original-imaghej7z9m6ztdm.jpeg?q=70,1.0464,0.0014444551559090802
70,http://flipkart.com/levi-s-511-slim-men-blue-jeans/p/itm5f0f07d70dd1c?pid=JEAG525YPYDDMKHN&lid=LSTJEAG525YPYDDMKHNR1BQN7&marketplace=FLIPKART&store=clo%2Fvua%2Fk58%2Fi51&srno=b_1_32&otracker=browse&fm=organic&iid=en_As4UQsenXSGAygZ%2BEiykADI4hxqWHYoNgbN6%2F5JlbGoNX1NaHcjfNGnOWTJ5%2Be6iFPTzTJVB6VKV0Vz2YFei%2Bw%3D%3D&ppt=None&ppn=None&ssid=mgoz6165hs0000001679480290475,LEVI'S ,511 Men Slim Mid Rise Blue Jeans,"₹1,049",3.8,105,6,original products and very comfortable i am using levis for the last 20 years and this product is very good extra long good product 👍,Flipkart,https://rukminim1.flixcart.com/image/832/832/xif0q/jean/x/a/y/-original-imagnu3nudaxqbv8.jpeg?q=70,1.7096,0.001420669892246388
56,http://flipkart.com/flying-machine-skinny-men-black-jeans/p/itm64d7148b31c2d?pid=JEAGDQET3GYWC7YU&lid=LSTJEAGDQET3GYWC7YUSFKAFV&marketplace=FLIPKART&store=clo%2Fvua%2Fk58%2Fi51&srno=b_1_12&otracker=browse&fm=organic&iid=en_As4UQsenXSGAygZ%2BEiykADI4hxqWHYoNgbN6%2F5JlbGpud8oGUBFPStV0Ir%2B7anPTddLxzeRomgFhc3u3V5HqAQ%3D%3D&ppt=None&ppn=None&ssid=mgoz6165hs0000001679480290475,FLYING MACHINE ,Men Skinny Mid Rise Black Jeans,"₹1,169",4.0,105,10,fitting is perfect quality of material is not upto mark colour is very dull dont buy this not nice,Flipkart,https://rukminim1.flixcart.com/image/832/832/l44hyfk0/jean/7/n/e/32-fmjno2189-flying-machine-original-imagf3fjycn2eyvc.jpeg?q=70,0.5914999999999999,0.0013845472502145516
167,https://www.snapdeal.com/product/x20-white-denim-skinny-fit/647693152832,x20,White Denim Skinny Fit Men's Jeans ( Pack of 1 ),1049,4.5,2,0,,Snapdeal,https://n2.sdlcdn.com/imgs/k/l/z/x20-White-Denim-Skinny-Fit-SDL632341412-1-ad07c.jpg,0.0,0.0013395009912307335
120,https://www.snapdeal.com/product/true-colors-of-india-blue/654888881964,True Colors of India,Blue Denim Regular Fit Men's Jeans ( Pack of 1 ),799,4.0,2,0,,Snapdeal,https://n3.sdlcdn.com/imgs/k/m/9/True-Colors-of-India-Blue-SDL619213971-1-e0ce3.JPG,0.0,0.001190667547760652
88,http://flipkart.com/spykar-slim-men-dark-blue-jeans/p/itma9b25ff298465?pid=JEAGJ77SXH8FUQ9Z&lid=LSTJEAGJ77SXH8FUQ9ZF8CKLN&marketplace=FLIPKART&store=clo%2Fvua%2Fk58%2Fi51&srno=b_2_53&otracker=browse&fm=organic&iid=6d051f10-010e-4737-ac1b-4cefe8b77e4c.JEAGJ77SXH8FUQ9Z.SEARCH&ppt=None&ppn=None&ssid=homar62vgg0000001679480291644,Spykar ,Men Slim Mid Rise Dark Blue Jeans,"₹1,930",4.2,77,4,good one low quality thanks❤❤ flipkart like products,Flipkart,https://rukminim1.flixcart.com/image/832/832/xif0q/jean/j/t/h/32-ecskn2bb033-spykar-original-imagjukx2zmwyjj2.jpeg?q=70,1.4345999999999999,0.0010929899535746263
85,http://flipkart.com/u-s-polo-assn-tapered-fit-men-blue-jeans/p/itm612254c7d7d52?pid=JEAG94WBSZDZKZXB&lid=LSTJEAG94WBSZDZKZXBWCFCCU&marketplace=FLIPKART&store=clo%2Fvua%2Fk58%2Fi51&srno=b_2_50&otracker=browse&fm=organic&iid=6d051f10-010e-4737-ac1b-4cefe8b77e4c.JEAG94WBSZDZKZXB.SEARCH&ppt=None&ppn=None&ssid=homar62vgg0000001679480291644,U.S. POLO ASSN. ,Men Tapered Fit Mid Rise Blue Jeans,"₹1,844",3.9,58,3,amazing product excellent good product,Flipkart,https://rukminim1.flixcart.com/image/832/832/l251xu80/jean/y/p/2/40-udjen0368-u-s-polo-assn-original-imagdjth5htfsfmt.jpeg?q=70,1.5981999999999998,0.0007822213807879482
26,https://www.amazon.in/Levis-Mens-Jeans-18298-1247_Mid-Indigo_34/dp/B09Z76MKZC/ref=zg_bs_1968076031_sccl_27/257-0329217-1454160?psc=1,Levi's,Men's 511 Slim Fit Jeans,"₹1,478",3.8,28,3,fits perfectly fine with a classic color perfect nothing to say go for buy best good happy buying if same rate different colour i will buy again nice colour cottonpolyspandex mix light weight fabric 511 slim fit clean look jeans got it at a pocket friendly price suggested to opt for a size down for snug fit,Amazon,https://m.media-amazon.com/images/W/IMAGERENDERING_521856-T2/images/I/71FJCcPxkJL._UY550_.jpg,5.1000000000000005,0.0006642237001654945
80,http://flipkart.com/wrangler-skinny-men-blue-jeans/p/itm8dbfbd3c62b6e?pid=JEAGEZ2CQUGKGV7X&lid=LSTJEAGEZ2CQUGKGV7XQQUIZJ&marketplace=FLIPKART&store=clo%2Fvua%2Fk58%2Fi51&srno=b_2_45&otracker=browse&fm=organic&iid=6d051f10-010e-4737-ac1b-4cefe8b77e4c.JEAGEZ2CQUGKGV7X.SEARCH&ppt=None&ppn=None&ssid=homar62vgg0000001679480291644,Wrangler ,Men Skinny Low Rise Blue Jeans,"₹1,399",3.6,57,3,very very pathetic jeans its look like duplicate and even pant look like ladies n very short pant fittings is not up to the mark worst,Flipkart,https://rukminim1.flixcart.com/image/832/832/xif0q/jean/k/h/k/32-wmjn003593-wrangler-original-imagh9354ebujbmn.jpeg?q=70,-0.47439999999999993,0.000578487567836592
69,http://flipkart.com/lee-slim-men-blue-jeans/p/itm34aed9555d65d?pid=JEAGEHB6BXMBPWGF&lid=LSTJEAGEHB6BXMBPWGFEWFWJS&marketplace=FLIPKART&store=clo%2Fvua%2Fk58%2Fi51&srno=b_1_31&otracker=browse&fm=organic&iid=36d2601a-dec5-4170-987b-110e79c39c2b.JEAGEHB6BXMBPWGF.SEARCH&ppt=None&ppn=None&ssid=mgoz6165hs0000001679480290475,Lee ,Men Slim Mid Rise Blue Jeans,"₹1,399",3.8,45,1,pathetic jeans material it looks like road side jeans with lee logo,Flipkart,https://rukminim1.flixcart.com/image/832/832/xif0q/jean/w/8/o/34-lmjnsm3427-lee-original-imagh2g4t7g35nnw.jpeg?q=70,-0.21069999999999994,0.0005042247856801254
59,http://flipkart.com/levi-s-511-slim-men-blue-jeans/p/itm12d605bd4b5a9?pid=JEAGDWFKA2YTEZNE&lid=LSTJEAGDWFKA2YTEZNETU9GKH&marketplace=FLIPKART&store=clo%2Fvua%2Fk58%2Fi51&srno=b_1_17&otracker=browse&fm=organic&iid=36d2601a-dec5-4170-987b-110e79c39c2b.JEAGDWFKA2YTEZNE.SEARCH&ppt=None&ppn=None&ssid=mgoz6165hs0000001679480290475,Levi's ,511 Men Slim Mid Rise Blue Jeans,"₹1,919",4.1,35,1,nice product 👍,Flipkart,https://rukminim1.flixcart.com/image/832/832/xif0q/jean/3/k/q/-original-imagjcgckbkbzxyz.jpeg?q=70,0.4215,0.00043672543601615217
