index,url,brand,name,price,stars,num_ratings,num_reviews,reviews,platform,image,vader_score,final_score
101,https://www.snapdeal.com/product/urbanmark-sky-blue-cotton-blend/5764608159476111420#bcrumbLabelId:3033,UrbanMark Men Regular Fit Round Neck Half Sleeves Text Print T Shir,lack,199,3.7,7,0,,Snapdeal,https://n3.sdlcdn.com/imgs/k/k/w/UrbanMark-Black-Cotton-Blend-Regular-SDL856946231-1-bca1b.jpg,0.0,0.0008628553114907675
81,http://flipkart.com/madfrog-solid-men-round-neck-green-t-shirt/p/itmfb67c95019cf1?pid=TSHGGBHXSG6SKS4G&lid=LSTTSHGGBHXSG6SKS4GS2HBIJ&marketplace=FLIPKART&store=clo%2Fash%2Fank&srno=b_1_36&otracker=browse&fm=organic&iid=en_oMacTQNugFqdnMJuVQBMjh5E3fHP8De5Bbp00da6qwWFQz6t4Ceast9SdmnJfoOJexcYPjjWpOTy7iXKRh1R7A%3D%3D&ppt=None&ppn=None&ssid=8wi3xv8uwg0000001679480069493,Madfrog ,Solid Men Round Neck Olive T-Shirt Men Solid Round Neck Green T-Shirt,₹224,3.8,189,15,nice product🥰❤️ nice clothbut length very short nice quality,Flipkart,https://rukminim1.flixcart.com/image/832/832/xif0q/t-shirt/o/d/z/s-1196-madfrog-original-imagg9pbuzu9qunz.jpeg?q=70,2.0719,0.000708833004290338
39,https://www.amazon.in/LEOTUDE-Oversized-Round-T-Shirts-FS49_LOSANGELES_P_Brown_XL/dp/B0BVW3YWY8/ref=zg_bs_1968120031_sccl_40/257-0329217-1454160?psc=1,LEOTUDE,Men's Oversized Cottonblend Half Sleeve T-Shirts (Color: Brown),₹299,3.7,111,9,must buy this is the only product i find very comfortable and and stylish go for it👍🏽 the product was not satisfying me quality of cloth was below par this not the size i needso plz exchange it nice tshirt looks cool print is good and fitting also good thank you amazon for proving us cool outfits  it is poor quality jo product online me dikh raha hai waise quality ka nai mial or return bhi nai ho raha hai or t shirt fat gaya ek he was me the product was not a proper fit it was not of a good material at all had to return it since it was not even manageable very good product recommended good product go for it\nvalue for money\ngreat quality\nquality and fitting are as expected\nappreciate leotude for timely delivery\nbest for sumner oversize size tshirt,Amazon,https://m.media-amazon.com/images/W/IMAGERENDERING_521856-T2/images/I/61pD8Fq89IL._UY550_.jpg,4.932400000000001,0.0006025993358077243
103,https://www.snapdeal.com/product/austivo-multicolor-cotton-blend-regular/654674625350#bcrumbLabelId:3033,AUSTIVO,Multicolor Cotton Blend Regular Fit Men's Polo T Shirt ( Pack of 1 ),469,4.3,4,0,,Snapdeal,https://n1.sdlcdn.com/imgs/k/n/f/AUSTIVO-Multicolor-Cotton-Blend-Regular-SDL549740464-1-b14f4.jpg,0.0,0.0005730158825344092
26,https://www.amazon.in/AUSK-Sleeves-Regular-T-Shirts-Color-White_Size-L/dp/B0BGZZP6BY/ref=zg_bs_1968120031_sccl_27/257-0329217-1454160?psc=1,AUSK,Men's Henley Neck Full Sleeves Regular Fit Cotton T-Shirts,₹299,3.2,97,13,nice a bit tight colour is not the same not bad nice fabric and comfortable 👍can buy👍 fitting is not good shorter than back side use less nice fit very good quality must buy ordered more🙂 quality wise cost is high not a good fabric designed as a chest pocket actualky no pocket\n\nthis is decisiveness after one wash quality is too bad\nrashes are coming whole t shirt i will never used amazon,Amazon,https://m.media-amazon.com/images/W/IMAGERENDERING_521856-T2/images/I/619GtVocFYL._UX425_.jpg,3.7300000000000004,0.0005661396843897706
109,https://www.snapdeal.com/product/urbanmark-navy-cotton-blend-regular/650997823946#bcrumbLabelId:3033,UrbanMark Men 100% Cotton Regular Fit Round Neck Half Sleeves Striped T Shir,avy,499,4.7,3,0,,Snapdeal,https://n2.sdlcdn.com/imgs/k/k/7/UrbanMark-Navy-Cotton-Blend-Regular-SDL785864755-1-d5ac3.jpg,0.0,0.00046973976417064955
100,http://flipkart.com/u-s-polo-assn-printed-men-round-neck-yellow-t-shirt/p/itm902658cda3df3?pid=TSHG94WDR3FBXVBX&lid=LSTTSHG94WDR3FBXVBXUFLIEW&marketplace=FLIPKART&store=clo%2Fash%2Fank&srno=b_2_60&otracker=browse&fm=organic&iid=en_ACBteP%2BQNrM0EC3OvlTC73qSrHk1PrpEE6Us5O5PvFzpJMLi40%2B9DZNBb2jE5xOtLw5ferop99ws66%2F0ajv%2BeA%3D%3D&ppt=None&ppn=None&ssid=3v9mz9l50w0000001679480076415,U.S. POLO ASSN. ,Men Printed Round Neck Yellow T-Shirt,₹649,4.0,102,10,very nice 👌👍 very comfortable all good nothing to say,Flipkart,https://rukminim1.flixcart.com/image/832/832/kzn17680/t-shirt/z/m/j/xxl-udtsh0707-u-s-polo-assn-original-imagbhysbbkfm7hh.jpeg?q=70,2.1022,0.00042762676318126283
114,https://www.snapdeal.com/product/urbanmark-white-cotton-blend-regular/667185200164#bcrumbLabelId:3033,UrbanMark Men Regular Fit Round Neck Half Sleeves Graphic Print T Shir,hite,199,4.5,2,0,,Snapdeal,https://n4.sdlcdn.com/imgs/k/l/q/UrbanMark-White-Cotton-Blend-Regular-SDL567216272-1-4bd2c.jpg,0.0,0.0002998338920238188
106,https://www.snapdeal.com/product/bewakoof-black-cotton-blend-oversized/679534455860#bcrumbLabelId:3033,Bewakoof,Black Cotton Blend Oversized Fit Men's T-Shirt ( Pack of 1 ),675,5.0,1,0,,Snapdeal,https://n2.sdlcdn.com/imgs/k/m/i/Bewakoof-Black-Cotton-Blend-Oversized-SDL378678050-1-07c5c.jpg,0.0,0.00016657438445767713
41,https://www.amazon.in/Modern-Soul-Oversized-T-Shirts-Medium/dp/B0BVTG2QPQ/ref=zg_bs_1968120031_sccl_42/257-0329217-1454160?psc=1,The Modern Soul,Men's & Women Oversized T-Shirts,₹399,3.5,15,7,i like the material quality its very comfortable give u decent look quality is good but the print sticker has been started coming out from the first of the day only i like this product quality of the tshirt is really good compared to the price size is accurate too really awsm love it items was missing,Amazon,https://m.media-amazon.com/images/W/IMAGERENDERING_521856-T2/images/I/618jtrnUUwL._UX522_.jpg,2.4547000000000003,0.0001623094634841133
38,https://www.amazon.in/LEOTUDE-Oversize-Round-T-Shirt-FS49_Punisher_P_Black_L/dp/B0BVB3Z5Y5/ref=zg_bs_1968120031_sccl_39/257-0329217-1454160?psc=1,LEOTUDE,Men's Oversized Cottonblend Back Printed Round Neck T-Shirt(Color: Black),₹299,3.9,19,3,good tshirt but delivery is late and quality\nshould be improved bit more material of clothes is excellent good product go for it\nvalue for money\ngreat quality\nquality and fitting are as expected\nappreciate leotude for timely delivery\nsame print as show in image,Amazon,https://m.media-amazon.com/images/W/IMAGERENDERING_521856-T2/images/I/61fhnxz9S6L._UX569_.jpg,1.9293999999999998,9.226440666225222e-05
66,http://flipkart.com/keshavi-typography-men-round-neck-multicolor-t-shirt/p/itm0e4754436e38a?pid=TSHGH6M7MHEXNNPA&lid=LSTTSHGH6M7MHEXNNPAOIEJ7R&marketplace=FLIPKART&store=clo%2Fash%2Fank&srno=b_1_20&otracker=browse&fm=organic&iid=en_oMacTQNugFqdnMJuVQBMjh5E3fHP8De5Bbp00da6qwWXz3UQT6VAwY0JaM16jvC8y2HyvseV3MwyxG2eibzLdg%3D%3D&ppt=None&ppn=None&ssid=8wi3xv8uwg0000001679480069493,Keshavi ,Pack of 3 Men Typography Round Neck Multicolor T-Shirt,₹449,3.6,32,0,,Flipkart,https://rukminim1.flixcart.com/image/832/832/xif0q/t-shirt/j/l/d/l-mn-combo-3-black-d-camal-gold-keshavi-original-imaghdgxucwkhtak.jpeg?q=70,0.0,7.675747635809762e-05
56,http://flipkart.com/teefox-printed-men-round-neck-pink-light-green-t-shirt/p/itm01b209bea2caa?pid=TSHGNAQ35227ZDMF&lid=LSTTSHGNAQ35227ZDMFBALCIZ&marketplace=FLIPKART&store=clo%2Fash%2Fank&srno=b_1_8&otracker=browse&fm=organic&iid=en_oMacTQNugFqdnMJuVQBMjh5E3fHP8De5Bbp00da6qwWQX0nB5h%2F4dcncVlgRRKqkqJwQlpK2bCW8tHK55Shh1w%3D%3D&ppt=None&ppn=None&ssid=8wi3xv8uwg0000001679480069493,TEEFOX ,"Pack of 2 Men Printed Round Neck Pink, Light Green T-Shirt",₹398,4.5,8,1,nice fabric nd great fit,Flipkart,https://rukminim1.flixcart.com/image/832/832/xif0q/t-shirt/x/b/v/m-cy-26-combo-peach-adv-lgtgreen-nvr-cryptic-original-imagn7g5zuwwyy85.jpeg?q=70,1.4076,3.4417318480150176e-05
51,http://flipkart.com/slowloris-printed-men-round-neck-pink-light-green-t-shirt/p/itm994d53deea272?pid=TSHGN8VPGGVF26XJ&lid=LSTTSHGN8VPGGVF26XJMNLKZV&marketplace=FLIPKART&store=clo%2Fash%2Fank&srno=b_1_2&otracker=browse&fm=organic&iid=en_oMacTQNugFqdnMJuVQBMjh5E3fHP8De5Bbp00da6qwWu2qfw6Ulg1IMHTrGbogGhgRcW9pbcvz9D1YD2IyUYmA%3D%3D&ppt=None&ppn=None&ssid=8wi3xv8uwg0000001679480069493,SLOWLORIS ,"Pack of 2 Men Printed Round Neck Pink, Light Green T-Shirt",₹358,5.0,3,0,,Flipkart,https://rukminim1.flixcart.com/image/832/832/xif0q/t-shirt/x/b/v/m-cy-26-combo-peach-adv-lgtgreen-nvr-cryptic-original-imagn7g5zuwwyy85.jpeg?q=70,0.0,9.994463067460627e-06
96,http://flipkart.com/highlander-solid-men-hooded-neck-pink-t-shirt/p/itm86e2a7b909702?pid=TSHGMGW3U4XEZJFC&lid=LSTTSHGMGW3U4XEZJFCW3SJGP&marketplace=FLIPKART&store=clo%2Fash%2Fank&srno=b_2_56&otracker=browse&fm=organic&iid=en_ACBteP%2BQNrM0EC3OvlTC73qSrHk1PrpEE6Us5O5PvFx0cfeXHtCb%2BhYfCt1Xd1UzXZb9QR8MsykJ51JQygOmYQ%3D%3D&ppt=None&ppn=None&ssid=3v9mz9l50w0000001679480076415,HIGHLANDER ,Men Solid Hooded Neck Pink T-Shirt,₹697,0.0,0,0,,Flipkart,https://rukminim1.flixcart.com/image/832/832/xif0q/t-shirt/k/v/f/s-hlts002641-highlander-original-imagmgw2tvzb6nqh.jpeg?q=70,0.0,0.0
50,http://flipkart.com/smscreation-typography-men-round-neck-maroon-t-shirt/p/itmeb2a8b8d4608e?pid=TSHGNGPNTVX5GFYJ&lid=LSTTSHGNGPNTVX5GFYJDHA1BS&marketplace=FLIPKART&store=clo%2Fash%2Fank&srno=b_1_1&otracker=browse&fm=organic&iid=en_oMacTQNugFqdnMJuVQBMjh5E3fHP8De5Bbp00da6qwWqSAjEjZdFoAYMEMPNHKit%2FJVp39V9cs%2FU0EqgCBxkHA%3D%3D&ppt=None&ppn=None&ssid=8wi3xv8uwg0000001679480069493,Smscreation ,Men Typography Round Neck Maroon T-Shirt,₹369,0.0,0,0,,Flipkart,https://rukminim1.flixcart.com/image/832/832/kkcwo7k0/t-shirt/c/u/t/xl-ezd2021-believer-maroon-ezdeals-original-imafzqazyfytny9h.jpeg?q=70,0.0,0.0
29,https://www.amazon.in/Cristiano-Ronaldo-Football-Jersey-Shorts/dp/B0BTHDTSSF/ref=zg_bs_1968120031_sccl_30/257-0329217-1454160?psc=1,Generic,o Ronaldo 7 Football Home Jersey 2023/24 with Black Shorts (Men & Boys),₹435,0.0,0,0,,Amazon,https://m.media-amazon.com/images/W/IMAGERENDERING_521856-T2/images/I/41F4PM5jxmL._UX466_.jpg,0.0,0.0
159,https://www.snapdeal.com/product/breakbounce-black-100-cotton-relaxed/634551961859,Breakbounce,Black 100% Cotton Relaxed Fit Men's T-Shirt ( Pack of 1 ),1075,0.0,0,0,,Snapdeal,https://n1.sdlcdn.com/imgs/k/l/1/Breakbounce-Black-100-Cotton-Relaxed-SDL014731586-1-72b78.jpg,0.0,0.0
