index,url,brand,name,price,stars,num_ratings,num_reviews,reviews,platform,image,vader_score,final_score
44,http://flipkart.com/denill-women-beige-heels/p/itm2eb6c637f2410?pid=SNDGAMFMZ3QK85TU&lid=LSTSNDGAMFMZ3QK85TUIB3M06&marketplace=FLIPKART&store=osp%2Fiko&srno=b_1_5&otracker=browse&fm=organic&iid=25d08c2b-116b-437e-b7d7-13c9411da35f.SNDGAMFMZ3QK85TU.SEARCH&ppt=None&ppn=None&ssid=7c2xuwjlxc0000001680019115979,Denill ,Women Beige Heels Sandal,₹599,4.0,2887,289,nice happy feet😍🤗 good,Flipkart,https://rukminim1.flixcart.com/image/832/832/xif0q/sandal/p/u/j/5-h-hb13-5-denill-beige-original-imagamfmtqsgh9gd-bb.jpeg?q=70,2.1341,0.04390239395178689
110,https://www.snapdeal.com/product/ajanta-gray-flats/671048203811#bcrumbLabelId:264,Ajanta,Light Grey Women's Flats,675,4.4,78,2,,Snapdeal,https://n4.sdlcdn.com/imgs/j/r/g/Ajanta-Gray-Flats-SDL608465453-1-e4f40.jpg,0.0,0.04386357304077319
81,http://flipkart.com/denill-women-grey-wedges/p/itmfdvkb5cxfwazy?pid=SNDFDV9VQKPUZRWS&lid=LSTSNDFDV9VQKPUZRWSV3ODUS&marketplace=FLIPKART&store=osp%2Fiko&srno=b_2_43&otracker=browse&fm=organic&iid=f5fcd0bd-d477-4242-a189-0e5d1279be95.SNDFDV9VQKPUZRWS.SEARCH&ppt=None&ppn=None&ssid=uspv1s5s9c0000001680019116685,Denill ,Women Grey Wedges Sandal,₹449,3.9,2322,275,good product i am very happy very nice shoes comfortable good product 👍👍👍👍 im very happy,Flipkart,https://rukminim1.flixcart.com/image/832/832/xif0q/sandal/b/y/p/-original-imaghvb6ze4zhevh.jpeg?q=70,2.9566999999999997,0.04211093348042308
158,https://www.snapdeal.com/product/aerowalk-blue-slippers/623095519242,Aerowalk Blue Slippe,Aerowalk Blue Slippers,299,4.2,74,2,nice slippers satisfied,Snapdeal,https://n1.sdlcdn.com/imgs/j/e/z/Aerowalk-Blue-Slippers-SDL644272668-1-71a96.jpg,0.843,0.04168864954741886
17,https://www.amazon.in/Sparx-Brown-Outdoor-Sandals-10-SS0485G_BRBG0010/dp/B07VRDCLZS/ref=zg_bs_1983633031_sccl_18/258-1229559-2740407?psc=1,Sparx,mens Ss0485g Sandal,₹934,4.1,1297,138,the sandals look good and are very comfortable as they have cushion for extra comfort the grip is good too highly recommended for comfortable long time wearing value for money thats it comfort fit nice comfort is very nice but finishing not good i like the comfort and dislike the lasting its my 3time i use sparx scandals product quality is good comfort to wear grip on the leg is fine good good at this price,Amazon,https://m.media-amazon.com/images/I/6166NSf82AL._UX500_.jpg,6.903900000000002,0.03581259534438001
14,https://www.amazon.in/Colo-Sandal-Slipper-Womens-C-2/dp/B0965QRBTW/ref=zg_bs_1983633031_sccl_15/258-1229559-2740407?psc=1,Colo,"Flat Sandal,Slipper For Women's And Girl's",₹399,3.7,1910,192,good it very soft light weight but not so good quality money worth the product was good initially but within few months the sole got separated quality is bad not worth the value  it shoul have lasted for atleast for a year but within 4 months the product got dammaged iam totally dissatisfied not gonna buy anything from this brand anymore its sleak lookingbut little bit tight if i will take one size bigger than may be it will be too big for sleak leg it will fit properly  it was good product average product but the seller is not good delivers used product please avoid to buy products from this seller it is very comfortable and affordable footwear this sandal was broke very quick,Amazon,https://m.media-amazon.com/images/I/619+fDnXrpS._UY500_.jpg,2.543,0.029451426406992887
144,https://www.snapdeal.com/product/aerowalk-red-flats/649512235249,Aerowalk,Red Women's Flats,299,4.2,35,4,super quality nice brand absolutely love this pair review after several months of use comfortable,Snapdeal,https://n2.sdlcdn.com/imgs/i/7/e/Aerowalk-Red-Flats-SDL270091123-1-8b626.jpg,2.1684,0.028901996940186647
4,https://www.amazon.in/CANVI-Sandals-Synthetic-Leather-numeric_7/dp/B09RPGMB71/ref=zg_bs_1983633031_sccl_5/258-1229559-2740407?psc=1,CANVI - TAKE CHANGE TO MAKE CHANGE,"Women's Ethnic Flats Sandals for Women and Girl, Synthetic Leather Sandals Casual Summer Beach Shoes Sandal",₹499,3.9,919,101,its really a good product but the packaging could have been better super good finishing good product the finishing could be more better but worth the money  amazing for the price although does make a little noise when walking on noncarpeted surfaces makes noise while walking but the looks are good comfort wise also ok so kept it the sandal is exact fit  but the strap is loose n slips away  i generally wear a size 8 but when i ordered the shoe i found it 1 size smaller so i had to return it i would have exchanged it for the next size but size 8 is the last the shoe is beautiful and the sole is comfortable im really happy with the qualitysuper comfortable stylish and looks durable as well  awesome piece of footwear,Amazon,https://m.media-amazon.com/images/I/61ZLrNSnihL._UY535_.jpg,8.321500000000002,0.02876296765755086
119,https://www.snapdeal.com/product/apratim-black-flats/678844153715,Apratim,Black Women's Flats,289,4.1,54,1,,Snapdeal,https://n3.sdlcdn.com/imgs/j/j/x/Apratim-Black-Flats-SDL747269983-4-3d7ca.jpeg,0.0,0.028296605685393886
107,https://www.snapdeal.com/product/inblu-black-flats/668707187780#bcrumbLabelId:264,Inblu Black Fla,Inblu Black Flats,379,4.2,49,1,,Snapdeal,https://n1.sdlcdn.com/imgs/j/q/4/Inblu-Black-Flats-SDL791629960-1-85e99.jpeg,0.0,0.02630280691081329
123,https://www.snapdeal.com/product/walk-n-style-collection-beige/648711123731,WALK N STYLE COLLECTION Beige Fla,WALK N STYLE COLLECTION Beige Flats,369,4.3,43,2,great deal very nice,Snapdeal,https://n4.sdlcdn.com/imgs/j/r/j/WALK-N-STYLE-COLLECTION-Beige-SDL178108089-1-fd643.jpg,1.0464,0.02607204011599508
111,https://www.snapdeal.com/product/inblu-tan-flats/6917529654876479368#bcrumbLabelId:264,Inblu Red Fla,Inblu Red Flats,299,4.5,43,0,,Snapdeal,https://n1.sdlcdn.com/imgs/j/c/8/Inblu-Red-Flats-SDL040825179-1-c2b81.jpg,0.0,0.02473077326162474
72,http://flipkart.com/denill-women-brown-heels/p/itm8ee29e98f688c?pid=SNDGGHQYDRMFTDNJ&lid=LSTSNDGGHQYDRMFTDNJNEUTLE&marketplace=FLIPKART&store=osp%2Fiko&srno=b_1_33&otracker=browse&fm=organic&iid=25d08c2b-116b-437e-b7d7-13c9411da35f.SNDGGHQYDRMFTDNJ.SEARCH&ppt=None&ppn=None&ssid=7c2xuwjlxc0000001680019115979,Denill ,Women Brown Heels Sandal,₹599,4.1,1231,106,great pair of sandalslove it go fr it worth buying it lovely 😍 happy owsamm baily heel no dout lovely shoes true to size 😍 👌,Flipkart,https://rukminim1.flixcart.com/image/832/832/xif0q/sandal/b/6/p/4-h-hb21-denill-brown-original-imagghqzhyteytgp.jpeg?q=70,4.3677,0.02369867935304741
127,https://www.snapdeal.com/product/khadims-black-flats/621391234762,KHADIM,Black Women's Flats,469,4.1,45,2,,Snapdeal,https://n4.sdlcdn.com/imgs/h/j/t/Khadim-s-Black-Flats-SDL505479949-1-03543.jpeg,0.0,0.023580504737828238
38,https://www.amazon.in/HEALTH-FIT-Diabetic-Orthopedic-Footwear/dp/B0825ZW17W/ref=zg_bs_1983633031_sccl_39/258-1229559-2740407?psc=1,HEALTH FIT,Extra Soft Ortho Care Diabetic & Orthopedic Sandal/Doctor Sandal Footwear with Arch Support Women Brown,₹789,3.8,1267,129,light weight suitable for walking smaller distance belt was cut on the arrival we asked for a a change and within two days we got a replacement 😊 model i like all are ok but very tight to close to leg so i want next size my mom is diabetic and had a problem of her legs being swelled all the time so she couldnt wear sadanls shoes nothing just could wear male slippers which looked loose and bad on her legs but finally i get to found this product and this is a really nice sandal looks party wear byt unlike other partywear sandals it is super soft and comfortable prevents her foot from being swelled only one thing if i would ask to change would be a bigger strap size its a bit tight sometimes  else definitely go for this not worthy for buying this is the most comfortable ones for the feet\nworth the money soent i bought these for my mother she has calluses on her soles she found them comfortable and uses them for her daily walks i like the product but its small and return is not collected still i want to order bigger size am a diabetic person but this sandal causes excess heat to the feet its not cool need to be upgraded uncomfortable corners bite have damaged toes,Amazon,https://m.media-amazon.com/images/I/61QvWm6fFOL._UX500_.jpg,3.7257000000000002,0.02351575274473867
101,https://www.snapdeal.com/product/paragon-maroon-womens-flats-pack/5764608172412937782#bcrumbLabelId:264,Paragon,Black Women's Flats,309,4.3,40,2,,Snapdeal,https://n4.sdlcdn.com/imgs/k/h/r/Paragon-Black-Women-s-Flats-SDL366677174-2-313eb.jpg,0.0,0.02198290956588866
154,https://www.snapdeal.com/product/ajanta-black-flats/625908629407,Ajanta,Black Women's Flats,599,4.3,39,3,,Snapdeal,https://n4.sdlcdn.com/imgs/j/s/m/Ajanta-Black-Flats-SDL365452280-1-6e2b2.jpeg,0.0,0.02143333682674144
16,https://www.amazon.in/TRASE-Navy-Blue-Pink-Sandals-Women/dp/B0966D3HSZ/ref=zg_bs_1983633031_sccl_17/258-1229559-2740407?psc=1,TRASE,"Women's Fashion Sandals | Light weight, Comfortable & Trendy Floaters for Girls & Women | Soft Footbed, Casual and Stylish | For Walking, Working, All Day Wear",₹499,3.6,1379,136,quality is good but not much more comfortable its just good for few months later the sole is damaged after using for a month the layer below my sole ie the top layer came off and everytime i walk it rubs and there are abrasions on my sole i think we hv to handle little delicately… use it wise ✌🏻 uncomfortable to wear high heels doesnt makes my feets comfortable best product go for it i dislike this product because its price is heigh  quality is low i never use next time very good in fitting but material is quite hard,Amazon,https://m.media-amazon.com/images/I/61jd8LDi-QS._UX500_.jpg,2.5722999999999994,0.020848557074425962
31,https://www.amazon.in/Stylish-Comfortable-Platform-Sandals-numeric_6/dp/B09TJP7MK4/ref=zg_bs_1983633031_sccl_32/258-1229559-2740407?psc=1,MOSAC,Women's/Girls Stylish & Comfortable Wedge Platform Heel Sandals,₹495,4.0,305,86,no sound when walking best to wear for interview with saree fit and size chart is as expected looking very pretty and then slight heel doesnt hurt it is really good perfect fit its worth it and it was super shiny nice design too tight go for one size bigger very nice product and looks stylishalso comfortable to wearmust try it very much satisfied with the product comfortable and perfect height not comfortable in wearing and walking great product liked it very much😄 comfort for daily use good product👍,Amazon,https://m.media-amazon.com/images/I/71A9YSmIcaL._UY500_.jpg,8.7552,0.0206787278009071
41,http://flipkart.com/shoestail-women-green-flats/p/itma58dad2641991?pid=SNDG9AGVA6A66BZH&lid=LSTSNDG9AGVA6A66BZHNMI3F9&marketplace=FLIPKART&store=osp%2Fiko&srno=b_1_2&otracker=browse&fm=organic&iid=en_3RAEDcqjgoNTyJM7j7C6cFQGhRNDCWYJarvl0DtBl1%2BmgxIIsP9Qz45iPPnCMfH%2Fayg%2BuvnB2D1KdLMvZ6yOfw%3D%3D&ppt=None&ppn=None&ssid=7c2xuwjlxc0000001680019115979,Shoestail ,Women Green Flats Sandal,₹379,4.1,1668,110,very nice thank you flipkart very good owesome,Flipkart,https://rukminim1.flixcart.com/image/832/832/l5iid8w0/sandal/6/g/7/-original-imagg6y6hzxenumh.jpeg?q=70,1.2231,0.020618777134338392
99,https://www.snapdeal.com/product/trase-tan-slippers/660850249973#bcrumbLabelId:264,Trase Tan Slippe,Trase Tan Slippers,599,4.3,37,0,,Snapdeal,https://n3.sdlcdn.com/imgs/k/e/9/Trase-Tan-Slippers-SDL235897618-1-82b77.jpg,0.0,0.02033419134844701
141,https://www.snapdeal.com/product/ajanta-brown-flats/632695183313,Ajanta,Cream Women's Flats,469,4.2,33,1,its an imaging product,Snapdeal,https://n3.sdlcdn.com/imgs/k/d/y/Ajanta-Brown-Flats-SDL123873683-1-e993b.jpg,0.0,0.01771413526646609
117,https://www.snapdeal.com/product/asian-tan-flats/677605605986#bcrumbLabelId:264,ASIAN Tan Fla,ASIAN Tan Flats,469,3.9,32,1,its good and comfortable,Snapdeal,https://n4.sdlcdn.com/imgs/i/9/h/ASIAN-Tan-Flats-SDL671497110-5-097ad.jpeg,0.9510000000000001,0.017059350502629217
130,https://www.snapdeal.com/product/ajanta-red-flats/660940291443,Ajanta Red Fla,Ajanta Red Flats,439,4.3,31,2,,Snapdeal,https://n4.sdlcdn.com/imgs/k/d/y/Ajanta-Red-Flats-SDL017497895-1-b560f.jpg,0.0,0.01703675491356371
10,https://www.amazon.in/Bata-Womens-FLOATZ-THONG-Slippers/dp/B09WDL1Q5Q/ref=zg_bs_1983633031_sccl_11/258-1229559-2740407?psc=1,BATA,"Women FLOATZ THONG Olive Slippers, (6717333)",₹839,4.3,491,48,its comfortable we like it purchased two pairs light weighted slipper and very easy to use all age people can wear it and feel easy to walk\nfeel is like wearing nothing in legs and very comfortable  not worth 600 bought this product in diwali sale for 600 and its awesome it has the quality of crocs for a less price it fits my feet well comfort  beautiful for my toes liked the colour style comfort and everything about these slip on thongs beautiful comfortable nice arch support great product at reasonable price 13rd price compared to similar style of crocs i am very happy and satisfied with the product great pair just one word awesome go for it guys bata always rocks ,Amazon,https://m.media-amazon.com/images/I/61v2r5SASdL._UX500_.jpg,10.293600000000001,0.01692002832939726
64,http://flipkart.com/denill-women-pink-heels/p/itma1c708efe774d?pid=SNDGY9YAHUYJDUFW&lid=LSTSNDGY9YAHUYJDUFWMLOZ01&marketplace=FLIPKART&store=osp%2Fiko&srno=b_1_25&otracker=browse&fm=organic&iid=25d08c2b-116b-437e-b7d7-13c9411da35f.SNDGY9YAHUYJDUFW.SEARCH&ppt=None&ppn=None&ssid=7c2xuwjlxc0000001680019115979,Denill ,Women Pink Heels Sandal,₹599,4.0,852,99,awesome😍product🤩i like it ❤️ love it ❤️🤗 satisfied with the product✌️,Flipkart,https://rukminim1.flixcart.com/image/832/832/xif0q/sandal/i/0/i/-original-imaghxfm6cg9jfqw.jpeg?q=70,2.6375,0.014801028318354621
126,https://www.snapdeal.com/product/do-bhai-blue-flats/6917529701743803419,Do Bhai,Multicolor Women's Flats,700,4.2,25,1,comfortable,Snapdeal,https://n4.sdlcdn.com/imgs/j/v/4/Do-Bhai-Blue-Flats-SDL191478217-1-616dc.jpeg,0.5106,0.014015209677978766
24,https://www.amazon.in/ASIAN-Elite-123-Slipper-Slippers-Walking/dp/B07H9Z3DSH/ref=zg_bs_1983633031_sccl_25/258-1229559-2740407?psc=1,ASIAN,"Women's Elite-123 Casual Fashion Walking,Party,Office & Regular Used Sandal With Pu Sole LightWeight Sandal For Women's & Girl's",₹336,3.4,396,77,okay okay product  dont expect much \nasian footwears have a issue that both pairs have a bit different sizes though its not visible but after wearing them you can feel the difference if youre looking for comfort plus looks then this is not for you only buy if you want a pair of sandals for the sake of having a pair🤣🤣otherwise its a no no\nnot good finishing i would say just fine its better to go with bata lower segment products if you want otherwise save a bit extra and buy something else which can be comfortable and with good finishing value for money ok sandals good fit and durable comfort the fit is on the tighter side  the straps are nit long enough to ensure a proper range of fitting the upper material is synthetic and of cheap quality overall although the price is competitive it is not really value for money the price for the product as shown in the site to attract customers is 299rs but when we try to pay by any method it shows as 339rs has to be paid excluding delivery charges fact is that worth or the quality of this product or slipper is less than 299rs it is not worth to pay 339rs very worst product \nmy foot injured this product  size issmall so i cannot use it,Amazon,https://m.media-amazon.com/images/I/619U8etPJuL._UY500_.jpg,5.766200000000001,0.013796503371890765
33,https://www.amazon.in/WFS-Sandals-Material-Synthetic-Occasion/dp/B08Y737FXC/ref=zg_bs_1983633031_sccl_34/258-1229559-2740407?psc=1,WFS,Women Black Wedges Sandal 2.5 Inch Heel,₹474,3.7,421,59,value for money but not comfort all good nice one side of shoe got disintegrate from front section i just wore them 4 to 5 times 😪 this id little bit tight and small for me so i exchanged the large size quality is so good worth the price😍🤗 good one like it little bit heavy but fitting is good look is also good i love it very comfortable great quality and perfect footwear,Amazon,https://m.media-amazon.com/images/I/81wzMkUHB3L._UY500_.jpg,6.956800000000001,0.013554254431392663
106,https://www.snapdeal.com/product/do-bhai-yellow-flats/5764608148119884227#bcrumbLabelId:264,Do Bhai,Yellow Women's Flats,700,4.2,25,2,,Snapdeal,https://n1.sdlcdn.com/imgs/j/v/5/Do-Bhai-Yellow-Flats-SDL428079671-1-db2ce.jpeg,0.0,0.013419799444292495
30,https://www.amazon.in/crocs-Unisex-Bayaband-Slipper-205392-0GX/dp/B098LYK2VR/ref=zg_bs_1983633031_sccl_31/258-1229559-2740407?psc=1,crocs,unisex-adult Bayaband Slide Slide Sandal,"₹1,296",4.3,646,69,go for it very comfortable go for it under 1500\ncomfortable and lightweight good product amazing doesnt feel like crocs at all  great slipper  good product but price should be lesser crocs is a name in itselfvery comfortableproperly fitsdurable everything about these sliders is good but as mentioned one should go with one unit smaller one,Amazon,https://m.media-amazon.com/images/I/61ePd6P+-dL._UX500_.jpg,3.4038,0.012577932096326185
102,https://www.snapdeal.com/product/aerowalk-black-flats/5764608194933488905#bcrumbLabelId:264,Aerowalk Black Fla,Aerowalk Black Flats,319,3.7,26,0,aerowalk chappal,Snapdeal,https://n2.sdlcdn.com/imgs/j/c/7/Aerowalk-Black-Flats-SDL289768194-1-ff266.jpg,0.0,0.01229509244324703
70,http://flipkart.com/sirdenill-women-blue-heels/p/itmddabd006e1a5c?pid=SNDGATFJ7FGTDWAR&lid=LSTSNDGATFJ7FGTDWARRJ36CM&marketplace=FLIPKART&store=osp%2Fiko&srno=b_1_31&otracker=browse&fm=organic&iid=25d08c2b-116b-437e-b7d7-13c9411da35f.SNDGATFJ7FGTDWAR.SEARCH&ppt=None&ppn=None&ssid=7c2xuwjlxc0000001680019115979,SIRDENILL ,Women Blue Heels Sandal,₹499,4.0,770,71,it is awesome 😍 very nice this is most prettiest choice for any occasion im really happy to purchase this shoe,Flipkart,https://rukminim1.flixcart.com/image/832/832/xif0q/sandal/w/0/z/-original-imaghqz6nhqhayzs.jpeg?q=70,2.6489999999999996,0.012259324304673552
43,http://flipkart.com/dymo-women-black-heels/p/itmfecc2f531f9b5?pid=SNDFGUJVGHGMWRBK&lid=LSTSNDFGUJVGHGMWRBKQFLLJS&marketplace=FLIPKART&store=osp%2Fiko&srno=b_1_4&otracker=browse&fm=organic&iid=25d08c2b-116b-437e-b7d7-13c9411da35f.SNDFGUJVGHGMWRBK.SEARCH&ppt=None&ppn=None&ssid=7c2xuwjlxc0000001680019115979,Dymo ,Women Black Heels Sandal,₹499,4.0,538,51,nice 👋👋 nice heels  quality is good love it 😊❤ very good product 👌👌👌,Flipkart,https://rukminim1.flixcart.com/image/832/832/xif0q/sandal/e/f/o/-original-imagg5ucw6cg3yty.jpeg?q=70,4.9464999999999995,0.011384311406456626
137,https://www.snapdeal.com/product/aerowalk-black-flats/663612427259,Aerowalk Black Fla,Aerowalk Black Flats,309,4.0,22,1,,Snapdeal,https://n2.sdlcdn.com/imgs/j/l/m/Aerowalk-Black-Flats-SDL327879284-1-2ad0c.jpeg,0.0,0.011247070010454663
66,http://flipkart.com/walkaroo-women-pink-flats/p/itm83e43af40e579?pid=SNDGFSSHGADZQDSW&lid=LSTSNDGFSSHGADZQDSWU6BA4P&marketplace=FLIPKART&store=osp%2Fiko&srno=b_1_27&otracker=browse&fm=organic&iid=25d08c2b-116b-437e-b7d7-13c9411da35f.SNDGFSSHGADZQDSW.SEARCH&ppt=None&ppn=None&ssid=7c2xuwjlxc0000001680019115979,WALKAROO ,Women Pink Flats Sandal,₹299,4.1,728,70,very good qualityperfect size good one for regular use also used  in rain super i just love it,Flipkart,https://rukminim1.flixcart.com/image/832/832/l51d30w0/sandal/n/a/x/6-wl7792-6-walkaroo-fig-fig-original-imagfsshkajbysq6.jpeg?q=70,2.1170999999999998,0.011085851270054887
22,https://www.amazon.in/HimQuen-Stylish-Chunky-Casual-Fashion/dp/B09B285CVR/ref=zg_bs_1983633031_sccl_23/258-1229559-2740407?psc=1,HimQuen,Stylish Girl's High Heel Criss Cross Chunky Sole Casual Fashion Wedges Sandal For Women/Girls Ankle Strep Sandal,₹489,3.7,269,46,the sandals are ok kinds the base is slightly heavier than expected the elastic bands being new cause serious marks so ppl with vericose veins or any other problem may plz abstain the sole is soft and comfortable looking very nice but quality wise its very good i just love this product so comfortable want to buy this from so long thank you excellent no like heel has a heavy base so sometimes the straps get pulled when your wearing them causing them to create a gap where they are fixed kn the shoe and the white sole part gets damaged easily excellent product🥳🥳🥳 very comfortable and good but the back of the bottom broked easily get stains the elastic wrap losen up very light and comfortableloved how it grips gives casual looki tried it with both indian and westernn it was nice,Amazon,https://m.media-amazon.com/images/I/61VW7OxVJuL._UY500_.jpg,7.4041000000000015,0.010487340001277972
53,http://flipkart.com/crocs-classic-marbled-sandal-whi-blk-women-multicolor-flats/p/itmbfec5f8eb4bcd?pid=SNDGCPVMVHXZA8W3&lid=LSTSNDGCPVMVHXZA8W301YJNM&marketplace=FLIPKART&store=osp%2Fiko&srno=b_1_14&otracker=browse&fm=organic&iid=25d08c2b-116b-437e-b7d7-13c9411da35f.SNDGCPVMVHXZA8W3.SEARCH&ppt=None&ppn=None&ssid=7c2xuwjlxc0000001680019115979,CROCS ,Women Classic Crocs Marbled Sandal Whi/Blk Multicolor Flats Sandal,"₹1,048",4.0,795,58,good so nyc easy to use and wear worth product  superb crocs,Flipkart,https://rukminim1.flixcart.com/image/832/832/xif0q/sandal/d/p/v/14-207701-14-crocs-white-black-original-imagcpvhus7d7ggq-bb.jpeg?q=70,1.732,0.010471397389360058
68,http://flipkart.com/denill-women-blue-flats/p/itm6674b76f96b73?pid=SNDFUXT2HTHWKXHT&lid=LSTSNDFUXT2HTHWKXHTP4TBWO&marketplace=FLIPKART&store=osp%2Fiko&srno=b_1_29&otracker=browse&fm=organic&iid=25d08c2b-116b-437e-b7d7-13c9411da35f.SNDFUXT2HTHWKXHT.SEARCH&ppt=None&ppn=None&ssid=7c2xuwjlxc0000001680019115979,Denill ,Women Blue Flats Sandal,₹449,3.7,716,83,nice onevery comfortable nice i bought this product and i hardly wore it 2times and this is the condition of the sandal,Flipkart,https://rukminim1.flixcart.com/image/832/832/kdhphu80-0/sandal/h/i/m/fl-a13-5-denill-blue-original-imafue6eaz78evj5.jpeg?q=70,1.3536000000000001,0.009391955444742814
153,https://www.snapdeal.com/product/apratim-maroon-flats/643680924579,Apratim Maroon Fla,Apratim Maroon Flats,289,4.4,16,0,,Snapdeal,https://n2.sdlcdn.com/imgs/k/f/j/Apratim-Maroon-Flats-SDL954734644-2-c2749.jpg,0.0,0.008997656008363731
142,https://www.snapdeal.com/product/trase-beige-slippers/646466923139,Trase Beige Slippe,Trase Beige Slippers,625,4.6,15,0,,Snapdeal,https://n1.sdlcdn.com/imgs/k/e/9/Trase-Beige-Slippers-SDL505450852-1-6d20f.jpg,0.0,0.008818725349106497
35,https://www.amazon.in/BATA-Womens-Red-Ankle-Strap-6-6615313/dp/B0B154D6FC/ref=zg_bs_1983633031_sccl_36/258-1229559-2740407?psc=1,BATA,"Women ALASKA SANDAL Grey Heels, (6612313)",₹999,4.1,253,35,nice one and fits exactly good product and pricing at amazon very comfortable for daily use my daughter loved it perfect fit with comfort it’s comfortable but according to size it’s small very nice productcomfortable and fits as expected this heels is very comfortable and didnt hurt my feet even after wearing for whole day go for it strap was too tightsole came off in 1 week after using a week we love very good nice sandals fit as expected exact color as shown standard heel size and comfortable to wear overall good quality sandals original from bata,Amazon,https://m.media-amazon.com/images/I/61U4q+LwDDL._UY625_.jpg,7.489300000000002,0.00876478328885153
11,https://www.amazon.in/Red-Tape-Womens-RLF0066-Casual-5/dp/B09TDNZYQT/ref=zg_bs_1983633031_sccl_12/258-1229559-2740407?psc=1,Red Tape,Women's Sports Sandals - Light-Weight Comfortable Sliders,₹749,4.1,466,44,ossam product product is very comfortable to use but the price is too high and the availability of the product is also very rare really comfortable it is not soft as expected nice deserves 5 star for product quality and aggressive pricing it is comparable to the best brands in the market order one size less than u normally wear otherwise the product is good nice looks as expected my mother really like it very much her purpose to buy them was 100 meeting,Amazon,https://m.media-amazon.com/images/I/61OIqDRYbSL._UY500_.jpg,3.1496000000000004,0.00811580095548867
112,https://www.snapdeal.com/product/ajanta-brown-flats/652056239384#bcrumbLabelId:264,Ajanta,Rose Gold Women's Flats,625,4.1,15,0,,Snapdeal,https://n3.sdlcdn.com/imgs/j/r/g/Ajanta-Brown-Flats-SDL288737300-1-e6e86.jpg,0.0,0.007860168245942746
131,https://www.snapdeal.com/product/shoetopia-yellow-flats/6917529651966757561,Shoetopia,Yellow Women's Flats,599,3.9,14,1,great deal,Snapdeal,https://n4.sdlcdn.com/imgs/k/b/e/Shoetopia-Yellow-Flats-SDL801484443-1-ed38c.jpg,0.6249,0.007706991079286214
50,http://flipkart.com/picktoes-women-pink-wedges/p/itmb6026d973b7a4?pid=SNDGFMEGDQHMETK4&lid=LSTSNDGFMEGDQHMETK4CGSW74&marketplace=FLIPKART&store=osp%2Fiko&srno=b_1_11&otracker=browse&fm=organic&iid=25d08c2b-116b-437e-b7d7-13c9411da35f.SNDGFMEGDQHMETK4.SEARCH&ppt=None&ppn=None&ssid=7c2xuwjlxc0000001680019115979,Picktoes ,Women Pink Wedges Sandal,₹479,4.0,539,37,very beautiful 🥰🥰🥰🥰 it was nice👍 its so soft and comfortable must buy,Flipkart,https://rukminim1.flixcart.com/image/832/832/l4ssfww0/sandal/a/f/4/5-103-38-picktoes-pink-original-imagfmegtqxhfdtk.jpeg?q=70,2.5152,0.0076814640439165725
