index,url,brand,name,price,stars,num_ratings,num_reviews,reviews,platform,image,vader_score,final_score
99,https://www.snapdeal.com/product/radiksa-yellow-cotton-straight-kurti/632979566702#bcrumbLabelId:178,Radiksa,Yellow Cotton Women's Straight Kurti ( Pack of 1 ),369,4.3,30,0,,Snapdeal,https://n2.sdlcdn.com/imgs/k/g/6/Radiksa-Yellow-Cotton-Women-s-SDL737006198-1-a13b6.jpg,0.0,0.007611688248851461
34,https://www.amazon.in/ANNI-DESIGNER-Printed-Straight-Kavi-Grey-Nw_L_Grey_Large/dp/B0BSV7H75X/ref=zg_bs_1968255031_sccl_35/258-1229559-2740407?psc=1,ANNI DESIGNER,Women's Cotton Blend Printed Straight Kurta with Pant (Kavi Pink-Nw),₹469,4.0,79,46,beautiful n suitable for summers go for it overall great purchase can be bought as its very reasonable rate material not so good but its fits nice not cotton mix cloth it is but nice as pic this is perfect gift for my wife fabric and fitting too good its premium product in this range my wife love it quality of kurti and pant is superbwe can wear casual like office or home bothlooks very decentit designed beautifuly with neck patti and lace  fabric is very soft and friendly with skin very comfortable and stitching also very fine same looks as in picturebest quality products in this pricetotal value for moneyjust go for it i just loved the print of this kurti it’s really beautiful and perfect for my daily wear even the cloth is very good which makes it comfortable and perfect fitting it looks too beautiful on me the quality of the cloth is very amazing and very comfortable to carry and wearable at professionally as well gives a smart and amazing look size is good as expected happy with the quality,Amazon,https://m.media-amazon.com/images/I/71buykdavzL._UY550_.jpg,13.9704,0.007402199565964766
13,https://www.amazon.in/Rangnavi-Anarkali-Embroidered-Printed-Dupatta/dp/B0BPY8D3D1/ref=zg_bs_1968255031_sccl_14/258-1229559-2740407?psc=1,Rangnavi,Women Rayon Anarkali Embroidered Printed Kurta Pant and Dupatta Set,₹845,3.9,232,77,very beautiful kurta set duppata is little short otherwise everything is ok colour is very pretty nice dress very soft and comfortable in this price very good product very nice u must buy lenght of dupatta is hardly 2mtrs rest all ok it looks classy m very happy with this purchase the colour is same as shown in figure fittings are perfect material quality is good and soft overall good value for money colour looks different in image great good 👍 go for it,Amazon,https://m.media-amazon.com/images/I/41HnNEzSeCL._UX522_.jpg,7.3496000000000015,0.00725787900725233
12,https://www.amazon.in/GoSriKi-Womens-Printed-Dupatta-KALEPING-PISTA-Nw-GS_L_Pista_Large/dp/B0BPY2DGCL/ref=zg_bs_1968255031_sccl_13/258-1229559-2740407?psc=1,GoSriKi,Women's Cotton Blend Printed Kurta and Pant with Dupatta Set (KALEPING-Pista-Nw-GS),₹618,4.1,141,57,its good and comfort to wear i didnt expect this to be a good one in this price but my thinking are overturned while i received the package its comfort dress and value for money as shown in the picture beautiful color and material very good product i am very happy and i am interested in the brand it is good not a proper cotton as mentioned it is a cotton blend but fine can be worn in summers look wise very nice hope it turns out good in future the kurta set is good for casual wear i like the colour combination but i actually got the wrong product i ordered the white shade and not the green i have decided to keep the green as it is looking good good perfect fit and it looks good i liked it i gifted this kurta set to my mom she absolutely loved it quality is good,Amazon,https://m.media-amazon.com/images/I/61rbZSNUjyL._UY550_.jpg,10.325300000000002,0.007119791194567822
33,https://www.amazon.in/rytras-Womens-Printed-Straight-RYT310_Blue_Large/dp/B0B38XFH8G/ref=zg_bs_1968255031_sccl_34/258-1229559-2740407?psc=1,rytras,Women's Cotton Printed Straight Kurta,₹399,3.8,719,58,very nice product in this price range also fitting wise also very nice… good material is v thinn ok kind off i like the design and also it is soft and comfy i just now recieved it sostill dont know how the fabric will be after washif there is any cons in this tops good fitting i like it good one happy with the product achha tha kurta fabric not cotton muje blue ke badle me maroon kurta xxl chahiye replace ke liye bheja nice dress colour nd quality super ❤️,Amazon,https://m.media-amazon.com/images/I/81jgawQiCWL._UX466_.jpg,5.867900000000001,0.006946963453142826
100,https://www.snapdeal.com/product/rangita-mint-green-viscose-blend/659667253010#bcrumbLabelId:178,Rangita Women Mint Green Yoke Zari Embroidered Calf Length,ine Kurti,699,4.6,25,0,,Snapdeal,https://n2.sdlcdn.com/imgs/k/j/8/Rangita-Mint-Green-Viscose-Blend-SDL863280010-1-ea1b7.jpg,0.0,0.006785613555177658
56,http://flipkart.com/leaf-creation-women-printed-straight-kurta/p/itm1d8ad4f0565db?pid=KTAG5XH7B7A7K8HZ&lid=LSTKTAG5XH7B7A7K8HZWP3SVL&marketplace=FLIPKART&store=clo%2Fcfv%2Fcib%2Frkt&srno=b_1_19&otracker=browse&fm=organic&iid=2427a585-6e96-4bab-ae41-d0cad06d3779.KTAG5XH7B7A7K8HZ.SEARCH&ppt=None&ppn=None&ssid=uz4qsr0yhc0000001680018928581,LEAF CREATION ,Women Printed Viscose Rayon Straight Kurta  (Multicolor),₹324,3.8,1165,85,good one overall good but clothes quality thin i love it,Flipkart,https://rukminim1.flixcart.com/image/832/832/ksc46fk0/kurta/b/b/b/l-lc0031-leaf-creation-original-imag5xh6h4msdcxh.jpeg?q=70,1.5177,0.006635405090127194
140,https://www.snapdeal.com/product/rangita-off-white-chanderi-womens/652053017697,Rangita Women Chanderi Off White Yoke Embroidered Calf Length Anarkali Kur,Rangita Women Chanderi Off White Yoke Embroidered Calf Length Anarkali Kurti,1049,4.2,23,2,very nice product very nice and decent dress,Snapdeal,https://n4.sdlcdn.com/imgs/k/n/t/Rangita-Women-Chanderi-Off-White-SDL025453227-1-c791b.jpg,0.843,0.006622002826052592
120,https://www.snapdeal.com/product/rangita-cream-cotton-womens-anarkali/653831056048,Rangita Women Cotton Cream Yoke Embroidered Calf Length Anarkali Kur,Rangita Women Cotton Cream Yoke Embroidered Calf Length Anarkali Kurti,1049,4.4,24,1,awesome kurti,Snapdeal,https://n1.sdlcdn.com/imgs/k/n/t/Rangita-Women-Cotton-Cream-Yoke-SDL920570782-1-3b3e7.jpg,0.6249,0.006572726417394611
0,https://www.amazon.in/ANNI-DESIGNER-Straight-Pustak-Blue_M_Blue_Medium/dp/B0BV6WSF33/ref=zg_bs_1968255031_sccl_1/258-1229559-2740407?psc=1,ANNI DESIGNER,Women Kurta with Pant,₹435,3.8,95,57,love it\ngirls go for it  this my first buy clothes  i am little worried about the quality of the product  but it turned out beautiful❤️ very nice kurta set very nice product go for it look wise its really good material is also fine according to price but the pant has a very thin material very very thin so disappointed with the pant material otherwise okay looks wise it is great but the material is not suitable for summers otherwise its good it is nice overall true to size and colour but the quality is not upto the mark the fabric is little low quality but good for few uses looks different from the model pic but better can wear it looks good daily life use very good purchase 🙂 but kurtha is long though fyn  very comfortable clothing for daily wear ☺️ perfect size and material is also good pure cotton like the fit,Amazon,https://m.media-amazon.com/images/I/61q-JREtrAL._UY550_.jpg,9.633100000000002,0.006432020292577614
2,https://www.amazon.in/MEERA-FAB-Printed-Anarkali-Palazzo/dp/B0BTX2YD4R/ref=zg_bs_1968255031_sccl_3/258-1229559-2740407?psc=1,MEERA FAB,Women's Cotton Printed Blue Anarkali Kurta with Palazzo & Dupatta Set,₹799,3.8,203,72,i liked the materialsoft cottoncomfortable to wear in summer dupatta length is only 2 mtrs which is very less for me as i am tallanyway value for moneymachine wash not recommended as the cloth is very soft and might not withstand machine wash at this price rangeits a nice n comphy kurta set 👍 all good the sheeves are very tight as compared to the overall size of the dress superb dress but quality okok amount\nworth it fabric quality is good the material is of good quality  its quite comfy to wear didnt expect it to be so good at such price but really glad i bought it first time got such nice fitting pants at this cost overall happy the kurta and duppata is good the palazzo does not fit at the hips considering xxl size nice dress design on kurta looks different from the picture shown,Amazon,https://m.media-amazon.com/images/I/71T-yPIj-sL._UX425_.jpg,6.4471,0.005987734966530889
102,https://www.snapdeal.com/product/rangita-turquoise-rayon-womens-straight/636317060692#bcrumbLabelId:178,Rangita Women Rayon Turquoise Gold printed Calf length straight kur,Rangita Women Rayon Turquoise Gold printed Calf length straight kurti,499,4.2,22,0,,Snapdeal,https://n4.sdlcdn.com/imgs/k/l/v/Rangita-Turquoise-Rayon-Women-s-SDL807853108-1-bb298.jpg,0.0,0.005452092978247093
98,https://www.snapdeal.com/product/kapadia-wine-rayon-womens-straight/627201312537#bcrumbLabelId:178,Kapadia,Wine Rayon Women's Straight Kurti ( Pack of 1 ),379,4.0,23,0,,Snapdeal,https://n4.sdlcdn.com/imgs/k/m/o/Kapadia-Wine-Rayon-Women-s-SDL006307453-1-2ea1c.jpg,0.0,0.005428490844142127
41,http://flipkart.com/glorious-women-floral-print-anarkali-kurta/p/itm59c1483dd7661?pid=KTAGEUJUBDQBZRXS&lid=LSTKTAGEUJUBDQBZRXSEGQ2RI&marketplace=FLIPKART&store=clo%2Fcfv%2Fcib%2Frkt&srno=b_1_2&otracker=browse&fm=organic&iid=en_5z5JnbS%2F1dvVNyKuvR90bGHZSZyGox%2B99wFPhZPgUBDJ2GDNVlauZzasr1XgGO4HvGBpheZP1Ozo%2BD1DQKnHIA%3D%3D&ppt=None&ppn=None&ssid=uz4qsr0yhc0000001680018928581,Glorious ,Women Floral Print Viscose Rayon Anarkali Kurta With Attached Dupatta  (Green),₹614,4.0,766,60,woow at first the kurti came with a defectafter exchanging the product i kept itthe kurti looks quite good😍 my friends gave lots of compliments when i posted the pictures🥺but it gave out lots of colour during its first wash only 😭 so much that the colour has reduced to its half and all the shine has gone nobody can tell that i have wore the kurti only twice 🥲also the dupatta fabric is very poor the dye on it hasnt dried completely and it feels sticky on touchoverall i cant recomm fabric quality is good beautiful kurti,Flipkart,https://rukminim1.flixcart.com/image/832/832/l3t2fm80/kurta/w/c/k/l-psk303-glorious-original-imageujuk2zmfpkh.jpeg?q=70,1.6745999999999999,0.00471487016660833
111,https://www.snapdeal.com/product/haya-grey-rayon-womens-straight/627802541180#bcrumbLabelId:178,HAYA,Grey Rayon Women's Straight Kurti ( Pack of 1 ),449,4.4,17,2,,Snapdeal,https://n4.sdlcdn.com/imgs/k/l/8/HAYA-Grey-Rayon-Women-s-SDL430761935-1-8035f.jpg,0.0,0.0044135990776285995
104,https://www.snapdeal.com/product/frionkandy-pink-rayon-womens-aline/629475890868#bcrumbLabelId:178,Frionkandy,Pink Rayon Women's A-line Kurti ( Pack of 1 ),469,4.1,18,0,,Snapdeal,https://n1.sdlcdn.com/imgs/k/l/r/Frionkandy-Pink-Rayon-Women-s-SDL440282644-1-8299f.jpg,0.0,0.0043545937423661845
147,https://www.snapdeal.com/product/rangita-yellow-chanderi-womens-aline/626871455459,Rangita Women Chanderi Yellow Gold Printed Calf Length Kalidar Kurti With Contrast Border At Bottom H,Rangita Women Chanderi Yellow Gold Printed Calf Length Kalidar Kurti With Contrast Border At Bottom Hem,999,4.4,16,0,,Snapdeal,https://n3.sdlcdn.com/imgs/k/n/t/Rangita-Women-Chanderi-Yellow-Gold-SDL757890996-1-e9a08.jpg,0.0,0.004153975602473976
20,https://www.amazon.in/GoSriKi-Womens-Regular-Dupatta-Shank-Maroon-Nw08-GS_Maroon/dp/B0BTHCKZMQ/ref=zg_bs_1968255031_sccl_21/258-1229559-2740407?psc=1,GoSriKi,Women Kurta with Pants & Dupatta,₹659,4.2,55,30,the fabric of top and bottom is rayon hence light and comfortable\ndupatta has enough length and it has a georgette fabric \ncolour is very elegant and pictures look appealing however i feel it might colour bleed over first few washes dress is looking nice material is okay not cotton rayon type material… dupatta synthetic… overall good for the price… very nice product overall\ni ordered more 2 absolutely beautiful value for money and very comfortable perfect fit its a nice suit with amazing dupatta the fabric of the kurta set is very fine quality the design is same as shown in pic even the dupatta lenght is perfect that adds more grace tk the suit overall a nice suit for part occasion hi the product is very good and comfortable at this price range quality is good an cloth is also cotton so feel good factor is there amazing fabric quality and design is good nice fitting not pure cotton but very comfortable\n👌,Amazon,https://m.media-amazon.com/images/I/815QW8bkthL._UX522_.jpg,11.205700000000002,0.003949699034351468
5,https://www.amazon.in/ANNI-DESIGNER-Straight-Baiyaan-Purple_L_Purple_Large/dp/B0BFQSNNTX/ref=zg_bs_1968255031_sccl_6/258-1229559-2740407?psc=1,ANNI DESIGNER,Women's Cotton Blend Straight Printed Kurta with Pant & Dupatta (Baiyaan),₹759,3.9,215,54,supb♥️must buy i like this kurta set a lot but i got a size issue i have ordered s checking bust size says 36  i wear 34 and got it shipped here in the united states reviews claim its the fit as expected so i have ordered a small but it’s not even 34bust size and it’s tight for me at the chest now i’m very disappointed as i can’t exchange or return it now 😢😭 its not even having marginal at the sides so that i can do some fittings nice dress kurta is awesome material is good\nonly problem with pant height it did not fit for my height pant is short acha है photo me colur sahi nhi dikha rha real me light colour h aur kurta b long hai jo kafi accha look de rha hai खरीद skte hai 779 me acha hai size issue perfect product the best👌 actually im obsessed with the color 😍 💜\u0001fa76 bit transparent but thats ok worth the price must buy for the color fit and material ok product in this price but cloth is not that good ,Amazon,https://m.media-amazon.com/images/I/61HdzJJaJTL._UY550_.jpg,4.9316,0.0039024232274232646
18,https://www.amazon.in/ANNI-DESIGNER-Embroidered-Straight-Stho-White-Nw_M_White_Medium/dp/B0BTBPZLSW/ref=zg_bs_1968255031_sccl_19/258-1229559-2740407?psc=1,ANNI DESIGNER,Women's Cotton Blend Embroidered Straight Kurta (Stho-White-Nw),₹499.,4.3,95,51,look waise its so pretty just love the combination of black and white but the material is not cotton good no doubt but its cotton as mentioned  good quality a good quality product and totally worth the money its a perfect fit nd i loved it kurta is so good and beautiful 😍 its an awesome product at a very reasonable price must buy,Amazon,https://m.media-amazon.com/images/I/614dVwr4THL._UY550_.jpg,5.6771,0.0036490239188796472
157,https://www.snapdeal.com/product/janasya-blue-crepe-straight-kurti/648979896898,Janasya,Blue Crepe Women's Straight Kurti ( Pack of 1 ),694,4.5,13,1,,Snapdeal,https://n3.sdlcdn.com/imgs/j/7/q/Janasya-Blue-Crepe-Straight-Kurti-SDL566664817-1-cc606.jpg,0.0,0.0034518121128512443
10,https://www.amazon.in/ANNI-DESIGNER-Chikankari-Embroidered-Gori-Black_XL_Black_X-Large/dp/B0BRSXRZV3/ref=zg_bs_1968255031_sccl_11/258-1229559-2740407?psc=1,ANNI DESIGNER,Women's Printed Georgette Chikankari Embroidered Kurti (Gori),₹469,3.7,100,38,beautiful fitting i loved it i like the kurta its beautiful gv u a beautiful look\nu can buy it i like the pattern also but whear is ambroderi the cloth is streshing  the kurti is just as shown in image its a georgette material and the embroidery is of good quality overall looks good but tight for me otherwise amazing kirta this kurti looks very stylish quality is also good i bought it for my wife and she paired it with white dupatta n bottom and it looks great price is also affordable considering the quality go for it worth the cost  quality is not good i ordered orange colour but received green kurti fitting is also poor this kurti looks very stylish quality is also good i bought it for my wife and she paired it with white dupatta n bottom and it looks great,Amazon,https://m.media-amazon.com/images/I/61Q1QkDd86L._UY550_.jpg,6.907300000000002,0.0033076609963154607
116,https://www.snapdeal.com/product/lerkiza-multicoloured-cotton-womens-straight/655059217585#bcrumbLabelId:178,Lerkiza,Multicolor Cotton Women's Straight Kurti ( Pack of 2 ),625,4.3,13,0,,Snapdeal,https://n4.sdlcdn.com/imgs/k/l/a/Lerkiza-Multicoloured-Cotton-Women-s-SDL931404591-1-27c4f.jpeg,0.0,0.0032983982411689664
27,https://www.amazon.in/GoSriKi-Printed-Straight-Dupatta-AUX-Orange-GS_S_Pink_Small/dp/B0BR5XK932/ref=zg_bs_1968255031_sccl_28/258-1229559-2740407?psc=1,GoSriKi,Women's Cotton Blend Printed Straight Kurta with Pant & Dupatta (AUX),₹659,3.8,72,36,pretty dress  the quality of material is good and for this price this is a good deal i like the print but cloth is too thin and length was too long so i didnt like that much pant not delivered with the kurta please send it immediately pant material is mixed cotton bit top ia purely polyester design is good just loved the colour of the dress the dress looks very traditional and ethnic material quality is very smooth wearing this dress is eye catching all you can say the fabric print and price are all good at this price its superb  colour is same as shown as a picture and fabric is also good thank you so much a beautiful colour and equally beautiful suit set the fabric is soft good for regular office wear or small functions,Amazon,https://m.media-amazon.com/images/I/61Biq8HRTyL._UY550_.jpg,7.163500000000002,0.0031436772120569992
79,http://flipkart.com/ashru-women-printed-straight-kurta/p/itmbfeaba0024f09?pid=KTAGBHH3WWFEQXY2&lid=LSTKTAGBHH3WWFEQXY20ZUGYQ&marketplace=FLIPKART&store=clo%2Fcfv%2Fcib%2Frkt&srno=b_2_42&otracker=browse&fm=organic&iid=c8e69d03-2cee-416b-8787-e216848d594a.KTAGBHH3WWFEQXY2.SEARCH&ppt=None&ppn=None&ssid=kp8i2bf5ps0000001680018929720,ASHRU ,Women Printed Cotton Rayon Straight Kurta  (Black),₹449,3.9,243,36,same as sone pictures  nice dress pure cotton very nice quality comfortable and beautiful kurti worth buying very nice 😊👌👌 very nice product must buy,Flipkart,https://rukminim1.flixcart.com/image/832/832/xif0q/kurta/p/7/c/l-sp-103-black-ashru-original-imagbhh3gasfjbqa-bb.jpeg?q=70,3.9759,0.0026839931536812023
62,http://flipkart.com/parnavi-women-chikan-embroidery-straight-kurta/p/itm37d3d16b031b8?pid=KTAGN25VZPJHHHZG&lid=LSTKTAGN25VZPJHHHZGJ67U3E&marketplace=FLIPKART&store=clo%2Fcfv%2Fcib%2Frkt&srno=b_1_25&otracker=browse&fm=organic&iid=2427a585-6e96-4bab-ae41-d0cad06d3779.KTAGN25VZPJHHHZG.SEARCH&ppt=None&ppn=None&ssid=uz4qsr0yhc0000001680018928581,Parnavi ,Women Chikan Embroidery Pure Cotton Straight Kurta  (Purple),₹379,4.1,400,25,beautiful n comfortable very nice kurti best,Flipkart,https://rukminim1.flixcart.com/image/832/832/xif0q/kurta/s/j/u/l-8001-8002-parnavi-original-imagn233em7ngkpj.jpeg?q=70,2.1684,0.0025283330049858284
142,https://www.snapdeal.com/product/rangita-pink-rayon-womens-straight/5764608209370759227,Rangita Women Rayon Sea Green Gold Printed Calf Length Straight Kur,Rangita Women Rayon Sea Green Gold Printed Calf Length Straight Kurti,499,3.9,9,1,excellent quality,Snapdeal,https://n1.sdlcdn.com/imgs/k/l/v/Rangita-Sea-Green-Rayon-Women-SDL550455215-1-e119f.jpg,0.5719,0.0023838641400514044
109,https://www.snapdeal.com/product/rangita-pink-rayon-womens-flared/685864202068#bcrumbLabelId:178,Rangita Women Rayon Pink Sequin yoke embroidered Calf length Kurti Gathered at wai,Rangita Women Rayon Pink Sequin yoke embroidered Calf length Kurti Gathered at waist,349,4.4,9,0,,Snapdeal,https://n4.sdlcdn.com/imgs/k/l/m/Rangita-Pink-Rayon-Women-s-SDL928823502-1-ab47b.jpg,0.0,0.0023366112763916116
11,https://www.amazon.in/vaamsi-Printed-Palazzo-Dupatta-VKSKD1099_XL_Off/dp/B094G13R1K/ref=zg_bs_1968255031_sccl_12/258-1229559-2740407?psc=1,Vaamsi,Cotton Blend Printed Kurta Palazzo Dupatta Set (VKSKD1099_Off White),₹659,3.9,157,19,really amazing suit👍😊 very happy with the product product is same as in pic fabric and fitting is good i like the material too good same as in image  good quality  highly satisfied   this not pure cotton but look was good worth for the price nice cotton dress quality is good price is also good i liked the most little bit colour change while washing good its very soft and looks so elegant just as expected too good❤️❤️,Amazon,https://m.media-amazon.com/images/I/71bvdULi7FL._UY550_.jpg,7.728100000000001,0.0023286729882054814
55,http://flipkart.com/pooja-creation-women-solid-anarkali-kurta/p/itm051f777c6ce55?pid=KTAG5GYJFVUDUZJC&lid=LSTKTAG5GYJFVUDUZJCWTWFZV&marketplace=FLIPKART&store=clo%2Fcfv%2Fcib%2Frkt&srno=b_1_18&otracker=browse&fm=organic&iid=2427a585-6e96-4bab-ae41-d0cad06d3779.KTAG5GYJFVUDUZJC.SEARCH&ppt=None&ppn=None&ssid=uz4qsr0yhc0000001680018928581,Pooja Creation ,Women Solid Viscose Rayon Anarkali Kurta  (Dark Green),₹426,3.8,359,30,good quality and love it wowww very nice dress really amazinf nice,Flipkart,https://rukminim1.flixcart.com/image/832/832/kzu6efk0/kurta/h/l/n/m-dark-green-anarkali-kurta-for-women-kr34a-pooja-creation-original-imagbrk64yh8djyf.jpeg?q=70,1.9203000000000001,0.002240038403763187
21,https://www.amazon.in/ANNI-DESIGNER-Straight-Dupatta-Authentic-Pista_L_Pista_Large/dp/B0BNG1P6WC/ref=zg_bs_1968255031_sccl_22/258-1229559-2740407?psc=1,ANNI DESIGNER,Women's Cotton Blend Straight Printed Kurta with Pant & Dupatta (Authentic),₹659,3.8,125,23,product is very good but i ordered black colour kurti but i received green colour kurti colour is good but cloth is not cotton i like the dress colour and quality fitting and color is goodbut cloth is not skin friendly for those who have sensitive skinthis is not cotton fabric nice fit great product lene se phle kaafi doubt the ki paise waste na hojaye but baadme sara doubt clear hogya just go for itan honest review nice product is very good fits perfectly nice finishing soft fabric duptta length aslo perfect go for it amazing fabric i like the suit material quality also fine in this price,Amazon,https://m.media-amazon.com/images/I/61XZ65kmpzL._UY550_.jpg,6.533600000000001,0.0022042595985048543
105,https://www.snapdeal.com/product/haya-black-rayon-womens-straight/677064420041#bcrumbLabelId:178,HAYA,Black Rayon Women's Straight Kurti ( Pack of 1 ),449,4.5,8,0,,Snapdeal,https://n3.sdlcdn.com/imgs/k/m/t/HAYA-Black-Rayon-Women-s-SDL462432811-1-511a7.jpg,0.0,0.002124192069446919
127,https://www.snapdeal.com/product/rangita-cream-chanderi-womens-straight/639453468708,Rangita Women Chanderi Cream Yoke Embroidered Calf Length Straight Kur,Rangita Women Chanderi Cream Yoke Embroidered Calf Length Straight Kurti,699,4.4,8,0,,Snapdeal,https://n4.sdlcdn.com/imgs/k/l/w/Rangita-Cream-Chanderi-Women-s-SDL558112022-1-c801d.jpg,0.0,0.002076987801236988
29,https://www.amazon.in/Vaamsi-Womens-Printed-Dupatta-VKSKD1242_XL_Mustard/dp/B09G74BL7T/ref=zg_bs_1968255031_sccl_30/258-1229559-2740407?psc=1,Vaamsi,Women's Cotton Blend Printed Kurta Pant Dupatta Set (VKSKD1242_Mustard,₹659,3.6,128,16,nce …but the quality of cloth is not so good nice cotton soft dress the fabric is very thin and dupatta is also not good good material and fitting is perfect kurte ka stuff transi hai thodda but color dark hone ki wajah se chalega plazzo ka fabric b badiya hai dupatta b badiya and full length ka hai so go for it not bad in this price suit qulity good but duptta not good bht halka hai the best part is the trouser its perfect fit and has a pocked it has elastic band at back plus a drawstring making it double secure\nthe kurta is good as well just neck isnt as symmetric as i would have liked\nbut overall a good product\nrequires no extra work which is a huge relief color is as shown in the picture but material is not at all cotton its some thing else  pls donot mention cotton it it is not because of people donot like the material definitely they will return so unnecessary hampering the image of amazon and also amazon pls verify your vendor other wise your market will get hamper fabric is good cotton material full length duppatabut the color is too dark for meotherwise kurta set is nice color is not mustard as shown in the photos\nits olive brown\nphotos shown are completely different from the actual product sent,Amazon,https://m.media-amazon.com/images/I/61H1+-zGcVL._UY550_.jpg,8.487900000000002,0.0020292661907906294
14,https://www.amazon.in/ANNI-DESIGNER-Staright-Palazzos-Blue-Jan02_S_Blue_Small/dp/B0BSQQH327/ref=zg_bs_1968255031_sccl_15/258-1229559-2740407?psc=1,ANNI DESIGNER,Women's Cotton Blend Straight Printed & Embroidered Kurta Set (Vadaanall-Jan02),₹469,3.7,49,19,good fitting is good  amazon is great when it comes to suit set the price is pocket friendly and the quality is amazing the suits are way better than shown in picture its a must buy product is too good to wear enjoyed wearing it thank you very poor quality and i felt like the seller had sent a used dress it was full of threads coming out and bobling also excellent dress the clothes are nice stitched and quality of matter is decent and good fitting ek bar pahnne ke bad hi koda kharab ho gyacheap dnt buy perfect fit nice material\nvery soft comfortable and vibrant in color\npure cotton suit friendly on skin\nperfect for formal wear normal occasion,Amazon,https://m.media-amazon.com/images/I/51efLptxVyL._UY550_.jpg,8.203600000000002,0.0019188678638899699
