index,url,brand,name,price,stars,num_ratings,num_reviews,reviews,platform,image,vader_score,final_score
29,https://www.amazon.in/Clarks-womens-Mira-Black-Sandal/dp/B098QWPNPJ/ref=zg_bs_1983633031_sccl_30/258-1229559-2740407?psc=1,Clarks,womens Mira Tide Black Flat Sandal,"₹1,800",4.2,65,20,fits really well easy to wear as you don’t have to tie and untie the buckles every time comfortable with good cushioning facility price is bit high and main problem is due to white soles it gets dirty every time i wear it very good comfy and smart costly super comfortable very comfortable thank you amazon  i always have a problem with my footwear i very rarely get shoes that are comfortable and perfect this is superb all day comfort a must buy you can check the size at the store and then buy online\ni got it at an excellent price too try a size larger as the front straps arent stretchable except for the last one instead of uk 4 i had to get uk 5  otherwise very comfortable to wear all day too good quality and comfort is also very good very good fit and comfortable very good price,Amazon,https://m.media-amazon.com/images/I/61055VLjwYL._UX500_.jpg,9.465400000000004,0.0051128675859359925
3,https://www.amazon.in/Denill-Women-Cross-Strap-Heels/dp/B09QHZ623Q/ref=zg_bs_1983633031_sccl_4/258-1229559-2740407?psc=1,Denill,Women Cross Strap Cone Heels,₹299,3.6,332,32,quality is good but its a bit loose this sandal comfortable to walk in n totally worth buying product finishing is not good its very comfortableand its worth it its ok to wear on occasion nice looks great fits well but it hurts your heels if you walk for quite sometime good  but very light weight bfr purchase the buyer used with heels then only this product will b comfortable very disappointed from denill and amazonpoor quality of product receivedheel broken after one hour of wearing it,Amazon,https://m.media-amazon.com/images/I/41ADInTT0lL._UY625_.jpg,2.6622999999999997,0.005041996915794761
75,http://flipkart.com/skechers-women-natural-flats/p/itm082402f1e2bf2?pid=SNDFUUX8KXVZ5NHD&lid=LSTSNDFUUX8KXVZ5NHD6KRR8C&marketplace=FLIPKART&store=osp%2Fiko&srno=b_1_36&otracker=browse&fm=organic&iid=en_3RAEDcqjgoNTyJM7j7C6cFQGhRNDCWYJarvl0DtBl1%2FLltZClUEec02pUCsZ3HGOCE6iFDy1XNLE%2FzNdbDKGVA%3D%3D&ppt=None&ppn=None&ssid=7c2xuwjlxc0000001680019115979,Skechers ,Women Natural Flats Sandal,"₹2,009",4.3,246,27,beautiful pair super fantastic and soft nice product 👌,Flipkart,https://rukminim1.flixcart.com/image/832/832/xif0q/sandal/g/i/q/3-32865-6-skechers-nat-original-imageqfbw4f2jsyn-bb.jpeg?q=70,2.9074,0.0045346689013722515
8,https://www.amazon.in/Elibolz-Womens-First-Choice-Sandals/dp/B09YK7LKTK/ref=zg_bs_1983633031_sccl_9/258-1229559-2740407?psc=1,Elibolz,Womens & Girls First Choice Wedge Heel Sandals (Grey),₹449,3.8,213,22,comfortable nice product poor quality\nbroken within a month after i started using ive been using it for months and i think in this price range its good and comfortable product is overall good good but i think it costly  very comfortable the outer lining is rough making it irritating quality of product is very good and superb comfertibility just loved it♥️♥️,Amazon,https://m.media-amazon.com/images/I/61Qr452lb9L._UY500_.jpg,4.7565,0.004509431950083312
115,https://www.snapdeal.com/product/shoetopia-beige-womens-flats/628505941821#bcrumbLabelId:264,Shoetopia,Beige Women's Flats,575,4.0,7,0,,Snapdeal,https://n1.sdlcdn.com/imgs/k/k/k/Shoetopia-Beige-Women-s-Flats-SDL393820534-1-03af5.jpg,0.0,0.0035786131851446657
122,https://www.snapdeal.com/product/apratim-pink-flats/664841124428,Apratim Pink Fla,Apratim Pink Flats,279,4.0,6,0,,Snapdeal,https://n4.sdlcdn.com/imgs/k/f/j/Apratim-Pink-Flats-SDL038427674-3-92855.jpg,0.0,0.003067382730123999
155,https://www.snapdeal.com/product/stephues-purple-womens-flats/5764608205709831286,StepHues,White Women's Flats,389,4.0,6,1,,Snapdeal,https://n4.sdlcdn.com/imgs/k/k/0/StepHues-White-Women-s-Flats-SDL638483927-1-79226.jpg,0.0,0.003067382730123999
45,http://flipkart.com/denill-women-brown-flats/p/itmed94b8de55ee6?pid=SNDFUP5KH6TQXAMH&lid=LSTSNDFUP5KH6TQXAMH0OCDVI&marketplace=FLIPKART&store=osp%2Fiko&srno=b_1_6&otracker=browse&fm=organic&iid=25d08c2b-116b-437e-b7d7-13c9411da35f.SNDFUP5KH6TQXAMH.SEARCH&ppt=None&ppn=None&ssid=7c2xuwjlxc0000001680019115979,Denill ,Women Brown Flats Sandal,₹599,4.1,121,16,its a great pair of flats for aged women my mom loved the design and other features but was little high for her so had to return the heel size is little above normal but otherwise all the other features and good and its so soft while walking foot feel soo good in it good product is very nice and its especially comfortable i really loved it happy with it,Flipkart,https://rukminim1.flixcart.com/image/832/832/xif0q/sandal/k/y/a/-original-imaghxffggzj9gft.jpeg?q=70,4.6489,0.003002852234401278
57,http://flipkart.com/sandak-bata-women-multicolor-wedges/p/itma7937e64e0603?pid=SFFGENKWBTCDGDCT&lid=LSTSFFGENKWBTCDGDCT9RFPFH&marketplace=FLIPKART&store=osp%2Fiko&srno=b_1_18&otracker=browse&fm=organic&iid=25d08c2b-116b-437e-b7d7-13c9411da35f.SFFGENKWBTCDGDCT.SEARCH&ppt=None&ppn=None&ssid=7c2xuwjlxc0000001680019115979,SANDAK By Bata ,Women Multicolor Wedges Sandal,₹421,4.3,195,17,very nice 👌 nice and comfortable just go for it,Flipkart,https://rukminim1.flixcart.com/image/832/832/l55nekw0/sandal/1/d/h/-original-imagfwgce3zxyhnf.jpeg?q=70,2.0833,0.0029693073754769803
136,https://www.snapdeal.com/product/do-bhai-white-flats/5764608183664028114,Do Bhai White Fla,Do Bhai White Flats,549,4.2,5,0,,Snapdeal,https://n3.sdlcdn.com/imgs/j/w/b/Do-Bhai-White-Flats-SDL855062317-2-af398.jpeg,0.0,0.002683959888858499
23,https://www.amazon.in/Bata-Womens-SHINE-Beige-Slipper/dp/B09W5X1FYP/ref=zg_bs_1983633031_sccl_24/258-1229559-2740407?psc=1,BATA,Women's Shine Tr Flat Sandal,₹419,4.0,178,12,nice product nice good for daily wear no more second thoughts please proceed to buy product was in good condition but after wearing it for a month or so i have started to have pain in my feet it’s not good for your feet’s if it’s for longer duration of work  not leg friendly product at all  nice product in photo looking good bt really nt good i have requested for return of the product 45 times but everytime my return request isnt being processed it says failed to pickup product is very narrow for my foot it doesnt even cover the entire foot dont recommend neither the product nor the seller nor amazon worst app no customer support ,Amazon,https://m.media-amazon.com/images/I/71C661mWp1L._UX500_.jpg,2.9814999999999996,0.002654394338433207
26,https://www.amazon.in/Smart-Sleek-Transparent-Sandals-numeric_7/dp/B0B53NRVCC/ref=zg_bs_1983633031_sccl_27/258-1229559-2740407?psc=1,Smart & Sleek,Women Transparent Block Heels Slip On Mules,₹499,3.8,85,15,first i received a size smaller by mistake\nbut the heels are very pretty and comfortable go for it very good very nice bought one size big so got it exchanges go for it good fit nice heels as i wantedsize is perfect looks good quality average bit uncomfortable look wise its very good but heeels came on the first day of wearing wasted my 550rs on the product i like this product like it,Amazon,https://m.media-amazon.com/images/I/51cimUcs2HL._UY500_.jpg,4.865600000000001,0.0025277688141321303
34,https://www.amazon.in/Womens-Speed-Brown-Sandal-5613078/dp/B095X3Q59N/ref=zg_bs_1983633031_sccl_35/258-1229559-2740407?psc=1,BATA,"Womens Flat Blossom Flats, (5613078)","₹1,038",3.8,71,13,worth the price  these pair are more of style over comfort great for narrow feet they do tend to ache the heels after long day which to me doesnt fit the comfit profile liked sandals so much have cousiony sole that doesnt hurt the feet at all velcro fastening is really good quality and makes wearing sandals easily material seems waterproof as i have bought this in rainy season and wearing continuously in rain but no single layer or materiallather seem to be damaged like other sandals in monsoon style of sandals is elegant u can pair up with all sort of dresses overall i just love bata its my altime favourite not good just in a month started tearing and upper layer is tore bata never expected this kinda of product i dont suggest anyone amazing footwear ❤️ stylish and comfortable the sandals are very comfortable casual wear\nlove them i purchased the sandals on 14 march as the product started developing cracks all over jointspasting within 2 months i didnt expect this from bata the online seller selling oldduplicate products bata comfit🐾 sandals are just awesome\nlooks very elegant\nvery comfortable and easy to wear and remove fastly\nbought it for 1499 worth it ✨ with in a one month its broken and its sole get seprated all products are defected,Amazon,https://m.media-amazon.com/images/I/71NnSxTN4wL._UX500_.jpg,5.394900000000001,0.0023253068640924817
15,https://www.amazon.in/Red-Tape-Womens-Purple-Sliders-6/dp/B0BPPMKCTD/ref=zg_bs_1983633031_sccl_16/258-1229559-2740407?psc=1,Red Tape,Women's Sliders,₹899.,4.4,66,11,this is value for money its even cheaper on amazon from red tapes store nearbyi just love it light weight n comfortable size little bit small liked very much good quality genuine product for great discount and it looks nice its very light weight n fit to my feet becomes dirty very fast product is of good quality 👍 love the product good quality genuine product for great discount,Amazon,https://m.media-amazon.com/images/I/61O7a9TnWbL._UY500_.jpg,5.6371,0.0021884584934452667
61,http://flipkart.com/mochi-women-pink-heels/p/itm4565a8b51cf0c?pid=SNDGHFP5EZWNEXSZ&lid=LSTSNDGHFP5EZWNEXSZJESXXT&marketplace=FLIPKART&store=osp%2Fiko&srno=b_1_22&otracker=browse&fm=organic&iid=25d08c2b-116b-437e-b7d7-13c9411da35f.SNDGHFP5EZWNEXSZ.SEARCH&ppt=None&ppn=None&ssid=7c2xuwjlxc0000001680019115979,MOCHI ,Women Pink Heels Sandal,₹921,4.3,136,13,its beautiful and same as the showed images and description absolutely stylish and such lovely color comfortable too but the heel is little hard tough nice,Flipkart,https://rukminim1.flixcart.com/image/832/832/xif0q/sandal/7/s/f/7-40-2515-40-mochi-24-pink-original-imaghhygzrufr5dv.jpeg?q=70,1.8866999999999998,0.002066858467113667
85,http://flipkart.com/mochi-women-black-heels/p/itm4d2e382e5e013?pid=SNDFH8RDRXB63J9T&lid=LSTSNDFH8RDRXB63J9T8BBO1O&marketplace=FLIPKART&store=osp%2Fiko&srno=b_2_47&otracker=browse&fm=organic&iid=f5fcd0bd-d477-4242-a189-0e5d1279be95.SNDFH8RDRXB63J9T.SEARCH&ppt=None&ppn=None&ssid=uspv1s5s9c0000001680019116685,MOCHI ,Women Black Heels Sandal,"₹1,048",4.0,179,11,just wore it twice already the sole is coming out totally a waste of money nice product 👍 product was good but the size is bigger,Flipkart,https://rukminim1.flixcart.com/image/832/832/k1qr5ow0/sandal/j/9/t/33-606-40-mochi-11-black-original-imafh8shffesjk4a.jpeg?q=70,0.4404,0.0019431860448795787
138,https://www.snapdeal.com/product/apratim-blue-flats/678702717105,Apratim Blue Fla,Apratim Blue Flats,329,5.0,3,0,,Snapdeal,https://n3.sdlcdn.com/imgs/k/d/i/Apratim-Blue-Flats-SDL541192658-1-0cd6d.jpg,0.0,0.0019171142063274993
134,https://www.snapdeal.com/product/ajanta-beige-flats/633708539288,Ajanta Beige Fla,Ajanta Beige Flats,799,4.3,3,0,,Snapdeal,https://n1.sdlcdn.com/imgs/k/a/5/Ajanta-Beige-Flats-SDL288156157-1-d342d.jpg,0.0,0.0016487182174416493
7,https://www.amazon.in/SOLETHREADS-SUMMER-Comfort-Cushion-Handcrafted/dp/B0BV79DKCX/ref=zg_bs_1983633031_sccl_8/258-1229559-2740407?psc=1,SOLETHREADS,SUMMER SANDAL| Super Soft | Comfort | Cushion | Bounce Back | Durable | Handcrafted Upper | Outdoor | Flip Flops Sandals for Women,₹499,3.5,18,10,colour is beautiful but the plastic straps are hard and so don’t give the comfort one would expect from a foam base sandal good as expected such a pretty color and perfect looking sandal but the footbed is so rough it hurts strap is not easy to open and close  makes it hard to use these are a great pair of sandals for all weather\nthey are a snug fit and soft but firm\nwear them on the beach or to a party really supercomfortable and cool productbest is tge light pink shade adjustable straps with flexible soalthankyou soalthreads quality good but size is small not impress flats are nice but price is very high compare to other apps like myntra and all try to decrease the price ,Amazon,https://m.media-amazon.com/images/I/61pv2kXejrL._UY500_.jpg,5.8211,0.0015186335632927956
93,http://flipkart.com/ajanta-pu2015-women-green-flats/p/itmd8e0b4d3388f7?pid=SNDGGRGECVZ7JYDM&lid=LSTSNDGGRGECVZ7JYDMA6CIZC&marketplace=FLIPKART&store=osp%2Fiko&srno=b_2_55&otracker=browse&fm=organic&iid=f5fcd0bd-d477-4242-a189-0e5d1279be95.SNDGGRGECVZ7JYDM.SEARCH&ppt=None&ppn=None&ssid=uspv1s5s9c0000001680019116685,AJANTA ,Women PU2015 Green Flats Sandal,₹309,4.3,96,9,nicegood quality😊 good product i like it very much  good purchase  thankyou flipkart,Flipkart,https://rukminim1.flixcart.com/image/832/832/xif0q/sandal/k/d/z/5-pu2015-ajanta-green-original-imaggrgenbmhxbgn.jpeg?q=70,1.9604,0.0014666634037402944
36,https://www.amazon.in/Feel-Cream-Wedge-Heels-Womens/dp/B07H93DRRQ/ref=zg_bs_1983633031_sccl_37/258-1229559-2740407?psc=1,Feel it,Women's Casual Sandal (Black,₹551,3.7,98,5,nice quality nice sandal it has the perfect fit nice fit and comfortable to wear beautiful,Amazon,https://m.media-amazon.com/images/I/61afMMZjamL._UY500_.jpg,3.6688,0.0013546792766344498
21,https://www.amazon.in/Fashion-Sandals-Comfortable-Stylish-Floaters/dp/B09YHLVY7D/ref=zg_bs_1983633031_sccl_22/258-1229559-2740407?psc=1,Earth Step,Women's Black Wedge Heel Sandal for girls,₹490,3.9,38,9,comfortable helpful for short hight girl very nice 👍🏼 good light weight comfortable got thi in july it has a very good fitting and is comfortable but not durable my footwear broke at the sole so please think before buying nice its very comfortable painful dont buy size is not proper1,Amazon,https://m.media-amazon.com/images/I/61yOyGVO5yL._UY500_.jpg,3.6440000000000006,0.0011436895315249948
76,http://flipkart.com/bata-women-beige-flats/p/itmb3fe85954629b?pid=SFFGGSBSCYVZNWZM&lid=LSTSFFGGSBSCYVZNWZM1OR5KJ&marketplace=FLIPKART&store=osp%2Fiko&srno=b_1_37&otracker=browse&fm=organic&iid=25d08c2b-116b-437e-b7d7-13c9411da35f.SFFGGSBSCYVZNWZM.SEARCH&ppt=None&ppn=None&ssid=7c2xuwjlxc0000001680019115979,Bata ,Women Beige Flats Sandal,₹710,4.1,71,3,quality is good and also it very light awesome 😎 excellent quality,Flipkart,https://rukminim1.flixcart.com/image/832/832/xif0q/sandal/n/y/3/-original-imaggjdfzvw3tphh.jpeg?q=70,2.096,0.0008907445582821603
20,https://www.amazon.in/SABBAG-Trendy-Newly-Block-Sandal/dp/B0BKVQWVM8/ref=zg_bs_1983633031_sccl_21/258-1229559-2740407?psc=1,SABBAG,Trendy And Newly Look Tie Block Heel Sandal For Women And Girl,₹379,4.0,17,5,sandels are beautiful but little loose for me my size is 5 nice 🙂 i really loved this product same as shown in in the pic super comfy and perfectly fit this is very nice\nsame as shown in the pic\nthank you 😊 my wife told me to give a 5 star rating as this sandal was liked by her so much the fitting the comfort the style the quality all are awesome very soon she will order with different colours,Amazon,https://m.media-amazon.com/images/I/41WszXSJEoL._UY500_.jpg,5.4289000000000005,0.0008068819304335065
13,https://www.amazon.in/crocs-Classic-Flip-207713-410-Women/dp/B0BQC1Y1CD/ref=zg_bs_1983633031_sccl_14/258-1229559-2740407?psc=1,crocs,unisex-adult Classic Flip Flip-Flop,₹997,3.6,28,8,crocs batch is missing from slippers which was there in pic wen placing order bought it for 900 rupees only looks good not comfortable crocs should really work on this not comfortable material doesnt feel like that of my others crocs  very ugly n horrible looking pair of flip flops avoid at all cost never seen such a pair ever  not worth anything my wife is in love with this and with me too 🤣 i ordered these in good faith and ordered a uk womens size 8 i am aware of how the croc sizing works so ordered a croc size that was equal to my foot details but obviously the company cannot read and sent me a size smaller they just about fit and i was going to keep them as the next size up which is the one that i would need is actually £2500 more expensive absolute ripoff charging £2500 for an extra cm or so\nvery disappointing especially as i waited 3 weeks for them really not worth the money for the flip,Amazon,https://m.media-amazon.com/images/I/71T1xLJAN4L._UX500_.jpg,2.1505000000000005,0.0006588915500487331
140,https://www.snapdeal.com/product/aqualite-red-flats/8070451183551721348,Aqualite Black Fla,Aqualite Black Flats,319,5.0,1,0,,Snapdeal,https://n3.sdlcdn.com/imgs/k/e/x/Aqualite-Black-Flats-SDL705858695-1-9f742.jpg,0.0,0.0006390380687758331
9,https://www.amazon.in/MOHUK-Round-Kolhapuri-Sandals-numeric_6/dp/B0BKT5BV86/ref=zg_bs_1983633031_sccl_10/258-1229559-2740407?psc=1,MOHUK,Round Open Toe Kolhapuri Style Flat Sandals for Women,₹299,3.9,12,4,quality and looks wise also it’s good loved the sandals color is too good and it will go with jeans and kurtas both good product with minimum price worth it 😊 very comfortable and true fit i like this productyou can buy,Amazon,https://m.media-amazon.com/images/I/711ydlKkCiL._UY500_.jpg,4.996500000000001,0.0005857410847378147
58,http://flipkart.com/dymo-footwear-women-gold-heels/p/itm5f6acbf538e38?pid=SNDG8NCHW9XN6AGA&lid=LSTSNDG8NCHW9XN6AGAZFX9CC&marketplace=FLIPKART&store=osp%2Fiko&srno=b_1_19&otracker=browse&fm=organic&iid=25d08c2b-116b-437e-b7d7-13c9411da35f.SNDG8NCHW9XN6AGA.SEARCH&ppt=None&ppn=None&ssid=7c2xuwjlxc0000001680019115979,DYMO FOOTWEAR ,Women Gold Heels Sandal,₹549,3.5,6,4,size too small order atleast 2 size large beautiful and stylish in looks size and fitting is quite comfortable i love transparent design very much best for festival or party occasion beautiful color suits my skin tone perfect fit i measured my feet in centimetres before placing the order so as to avoid size issues later i hope it proves to be durable too three cheers for my high heel,Flipkart,https://rukminim1.flixcart.com/image/832/832/kvtuxe80/sandal/k/h/u/8-n-112-8-dymo-footwear-golden-original-imag8n6ukxjrtztp.jpeg?q=70,5.4332,0.000560531196471139
62,http://flipkart.com/bata-women-black-flats/p/itm29ab30d20720a?pid=SFFGFQZQKQNPGDZP&lid=LSTSFFGFQZQKQNPGDZPSCED3Y&marketplace=FLIPKART&store=osp%2Fiko&srno=b_1_23&otracker=browse&fm=organic&iid=25d08c2b-116b-437e-b7d7-13c9411da35f.SFFGFQZQKQNPGDZP.SEARCH&ppt=None&ppn=None&ssid=7c2xuwjlxc0000001680019115979,Bata ,Women Black Flats Sandal,₹771,4.0,25,2,just wowi usually wear 5 size but in this brand size 4 fits me perfectly good 😊😊🌷,Flipkart,https://rukminim1.flixcart.com/image/832/832/l3lx8cw0/sandal/u/z/h/8-6716878-8-bata-black-original-imagezrvzfupqwgd.jpeg?q=70,1.9774000000000003,0.00034784900707094714
25,https://www.amazon.in/HEADTAILS-HD-21-Black-Heel-Sandal/dp/B0BWJJMGSJ/ref=zg_bs_1983633031_sccl_26/258-1229559-2740407?psc=1,HEADTAILS,Black Heel Sandal,₹379,3.6,5,3,very good product amazing product money worth it🥰 i liked it the first time i wore it it was comfortable but just in 2 days the strap torn off i was in office and it was embarrassing i had to go near by store to get a new shoe i would have uploaded pictures but i threw away,Amazon,https://m.media-amazon.com/images/I/418XQXj881L._UY500_.jpg,2.3603,0.00021115137251116777
84,http://flipkart.com/carlton-london-women-black-heels/p/itmfe2zrsk2adg3h?pid=SNDFE2ZRZZK7WXBY&lid=LSTSNDFE2ZRZZK7WXBY3SGXQN&marketplace=FLIPKART&store=osp%2Fiko&srno=b_2_46&otracker=browse&fm=organic&iid=f5fcd0bd-d477-4242-a189-0e5d1279be95.SNDFE2ZRZZK7WXBY.SEARCH&ppt=None&ppn=None&ssid=uspv1s5s9c0000001680019116685,CARLTON LONDON ,Women Black Heels Sandal,₹749,3.7,12,0,,Flipkart,https://rukminim1.flixcart.com/image/832/832/jvzkb680/sandal/u/r/r/cll-4709black-38-carlton-london-black-original-imafgs54b7fyxk2r.jpeg?q=70,0.0,0.00011349316101458798
65,http://flipkart.com/dressberry-women-silver-flats/p/itm76166a71f7cd2?pid=SNDGFQWNETHEUXJ5&lid=LSTSNDGFQWNETHEUXJ5RBYVPN&marketplace=FLIPKART&store=osp%2Fiko&srno=b_1_26&otracker=browse&fm=organic&iid=25d08c2b-116b-437e-b7d7-13c9411da35f.SNDGFQWNETHEUXJ5.SEARCH&ppt=None&ppn=None&ssid=7c2xuwjlxc0000001680019115979,Dressberry ,Women Silver Flats Sandal,₹469,3.8,6,1,very cheap qualityafter two use the slipper was torndont buy this,Flipkart,https://rukminim1.flixcart.com/image/832/832/xif0q/sandal/5/s/a/-original-imaghfjbtyhgvhy5.jpeg?q=70,0.0,5.828027187235597e-05
78,http://flipkart.com/myra-women-tan-flats/p/itm66224c5cf808d?pid=SNDGNZCEEHDG5GK5&lid=LSTSNDGNZCEEHDG5GK5LZT5NG&marketplace=FLIPKART&store=osp%2Fiko&srno=b_1_40&otracker=browse&fm=organic&iid=en_3RAEDcqjgoNTyJM7j7C6cFQGhRNDCWYJarvl0DtBl19MfJFBXpv%2BRogUcceq%2ByGMvsaktJb2iIvPBIpI3AWJ5g%3D%3D&ppt=None&ppn=None&ssid=7c2xuwjlxc0000001680019115979,MYRA ,Women Tan Flats Sandal,₹899,0.0,0,0,,Flipkart,https://rukminim1.flixcart.com/image/832/832/xif0q/sandal/0/s/q/8-ms1520c-myra-tan-original-imagnzcegxhcd9qy.jpeg?q=70,0.0,0.0
40,http://flipkart.com/hidesign-women-red-flats/p/itmdd2216fd1d5f5?pid=SNDGDBVJXKWWMYZK&lid=LSTSNDGDBVJXKWWMYZKHNNCS5&marketplace=FLIPKART&store=osp%2Fiko&srno=b_1_1&otracker=browse&fm=organic&iid=en_3RAEDcqjgoNTyJM7j7C6cFQGhRNDCWYJarvl0DtBl1%2BSrOiOKuwZNT1mKtdkp4g88tNBJdsAW9TlFIVaaU4TSw%3D%3D&ppt=None&ppn=None&ssid=7c2xuwjlxc0000001680019115979,HIDESIGN ,Women Red Flats Sandal,"₹1,847",0.0,0,0,,Flipkart,https://rukminim1.flixcart.com/image/832/832/l4oi4cw0/sandal/y/v/a/5-aretha-38-hidesign-red-original-imagfguunpbhxd5d.jpeg?q=70,0.0,0.0
37,https://www.amazon.in/Stylish-Slippers-Comfortable-Occasions-numeric_6/dp/B0BX41257T/ref=zg_bs_1983633031_sccl_38/258-1229559-2740407?psc=1,Generic,& Girls Stylish Fashion Slippers First Choice Wedge Heel Comfortable Sandals Formal Wear Occasions Pack Of 1.,₹449.,0.0,0,0,,Amazon,https://m.media-amazon.com/images/I/81hiOd3of4L._UY500_.jpg,0.0,0.0
55,http://flipkart.com/hasten-women-pink-heels/p/itm6aff8283b9426?pid=SNDGNXYZGGG7TRRU&lid=LSTSNDGNXYZGGG7TRRULCUIK9&marketplace=FLIPKART&store=osp%2Fiko&srno=b_1_16&otracker=browse&fm=organic&iid=en_3RAEDcqjgoNTyJM7j7C6cFQGhRNDCWYJarvl0DtBl1%2B%2FWCn25%2BmJUuZd7He3edh1URIg%2FBrvPrGDj2W6oPNM%2FA%3D%3D&ppt=None&ppn=None&ssid=7c2xuwjlxc0000001680019115979,HASTEN ,Women Pink Heels Sandal,₹899,0.0,0,0,,Flipkart,https://rukminim1.flixcart.com/image/832/832/xif0q/sandal/o/y/9/7-1542-rani-pink-7-hasten-rani-pink-original-imagz33raqgcs5fu.jpeg?q=70,0.0,0.0
108,https://www.snapdeal.com/product/ajanta-blue-flats/684176884757#bcrumbLabelId:264,Ajanta Blue Fla,Ajanta Blue Flats,649,0.0,0,0,,Snapdeal,https://n1.sdlcdn.com/imgs/k/d/3/Ajanta-Blue-Flats-SDL029334734-1-c5060.jpg,0.0,0.0
139,https://www.snapdeal.com/product/ortho-joy-pink-womens-flats/5188147430569055952,ORTHO JOY,Green Women's Flats,499,0.0,0,0,,Snapdeal,https://n2.sdlcdn.com/imgs/k/k/v/ORTHO-JOY-Green-Women-s-SDL431932357-1-c0580.jpg,0.0,0.0
59,http://flipkart.com/shoegazing-women-blue-flats/p/itm4db886c423147?pid=SNDGMA86YGGDG7T3&lid=LSTSNDGMA86YGGDG7T3LBP1RJ&marketplace=FLIPKART&store=osp%2Fiko&srno=b_1_20&otracker=browse&fm=organic&iid=en_3RAEDcqjgoNTyJM7j7C6cFQGhRNDCWYJarvl0DtBl18%2FdXxn8C5UGkQ8RLdbkCC1yZBFoDuJexdI7YMBv9Qnjw%3D%3D&ppt=None&ppn=None&ssid=7c2xuwjlxc0000001680019115979,shoegazing ,Women Blue Flats Sandal,₹417,0.0,0,0,,Flipkart,https://rukminim1.flixcart.com/image/832/832/xif0q/sandal/n/6/t/8-women-sandal-shoegazing-light-blue-original-imagma86azqfsfsb.jpeg?q=70,0.0,0.0
113,https://www.snapdeal.com/product/liberty-peach-womens-flats/6917529660566063913#bcrumbLabelId:264,Liberty,Peach Women's Flats,1299,0.0,0,0,,Snapdeal,https://n4.sdlcdn.com/imgs/k/m/c/Liberty-Peach-Women-s-Flats-SDL967614508-1-ab69e.jpg,0.0,0.0
