index,url,brand,name,price,stars,num_ratings,num_reviews,reviews,platform,image,vader_score,final_score
20,https://www.amazon.in/layasa-Comfotable-Lightweight-Numeric_3-MULTICOLUR/dp/B0BNZB3L6B/ref=zg_bs_9780815031_sccl_21/257-0329217-1454160?psc=1,layasa,Stylish Trendy Lightweight Canvas Casual High Top Sneaker Shoes for Women's & Girls| Sneakers| White Sneakers|Running Shoes,₹399,3.9,185,57,quality product value for money go for it colour and design is exactly as what is shown shoe was stinking with glue smell received item today best shoes at this rate quality also good  loved the product quality and comfort worthy good product with good quality and worth the price same shown as picture,Amazon,https://m.media-amazon.com/images/W/IMAGERENDERING_521856-T2/images/I/41SLiVsN8hL.jpg,3.3987000000000003,0.006384471154083697
71,http://flipkart.com/adidas-aestheto-w-running-shoes-women/p/itm51260dfeec678?pid=SHOG9XNXQNEMHPMN&lid=LSTSHOG9XNXQNEMHPMNPNQZSS&marketplace=FLIPKART&store=osp%2Fiko&srno=b_1_34&otracker=browse&fm=organic&iid=14639c9a-4053-4688-b979-50fcfd8d974d.SHOG9XNXQNEMHPMN.SEARCH&ppt=None&ppn=None&ssid=vfgk5czj7k0000001679481119570,ADIDAS ,Aestheto W Running Shoes For Women  (Black),"₹1,745",4.2,458,33,same as shown in the picture excellent product nice product at a reasonable price good fitting and size just go for it 👍🏻,Flipkart,https://rukminim1.flixcart.com/image/832/832/xif0q/shoe/w/p/s/6-ga1083-6-adidas-cblack-dovgry-wilpnk-original-imagefp72rzz6yvk-bb.jpeg?q=70,1.4338,0.006295159969170777
92,http://flipkart.com/el-paso-boots-women/p/itmf797a9569b577?pid=SHOG2A4HATVMEEJG&lid=LSTSHOG2A4HATVMEEJGMLT1IE&marketplace=FLIPKART&store=osp%2Fiko&srno=b_2_55&otracker=browse&fm=organic&iid=bf4c57e6-29e5-4812-8263-55b3f3c7ea64.SHOG2A4HATVMEEJG.SEARCH&ppt=None&ppn=None&ssid=iqo2gqb1xs0000001679481120822,El Paso ,Boots For Women  (Black),"₹1,119",3.9,478,33,not comfortablehurts the feet same as shown in picture thanku so much flipkart 😍😍🥰🥰🥰 perfect,Flipkart,https://rukminim1.flixcart.com/image/832/832/xif0q/shoe/0/a/k/-original-imaghvb4mnwzuqz9.jpeg?q=70,1.5535,0.00622448034919596
31,https://www.amazon.in/layasa-Comfotable-Lightweight-Girls743-Numeric_6/dp/B0BG3XTBD6/ref=zg_bs_9780815031_sccl_32/257-0329217-1454160?psc=1,layasa,Comfotable Lightweight Casual Sneaker for Women/Girls743,₹379,4.0,147,28,like very comfortable and fully light weight happy shoes are very soft  comfortable good product  nice shoes worth to buy it is soft to wear in your legs and it is easy to wear thanks amazonplease purchase this shoes i like it very nice quality and comfortable pair shoes dont think twice and get it nice shoes light weight and soft i had bought it for me but it was a size bigger so i gave it to my mom anyway it worked out its perfectquality wise as well so placed another order for myself hehe🤭,Amazon,https://m.media-amazon.com/images/W/IMAGERENDERING_521856-T2/images/I/81arFCFUcZL._UY500_.jpg,6.881900000000001,0.005999044132718255
106,https://www.snapdeal.com/product/oneshine-white-womens-sneakers/673692559683#bcrumbLabelId:258,OneShine,White Women's Sneakers,575,4.8,9,0,,Snapdeal,https://n3.sdlcdn.com/imgs/k/k/6/OneShine-White-Women-s-Sneakers-SDL960515791-1-b68e5.jpg,0.0,0.005854118616368223
30,https://www.amazon.in/TRASE-Revel-II-Comfortable-Sneakers-Grey-Purple/dp/B0BFH4Q8H5/ref=zg_bs_9780815031_sccl_31/257-0329217-1454160?psc=1,TRASE,Revel-II Comfortable Stylish Sneakers for Women & Girls,₹599,3.8,123,31,like just wow 🤩 stylish and worth the money shi hai 🥰👍baki thora size ka issue hai but baki shoes shi hai the shoes look trendy the quality is good too\nthe only con i found is that the lace latches on to a very thin rubber fabric if we pull it hard while tyingit might break problem in the design\njust need to be careful other than that the shoes r just fine aswum worth for this price good to go  the shoes is not at all worth the price it will not last a week if not treated as a delicate purchase the sole seems to be glued so it can come off easily and the show lace area can be broken easily as the quality is so cheap nice these shoes are so classy and material is also so good these are very comfortable in wearing and very light weight i m loving these sneakers 😍,Amazon,https://m.media-amazon.com/images/W/IMAGERENDERING_521856-T2/images/I/61a-xm-IneL._UY500_.jpg,6.291000000000001,0.005725408198128322
34,https://www.amazon.in/Vendoz-Women-Stylish-Casual-Sneakers/dp/B0B5VDSHDC/ref=zg_bs_9780815031_sccl_35/257-0329217-1454160?psc=1,Vendoz,Women White Stylish Casual Sneakers,₹634,3.8,134,21,its a good onebut sole is little hard  neat pair fairly priced nice quality as per the price study and looking good worth the price and go one size down i wear 6 but 5 fit me perfectly it was much more good than i expected was in love with the shoes quality is also very good 👍🏻 i did not expect the product would be this good was completely satisfied with the product 💖 delivery was also on time buy it without any doubt… same as shown in picture pretty good i really liked it but mine didnt fit me well so i am exchanging themthe packaging was really nice quality too 1 number bada size chahiye,Amazon,https://m.media-amazon.com/images/W/IMAGERENDERING_521856-T2/images/I/51eVlts2QvL._UY500_.jpg,8.501900000000001,0.005461899252148095
89,http://flipkart.com/red-tape-walking-shoes-women/p/itm46f2e18122480?pid=SHOG9MRT6TT67FYP&lid=LSTSHOG9MRT6TT67FYPTAT03R&marketplace=FLIPKART&store=osp%2Fiko&srno=b_2_52&otracker=browse&fm=organic&iid=en_AT4ZTSB4E190736vbAo0k8Sh3AH2nIaZOqoofgKUo75CGPXKKJLTPf%2F8Sk%2FJmD8CZiH7bF2Tw3KlnJQlMM%2Fx9Q%3D%3D&ppt=None&ppn=None&ssid=iqo2gqb1xs0000001679481120822,RED TAPE ,Walking Shoes For Women  (White),"₹1,679",4.1,360,29,i selected size 5 prefect light weight awesome comfortable good product comfortable shoes,Flipkart,https://rukminim1.flixcart.com/image/832/832/xif0q/shoe/z/g/3/-original-imaggkkrzftdzbbq.jpeg?q=70,2.0865,0.005383682014737765
64,http://flipkart.com/skechers-go-walk-5-trendy-walking-shoes-women/p/itm85fa76545ab8d?pid=SHOGFHWZGQUYFFJD&lid=LSTSHOGFHWZGQUYFFJDP7A21Z&marketplace=FLIPKART&store=osp%2Fiko&srno=b_1_27&otracker=browse&fm=organic&iid=14639c9a-4053-4688-b979-50fcfd8d974d.SHOGFHWZGQUYFFJD.SEARCH&ppt=None&ppn=None&ssid=vfgk5czj7k0000001679481119570,Skechers ,GO WALK 5 - TRENDY Walking Shoes For Women  (Black),"₹3,329",4.4,287,22,great product 🔥 perfect fit 🔥brought for my mother and she loved it  simply awesome😍 excellent product  ,Flipkart,https://rukminim1.flixcart.com/image/832/832/xif0q/shoe/f/y/3/-original-imagj88kjzbjp57w.jpeg?q=70,3.1857,0.005024809442665371
55,http://flipkart.com/puma-buzz-wmn-casuals-women/p/itm09ba22dabad19?pid=SHOGGEYGFV8GEUDU&lid=LSTSHOGGEYGFV8GEUDUW8HRQB&marketplace=FLIPKART&store=osp%2Fiko&srno=b_1_18&otracker=browse&fm=organic&iid=14639c9a-4053-4688-b979-50fcfd8d974d.SHOGGEYGFV8GEUDU.SEARCH&ppt=None&ppn=None&ssid=vfgk5czj7k0000001679481119570,PUMA ,Puma Buzz Wmn Casuals For Women  (Pink),"₹1,499",4.2,372,17,as expectedlooks good too good loved by mother,Flipkart,https://rukminim1.flixcart.com/image/832/832/xif0q/shoe/n/3/m/-original-imaghkpahcrfpyyr.jpeg?q=70,1.4802,0.004809774057060533
35,https://www.amazon.in/TRASE-Revel-I-Comfortable-Sneakers-Grey-Black/dp/B0BFH3XQL8/ref=zg_bs_9780815031_sccl_36/257-0329217-1454160?psc=1,TRASE,"Revel-I Fancy, Comfortable Stylish Sneakers for Women & Girls",₹599,3.8,84,25,size as mentioned product is really good nice and sturdy shoes according to the price very comfortable and lightweight shoes \nhappy buying  yes i got it in right size and i really love it happy good product value for money go for it value for money i bought it as a gift for my friend and she really liked it as the shoes is colourful and the design is also good the combination of white and mix colours pops out nice good quality reasonable price for the shoe,Amazon,https://m.media-amazon.com/images/W/IMAGERENDERING_521856-T2/images/I/61h6nGP+yUL._UY500_.jpg,6.7617,0.004729820574130794
62,http://flipkart.com/denill-casuals-women/p/itm20306cd12adb2?pid=SHOG588PXQBRBGNZ&lid=LSTSHOG588PXQBRBGNZGWT6DW&marketplace=FLIPKART&store=osp%2Fiko&srno=b_1_25&otracker=browse&fm=organic&iid=14639c9a-4053-4688-b979-50fcfd8d974d.SHOG588PXQBRBGNZ.SEARCH&ppt=None&ppn=None&ssid=vfgk5czj7k0000001679481119570,Denill ,Casuals For Women  (Beige),₹349,3.7,340,28,product in comparison to the price and material it is really soft and comfortable to use awesum product soft inside n smart look goes wid western as well as salvar kameez its ok,Flipkart,https://rukminim1.flixcart.com/image/832/832/krgohow0/shoe/m/7/l/3-b-b61-36-denill-peach-original-imag588zx8rrbsam.jpeg?q=70,1.4817000000000002,0.004357986847111851
84,http://flipkart.com/skechers-flex-appeal-4-0-active-flow-running-shoes-women/p/itmf116fd1f655c9?pid=SHOGB8DYGBNAJ5DZ&lid=LSTSHOGB8DYGBNAJ5DZYL9LWP&marketplace=FLIPKART&store=osp%2Fiko&srno=b_2_47&otracker=browse&fm=organic&iid=bf4c57e6-29e5-4812-8263-55b3f3c7ea64.SHOGB8DYGBNAJ5DZ.SEARCH&ppt=None&ppn=None&ssid=iqo2gqb1xs0000001679481120822,Skechers ,FLEX APPEAL 4.0-ACTIVE FLOW Running Shoes For Women  (Black),"₹4,019",4.2,205,20,shoes quailty is not good and not value for money amazing one choice and my wife prefer that looks good on her feet and she really liked a lot and there was a perfect tthanks from her😄👍🏼😉,Flipkart,https://rukminim1.flixcart.com/image/832/832/xif0q/shoe/k/i/1/5-149305-8-skechers-nvy-original-imaggbrt3hzpahvu.jpeg?q=70,3.4705999999999997,0.003920439451441108
11,https://www.amazon.in/Kraasa-Sneakers-Women-Latest-Casual/dp/B0BQYZ3XSH/ref=zg_bs_9780815031_sccl_12/257-0329217-1454160?psc=1,Kraasa,Slip On Sneakers for Women | Latest Trend Women Casual Shoes,₹399,3.7,98,43,little tight buy one size bigger quality you cannot get great shoe with this priceand krass is the brand who fulfill middle class requirements those cant afford high rage shoeand not interested low range for them  this shoes are very light weight and comfortable to use very flexible and the quality is also good and the memory foam used inside are so soft to the feet can wear it for long hours without any discomfort this is the best product for this price value for money im so happy mujhe bahut pasand aaya waste of money  smooth wear  tear\nlong time wear👍running 🥳👍,Amazon,https://m.media-amazon.com/images/W/IMAGERENDERING_521856-T2/images/I/61MvmQ9SYzL._UY500_.jpg,2.9015,0.0038351450402029294
177,https://www.snapdeal.com/product/shoetopia-white-casual-shoes/663002267943,Shoetopia White Casual Sho,Shoetopia White Casual Shoes,599,3.9,7,0,,Snapdeal,https://n1.sdlcdn.com/imgs/k/b/d/Shoetopia-White-Casual-Shoes-SDL238783922-3-03ab0.jpg,0.0,0.0036994777367326975
173,https://www.snapdeal.com/product/campus-black-casual-shoes/636022637261,Campus Black Casual Sho,Campus Black Casual Shoes,849,4.0,6,0,,Snapdeal,https://n3.sdlcdn.com/imgs/j/n/1/Campus-Black-Casual-Shoes-SDL862693914-1-f22c3.jpeg,0.0,0.0032522881202045693
32,https://www.amazon.in/Puma-Womens-Glacial-Blue-Peony-Quarry-38510603/dp/B09CH62N61/ref=zg_bs_9780815031_sccl_33/257-0329217-1454160?psc=1,Puma,Womens Agile Trip WN's Idp Sneaker,"₹2,169",4.2,147,13,i have 22cm feet i took size 4 which a bit large for me but comfortable with socks it would be perfect size expected much breathebility the package was somewhat damaged delivery person regretted and suggested if any damage in product plz return it though product was in good condition i had to return it for some size issue the size guide should be updated with pic  video to understand properly same as shown in picture very nice product quality is very good original product go for it worth it very much satisfied 😇 bekar hai koi kam ka nahi hai my wife happy with this product ☺️ easy it fits perfectly and its very pretty this product is not original and material and sole are worst quality please think before purchasing,Amazon,https://m.media-amazon.com/images/W/IMAGERENDERING_521856-T2/images/I/81TZx8xuw-L._UX500_.jpg,5.1841,0.003214072699665095
60,http://flipkart.com/nike-flex-rn-2019-running-shoes-women/p/itmfhc25qds5vmzc?pid=SHOFHC25ZGZK5EPY&lid=LSTSHOFHC25ZGZK5EPYHUIGXF&marketplace=FLIPKART&store=osp%2Fiko&srno=b_1_23&otracker=browse&fm=organic&iid=14639c9a-4053-4688-b979-50fcfd8d974d.SHOFHC25ZGZK5EPY.SEARCH&ppt=None&ppn=None&ssid=vfgk5czj7k0000001679481119570,NIKE ,Flex RN 2019 Running Shoes For Women  (Black),"₹2,371",4.3,214,19,excellent very bice product and size and fir of shoe is perfect nice,Flipkart,https://rukminim1.flixcart.com/image/832/832/xif0q/shoe/w/p/z/aq7487-001-nike-black-white-anthracite-original-imafuhpruzdvvtzz-bb.jpeg?q=70,1.5653,0.0031739057842555167
102,https://www.snapdeal.com/product/aqualite-pink-womens-derby-shoes/5764608149734325515#bcrumbLabelId:258,Aqualite,Pink Women's Derby Shoes,775,3.8,6,0,,Snapdeal,https://n2.sdlcdn.com/imgs/k/h/r/Aqualite-Pink-Women-s-Derby-SDL967683563-1-0301d.jpg,0.0,0.00308967371419434
124,https://www.snapdeal.com/product/aqualite-pink-womens-sneakers/662472244589,Aqualite,Pink Women's Sneakers,575,3.8,6,1,,Snapdeal,https://n4.sdlcdn.com/imgs/k/g/6/Aqualite-Pink-Women-s-Sneakers-SDL526645528-2-0891d.jpg,0.0,0.00308967371419434
67,http://flipkart.com/skechers-go-run-fast-float-running-shoes-women/p/itm5ddab3b9f1c4c?pid=SHOG4VHZDUUZWAJX&lid=LSTSHOG4VHZDUUZWAJXA547M6&marketplace=FLIPKART&store=osp%2Fiko&srno=b_1_30&otracker=browse&fm=organic&iid=14639c9a-4053-4688-b979-50fcfd8d974d.SHOG4VHZDUUZWAJX.SEARCH&ppt=None&ppn=None&ssid=vfgk5czj7k0000001679481119570,Skechers ,GO RUN FAST-FLOAT Running Shoes For Women  (White),"₹3,299",4.5,178,25,good just as expected looks great good product,Flipkart,https://rukminim1.flixcart.com/image/832/832/kuvkcy80/shoe/c/k/y/7-15109-10-skechers-bkw-original-imag7wkxhgy2vsx9.jpeg?q=70,1.5057,0.00303149902805548
82,http://flipkart.com/nike-w-nkrevolution-6-nn-running-shoes-women/p/itm8df6c09df037a?pid=SHOGG47MV85KP5KU&lid=LSTSHOGG47MV85KP5KUUIUIXG&marketplace=FLIPKART&store=osp%2Fiko&srno=b_2_45&otracker=browse&fm=organic&iid=bf4c57e6-29e5-4812-8263-55b3f3c7ea64.SHOGG47MV85KP5KU.SEARCH&ppt=None&ppn=None&ssid=iqo2gqb1xs0000001679481120822,NIKE ,W NKREVOLUTION 6 NN Running Shoes For Women  (Purple),"₹2,587",4.2,190,13,excellent product comfortable shoes with good grip and sole comfort decent purchase the product is amazing,Flipkart,https://rukminim1.flixcart.com/image/832/832/xif0q/shoe/z/i/5/-original-imagk3gfdav4gtsy.jpeg?q=70,2.4699999999999998,0.0028968822537997784
81,http://flipkart.com/red-tape-walking-shoes-women/p/itm365de11b8933b?pid=SHOG7T2B4G9UYUR8&lid=LSTSHOG7T2B4G9UYUR8QLOVUT&marketplace=FLIPKART&store=osp%2Fiko&srno=b_2_44&otracker=browse&fm=organic&iid=en_AT4ZTSB4E190736vbAo0k8Sh3AH2nIaZOqoofgKUo75SVU2qxe8Y76EpsGVYnr4MN1beABcJluvQWpB0rghiGA%3D%3D&ppt=None&ppn=None&ssid=iqo2gqb1xs0000001679481120822,RED TAPE ,Walking Shoes For Women  (Grey),"₹1,979",4.2,193,21,great good quality jst ok,Flipkart,https://rukminim1.flixcart.com/image/832/832/xif0q/shoe/j/8/f/-original-imaghqyukhsdeyx9.jpeg?q=70,1.3613000000000002,0.002850494013401204
99,https://www.snapdeal.com/product/do-bhai-white-casual-shoes/5764608206441272763#bcrumbLabelId:258,Do Bhai White Casual Sho,Do Bhai White Casual Shoes,699,3.5,6,0,,Snapdeal,https://n1.sdlcdn.com/imgs/j/u/b/Do-Bhai-White-Casual-Shoes-SDL650852137-2-7405b.jpg,0.0,0.002845752105178998
27,https://www.amazon.in/Sichumaria-Anti-Wrinkle-Protectors-Defloder-Indentation/dp/B0B14HTLSD/ref=zg_bs_9780815031_sccl_28/257-0329217-1454160?psc=1,Sichumaria,Anti-Wrinkle Shoes Flod Protectors Toe Box Defloder Shoes Flod Guards for Sneaker and Casual Shoes Soft Material Prevent Shoes Flod Indentation for Men's 7-12,₹238,3.6,128,12,fitted perfectly into my fila ankle shoe and supporting perfectly\nthere is no wrinkles after using this  it very light weight so you won’t feel any difference\nyou just need get used to it the product work very well for my nike sb dunks low but are not working that well for adidas high ankle shoes both are made of leather the product is very fragile but works like charm doesnt work as advertised good not shoes shape i bought this to prevent or lessen creases on my newly bought chelsea boots works great for now loved it good one absolutely worthless product  no protection provided to sneakers its not worth at all the product is not value for money even it is not enough effective to protect shoes from creases the product prices are too high i think according to the quality the product prices will 25 to 30 inr\n\noverall the product is useless nice 👍 product its repaired my crease on my shoes 👟,Amazon,https://m.media-amazon.com/images/W/IMAGERENDERING_521856-T2/images/I/41mShz1CCaL._UX500_.jpg,4.6369,0.002521004838432903
165,https://www.snapdeal.com/product/paragon-black-womens-sneakers/6917529684257935127,Paragon,Pink Women's Sneakers,441,3.8,4,0,,Snapdeal,https://n2.sdlcdn.com/imgs/k/f/l/Paragon-Pink-Women-s-Sneakers-SDL729075878-1-10e40.jpg,0.0,0.0020597824761295603
68,http://flipkart.com/nike-flex-tr-9-s-training-gym-shoes-women/p/itm48405e764125b?pid=SHOFS5GQ7STZZYWS&lid=LSTSHOFS5GQ7STZZYWSYWOO7K&marketplace=FLIPKART&store=osp%2Fiko&srno=b_1_31&otracker=browse&fm=organic&iid=14639c9a-4053-4688-b979-50fcfd8d974d.SHOFS5GQ7STZZYWS.SEARCH&ppt=None&ppn=None&ssid=vfgk5czj7k0000001679481119570,NIKE ,Flex TR 9 's Training & Gym Shoes For Women  (Black),"₹1,901",4.3,108,11,i loved it❤️so comfortable exactly same as shown in the picture i loved it 💜 very nice,Flipkart,https://rukminim1.flixcart.com/image/832/832/xif0q/shoe/a/e/r/aq7491-002nike-10-5-nike-black-white-anthracite-original-imafygrzsvkzpfhe-bb.jpeg?q=70,2.7678000000000003,0.0019546986026563423
40,http://flipkart.com/skechers-ultra-flex-joyful-path-walking-shoes-women/p/itm1e48a3feae0fb?pid=SHOGFHWZQFAEAYEH&lid=LSTSHOGFHWZQFAEAYEHTEZSJL&marketplace=FLIPKART&store=osp%2Fiko&srno=b_1_3&otracker=browse&fm=organic&iid=14639c9a-4053-4688-b979-50fcfd8d974d.SHOGFHWZQFAEAYEH.SEARCH&ppt=None&ppn=None&ssid=vfgk5czj7k0000001679481119570,Skechers ,ULTRA FLEX-JOYFUL PATH Walking Shoes For Women  (Red),"₹4,249",4.1,127,10,superb nice product genuine and good quality nice product genuine and good quality,Flipkart,https://rukminim1.flixcart.com/image/832/832/xif0q/shoe/n/m/k/4-149682-7-skechers-dkrs-original-imaghzzahsazfbwm.jpeg?q=70,2.3487,0.0019481904700901786
138,https://www.snapdeal.com/product/bersache-black-womens-sneakers/653264261685,Bersache,Black Women's Sneakers,489,4.7,3,0,,Snapdeal,https://n4.sdlcdn.com/imgs/k/i/5/Bersache-Black-Women-s-Sneakers-SDL610774600-5-57817.jpg,0.0,0.0019107192706201844
83,http://flipkart.com/bersache-lightweight-color-changing-sports-walking-shoes-high-quality-sole-running-women/p/itmc21249637fc95?pid=SHOGMNGXNQRMP7XM&lid=LSTSHOGMNGXNQRMP7XMAHKR7L&marketplace=FLIPKART&store=osp%2Fiko&srno=b_2_46&otracker=browse&fm=organic&iid=bf4c57e6-29e5-4812-8263-55b3f3c7ea64.SHOGMNGXNQRMP7XM.SEARCH&ppt=None&ppn=None&ssid=iqo2gqb1xs0000001679481120822,BERSACHE ,"Lightweight Color Changing Sports,Walking Shoes with High Quality Sole Running Shoes For Women  (White)",₹649,4.2,95,11,wow nice shoes awesome product 😊👍 nice productsize  5,Flipkart,https://rukminim1.flixcart.com/image/832/832/xif0q/shoe/d/p/r/5-ori-9053-5-bersache-white-original-imagnzfywbenmtqg.jpeg?q=70,2.7722,0.0017785554387425963
172,https://www.snapdeal.com/product/asian-pink-casual-shoes/6917529655806469388,ASIAN Navy Casual Sho,ASIAN Navy Casual Shoes,439,4.3,3,0,,Snapdeal,https://n4.sdlcdn.com/imgs/i/6/d/ASIAN-Navy-Casual-Shoes-SDL123731558-3-96265.jpeg,0.0,0.0017481048646099556
98,https://www.snapdeal.com/product/do-bhai-blue-casual-shoes/5764608193983988297#bcrumbLabelId:258,Do Bhai Red Casual Sho,Do Bhai Red Casual Shoes,749,4.3,3,0,,Snapdeal,https://n3.sdlcdn.com/imgs/j/w/8/Do-Bhai-Red-Casual-Shoes-SDL556693075-2-6b282.jpeg,0.0,0.0017481048646099556
170,https://www.snapdeal.com/product/trase-multi-color-casual-shoes/686069480127,Trase Multi Color Casual Sho,Trase Multi Color Casual Shoes,539,4.5,2,1,nice product,Snapdeal,https://n1.sdlcdn.com/imgs/k/e/k/Trase-Multi-Color-Casual-Shoes-SDL276901006-9-3e1c0.jpg,0.4215,0.0017014324620863155
168,https://www.snapdeal.com/product/shoetopia-pink-casual-shoes/6917529684037432426,Shoetopia Pink Casual Sho,Shoetopia Pink Casual Shoes,699,4.0,3,0,,Snapdeal,https://n4.sdlcdn.com/imgs/k/b/d/Shoetopia-Pink-Casual-Shoes-SDL047245870-1-603aa.jpg,0.0,0.0016261440601022846
46,http://flipkart.com/skechers-arch-fit-uplift-defined-walking-shoes-women/p/itme68ef2ad96e16?pid=SHOGFHXYWDGZTHFR&lid=LSTSHOGFHXYWDGZTHFRIPAEUV&marketplace=FLIPKART&store=osp%2Fiko&srno=b_1_9&otracker=browse&fm=organic&iid=14639c9a-4053-4688-b979-50fcfd8d974d.SHOGFHXYWDGZTHFR.SEARCH&ppt=None&ppn=None&ssid=vfgk5czj7k0000001679481119570,Skechers ,ARCH FIT UPLIFT - DEFINED Walking Shoes For Women  (Grey),"₹2,849",4.0,107,7,best quality not comfortable at all very hard doesnt seems like sketchers best and the best,Flipkart,https://rukminim1.flixcart.com/image/832/832/xif0q/shoe/b/y/i/-original-imagj88kfxzv3fud.jpeg?q=70,2.6798,0.0015888487893933104
139,https://www.snapdeal.com/product/trenduty-white-casual-shoes/684670887065,Trenduty White Casual Sho,Trenduty White Casual Shoes,899,3.7,3,0,,Snapdeal,https://n3.sdlcdn.com/imgs/k/c/8/Trenduty-White-Casual-Shoes-SDL268415442-2-0addd.jpg,0.0,0.0015041832555946133
22,https://www.amazon.in/ZOVIM-Chunky-Sneakers-Stylish-R5-White-6/dp/B0BTPF8GGS/ref=zg_bs_9780815031_sccl_23/257-0329217-1454160?psc=1,ZOVIM,Women Shoes Chunky Sneakers Shoes for Womens and Girls Stylish R5,₹799,4.3,14,8,no any quary fit is perfect and comfortable to wear pretty looking shoes i am using this for fests and walking very very nice 👍😊 loved the quality of shoes easy to use and very comfortable shoes thanks lovehush zovim its very comfortable thank you nice product and quality like the product,Amazon,https://m.media-amazon.com/images/W/IMAGERENDERING_521856-T2/images/I/51rBm4fl0LL._UY500_.jpg,6.426800000000001,0.0013386114151642363
96,http://flipkart.com/dressberry-casuals-women/p/itm527e49ad5bcfa?pid=SNDGCBAQBFD55RUP&lid=LSTSNDGCBAQBFD55RUPQ1OHTN&marketplace=FLIPKART&store=osp%2Fiko&srno=b_2_59&otracker=browse&fm=organic&iid=bf4c57e6-29e5-4812-8263-55b3f3c7ea64.SNDGCBAQBFD55RUP.SEARCH&ppt=None&ppn=None&ssid=iqo2gqb1xs0000001679481120822,Dressberry ,Casuals For Women  (Gold),₹542,3.8,102,5,excellent same as mentioned in the description product is nicebut it took so much time to deliver,Flipkart,https://rukminim1.flixcart.com/image/832/832/l33cia80/shoe/f/t/i/-original-imageaf7gg5t4yzs.jpeg?q=70,0.5719,0.0011158640056701543
43,http://flipkart.com/nike-wmns-waffle-debut-running-shoes-women/p/itm5b7032510e227?pid=SHOGG47MKDMRVMDV&lid=LSTSHOGG47MKDMRVMDVTUMAQX&marketplace=FLIPKART&store=osp%2Fiko&srno=b_1_6&otracker=browse&fm=organic&iid=14639c9a-4053-4688-b979-50fcfd8d974d.SHOGG47MKDMRVMDV.SEARCH&ppt=None&ppn=None&ssid=vfgk5czj7k0000001679481119570,NIKE ,WMNS Waffle Debut Running Shoes For Women  (Beige),"₹3,986",4.3,58,6,beautiful and classic hope they last long best shoes for running and workoutbest quality fabric is good this product is worth it soo comfortable and stylish,Flipkart,https://rukminim1.flixcart.com/image/832/832/xif0q/shoe/n/v/e/4-dh9523-602nike-6-5-nike-light-soft-pink-arctic-orange-original-imagnzbfumsptqw8.jpeg?q=70,2.8540000000000005,0.0010674290798851226
78,http://flipkart.com/dressberry-walking-shoes-women/p/itmad08f60cd4950?pid=SHOG5C3RVJVWX3JF&lid=LSTSHOG5C3RVJVWX3JFQOOMXC&marketplace=FLIPKART&store=osp%2Fiko&srno=b_2_41&otracker=browse&fm=organic&iid=bf4c57e6-29e5-4812-8263-55b3f3c7ea64.SHOG5C3RVJVWX3JF.SEARCH&ppt=None&ppn=None&ssid=iqo2gqb1xs0000001679481120822,Dressberry ,Walking Shoes For Women  (Pink),₹634,4.2,79,1,awesome bestest in the marketloved it✨❤️,Flipkart,https://rukminim1.flixcart.com/image/832/832/krkyt8w0/shoe/y/l/f/6-13882798-dressberry-pink-original-imag5cffj4xheqsc.jpeg?q=70,0.9431,0.0009208191650079396
86,http://flipkart.com/fila-training-gym-shoes-women/p/itmf889cba90b606?pid=SHOGDV7K9Z8MWTZA&lid=LSTSHOGDV7K9Z8MWTZA7C7JXM&marketplace=FLIPKART&store=osp%2Fiko&srno=b_2_49&otracker=browse&fm=organic&iid=bf4c57e6-29e5-4812-8263-55b3f3c7ea64.SHOGDV7K9Z8MWTZA.SEARCH&ppt=None&ppn=None&ssid=iqo2gqb1xs0000001679481120822,FILA ,Training & Gym Shoes For Women  (Grey),₹942,4.4,70,5,good quality ok design issue,Flipkart,https://rukminim1.flixcart.com/image/832/832/xif0q/shoe/j/c/q/7-11010511-7-fila-gcr-gry-dty-ros-original-imaghzzxvwybp9qw.jpeg?q=70,0.7363999999999999,0.0009189331918218705
41,http://flipkart.com/reebok-druhan-2-0-w-walking-shoes-women/p/itm6cc697d500209?pid=SHOGEUFGJNQ6QDMH&lid=LSTSHOGEUFGJNQ6QDMHEOMDP1&marketplace=FLIPKART&store=osp%2Fiko&srno=b_1_4&otracker=browse&fm=organic&iid=14639c9a-4053-4688-b979-50fcfd8d974d.SHOGEUFGJNQ6QDMH.SEARCH&ppt=None&ppn=None&ssid=vfgk5czj7k0000001679481119570,REEBOK ,Druhan 2.0 W Walking Shoes For Women  (Beige),"₹2,086",4.6,43,4,excellent shoes and very comfortable only thing is colours are limited we can have brown and coffee kinds of colours too thanks the product is okay i had bought dmx 40 for my mother which was very comfortable compared to this one nice,Flipkart,https://rukminim1.flixcart.com/image/832/832/xif0q/shoe/4/q/x/7-gb1843-9-5-reebok-soft-ecru-black-white-original-imaghvgqzxvqkfyg.jpeg?q=70,2.455,0.00076059395089008
