URL,BRAND,NAME,PRICE,STARS,NUMBER OF RATINGS,NUMBER OF REVIEWS,LIST OF REVIEWS,PLATFORM,IMAGE
https://www.amazon.in/GLORYBOYZ-Regular-Hawaiian-Tropical-Printed/dp/B0BFR7YLWM/ref=zg_bs_1967895031_sccl_1/257-0329217-1454160?psc=1,GLORYBOYZ,Regular Fit Hawaiian Tropical Printed Kids & Junior Boys Shirt,₹511,4.1,124,14,"['Slightly Overpriced, but very comfortable to wear for Kids', ""The fabric is so soft and it's worth buying... However size is lil small for 7-8 years age boy"", 'Good item', 'Color, cloth, fit and everything was perfect', 'Rayan cloth.size perfect.quality super', 'Looks good but when i received the priduct it s a verybad quality cloth not at all good for children.', 'Looks beautiful and satisfied', 'Good one if you are looking for a vacation for your child.', 'Nice', 'Really good. Very good quality']",Amazon,https://m.media-amazon.com/images/W/IMAGERENDERING_521856-T2/images/I/61pNN-dUZlL._UX342_.jpg
https://www.amazon.in/Amazon-Brand-Honey-Regular-SS19SRT321_Khakhi_11-12/dp/B07R2W7F5H/ref=zg_bs_1967895031_sccl_2/257-0329217-1454160?psc=1,Amazon Brand - Jam & Honey,Boy's Regular Fit Shirt,₹350,4.1,1847,110,"['Value for money', 'good quality and ahirt', 'Perfect fit for my kid. Fabric is good', 'Nice colour and a perfect fit for my son', 'Amazon symbol has good quality. Loved it', 'Fitting is as expected. Could be better pricing. As it feels over for the cloth quality', 'yes I like.', 'Best', 'Bahut badhiya']",Amazon,https://m.media-amazon.com/images/W/IMAGERENDERING_521856-T2/images/I/919vpm+pvnL._UX342_.jpg
https://www.amazon.in/Allen-Solly-Junior-ABSF31901792_Light-Green_15-16/dp/B07QP4RF6P/ref=zg_bs_1967895031_sccl_3/257-0329217-1454160?psc=1,Allen Solly Junior,Boys Shirt,₹869,4.2,3379,216,"['Pure cotton material comfort wear for kids.', 'Bought it for my 13y old boy. He is 162cm and slim. The shirt fits him very well. He likes it.', 'Good cotton shirt', 'Not bright colour as photo.', 'Just 👌👌', 'Quality, colour, style all are perfect..', 'Quality of product is good.', 'Very good quality', ""It's value for money product"", ""The shirt was delivered in a plastic packet (the kinds you get shirts in) only with a sticker which has the delivery label. Thankfully it didn't get damaged in any way.\nProduct wise: we ordered because of the brand name but the material is extremely transparent (as visible in the pic). Overall not worth the money paid.""]",Amazon,https://m.media-amazon.com/images/W/IMAGERENDERING_521856-T2/images/I/81JzUtI4GML._UX385_.jpg
https://www.amazon.in/Allen-Solly-Junior-Checkered-ABSF31901795_Green_13-14/dp/B07QL3DJNN/ref=zg_bs_1967895031_sccl_4/257-0329217-1454160?psc=1,Allen Solly Junior,Boys Shirt,₹899,4.2,2148,130,"['Perfect shirt for boy', 'Looks nice, fits well. Good quality fabric too.', 'Very good clothes & fiting 👍👍', ""Shirt colour is not at all like the image it is very bright and attractive and fresh in image , but shirt that arrived is dull ,old looking it's like old used shirt , didn't expect this from the brand like ALLEN SOLLY"", 'Good', 'no', ""It's comfortable to wear and gives staning outlook who ever wears it."", 'It was a good purchase. The size was also correct fitting', ""I like the quality but got different colour. I ordered orange colour but got red and this is only thing I'm not happy."", 'Good quality']",Amazon,https://m.media-amazon.com/images/W/IMAGERENDERING_521856-T2/images/I/91lo6JkLNLL._UX342_.jpg
https://www.amazon.in/Amazon-Brand-Honey-Regular-PAG-118_Maroon/dp/B08HZ7GS5D/ref=zg_bs_1967895031_sccl_5/257-0329217-1454160?psc=1,Amazon Brand - Jam & Honey,Boys Button Down Shirt,₹449,4.1,1434,97,"['Good cotton shirt', 'Fitting is excellent as expected. All other aspects as price, softness and comfort could have been better.', 'Bahut accha', 'Good', 'Very nice shirt, good fabric, colour and fitting.', 'Perfect Fit and Nice Quality', 'Nice color n fitting', 'Overall good product,worth purchasing', 'Bought if for a kid on his birthday. It was a pleasent surprise to experience tbe excellent quality,color and fitting. The product is just superb.', 'Size is too small']",Amazon,https://m.media-amazon.com/images/W/IMAGERENDERING_521856-T2/images/I/81ntg-gRiVL._UX385_.jpg
https://www.amazon.in/PELICAN-HUB-Latest-Printed-Designer/dp/B0BSS5BW1Y/ref=zg_bs_1967895031_sccl_6/257-0329217-1454160?psc=1,PELICAN HUB,Latest Lining Printed Designer Casual Wear Full Sleeve Cotton Shirt for Boys,₹299,0.0,0,0,[],Amazon,https://m.media-amazon.com/images/W/IMAGERENDERING_521856-T2/images/I/314QzwBn9bL._UY445_.jpg
https://www.amazon.in/Amazon-Brand-Regular-Button-PAG-151_Blue/dp/B08HZ6XL9V/ref=zg_bs_1967895031_sccl_7/257-0329217-1454160?psc=1,Amazon Brand - Jam & Honey,Boy's Regular Fit Button Down Shirt,₹479,4.2,854,37,"['Very nice product 👌 👍', 'I purchased a 9-10 yr size for my 7 yr old kid. Its not that he is too chubby- just like any kid of his age would be but even after ordering 2 sizes higher- The shirt is like - Just fitting.\n\nThe quality seems good but the price tag doesnt defend the quality and fitting. You would expect it to be much better in terms of fitting. I wasnt too impressed with the collar as its not stiff. I Ironed it & it still had some gathers.', 'Not a value for money product, fit is small - If ordering for a 6 yrs old then go for 7-8 yrs else it will be too short', 'Fabric quality, design and fitting everything is very good. Totally satisfied with it', 'The shirt is so nice .looks bright in colour my son like it so much.', 'nic i like it', 'Nice product.. correct fit...', ""It's very beautiful cloth and colour\n\nGood quality"", ""It's just ok""]",Amazon,https://m.media-amazon.com/images/W/IMAGERENDERING_521856-T2/images/I/910GZwufxwL._UX385_.jpg
https://www.amazon.in/Amazon-Brand-Symbol-Regular-SYMAW22SHR02_Navy/dp/B0BBR8B9FQ/ref=zg_bs_1967895031_sccl_8/257-0329217-1454160?psc=1,Amazon Brand - Symbol,Boys Shirt,₹613,3.6,32,3,"['Size to much short', 'Good']",Amazon,https://m.media-amazon.com/images/W/IMAGERENDERING_521856-T2/images/I/61Ei4H9Ae2L._UX385_.jpg
https://www.amazon.in/Amazon-Brand-Regular-Button-PAG-46_White/dp/B08HZ8SBTH/ref=zg_bs_1967895031_sccl_9/257-0329217-1454160?psc=1,Amazon Brand - Jam & Honey,Boys' Button Down Shirt,₹419,4.2,777,41,"['Good quality', 'Nice quality of product. Worth buying it.', ""Brought this for a niece,\n\nWe had tried multiple brands earlier which to accommodate his shoulders and his belly (he is little chubby), had to order larger sizes, which when tried up on, are very lengthy and don't look good at all\n\nWE had measured the actual measurements, referred to the size chart of Jam & Honey and brought the size, and it is perfect.\n\nIt fits superbly well, looks super good and the materials look and feel premium - all of this at an affordable price"", 'Nice shirt, true colour. Design is attractive. Fitting well, genuine quality. Value for money.', 'The colour was not as bright as shown..dim it is', 'Product is good', 'very good quality for this shirt👍', 'Not bad', 'OK', 'Very nice shirt. I really liked the material quality.']",Amazon,https://m.media-amazon.com/images/W/IMAGERENDERING_521856-T2/images/I/91PB1uOdX6L._UX522_.jpg
https://www.amazon.in/Jubination-Shirts-School-Uniform-Sleeve/dp/B0BVGHX42Z/ref=zg_bs_1967895031_sccl_10/257-0329217-1454160?psc=1,JUBINATION,White Shirts School Uniform Full Sleeve Shirt for Boys & Girls,₹399,2.5,3,3,"['Don’t go for it if you want white colour ..', 'Cheap quality', 'The product is same what i have seen in image . Fabric is gud have no issue']",Amazon,https://m.media-amazon.com/images/W/IMAGERENDERING_521856-T2/images/I/41cvPMmla-L._UX385_.jpg
https://www.amazon.in/Amazon-Brand-Honey-Regular-JH-BST-SH-25_Yellow/dp/B09BB8P95Q/ref=zg_bs_1967895031_sccl_11/257-0329217-1454160?psc=1,Amazon Brand - Jam & Honey,Boys Shirt,₹288,3.9,494,26,"['Gud material. U can buy', 'Cloth and color are very well. Fashionable and very liked this shirt for my son.\nThanks a lot Amazon fashion!!!', ""Don't imagine too much quality\nJust good shirt no colour fading overall ok\nAs per size if your kid is height it's look like a short shirt not for very fatty kidsthen go for one size"", 'Too short', 'Super', 'Order next size for a perfect fit.', 'Fitting is as mentioned, recommend', 'Product is very good', 'Very nice and some what smaller than expected', 'Looks too good on my 5-6 age son, fabric is also good and comfortable .']",Amazon,https://m.media-amazon.com/images/W/IMAGERENDERING_521856-T2/images/I/819wodvuiDL._UX342_.jpg
https://www.amazon.in/Arihant-Craft-Printed-Casual-Shirt/dp/B0BRJKFK1B/ref=zg_bs_1967895031_sccl_12/257-0329217-1454160?psc=1,Codeviser,aft Art Boy's Printed Casual Wear Shirt,₹299,0.0,0,0,[],Amazon,https://m.media-amazon.com/images/W/IMAGERENDERING_521856-T2/images/I/41E+3sldHsL._UY445_.jpg
https://www.amazon.in/Amazon-Brand-Regular-JH-BST-SH-04_Lt-Yellow/dp/B09BB8MKX2/ref=zg_bs_1967895031_sccl_13/257-0329217-1454160?psc=1,Amazon Brand - Jam & Honey,Boys Shirt,₹306,4.0,527,34,"['Materials ok\nBut colour & sewing all are not so good\nSize also smaller than actual size.🤞', 'good fit and quality', 'Value for money', 'Perfect color, quality, material, fitting\nEverything was upto the point 😍', 'நன்றாக உள்ளது', 'The quality of the cloth is good but not a perfect fit for the size mentioned. Perhaps one needs to take a bit larger size than required.', 'Considering price product is good now a days growing children clothes are so costly at stores', 'Good quality, size little less than expected,', ""It's 7-8 year size is actually 5-6year old. That means one should order at least 2 plus size of you have average weighing kid.\nFabric is good. It's pure cotton"", 'Colour']",Amazon,https://m.media-amazon.com/images/W/IMAGERENDERING_521856-T2/images/I/61h6RJ3lvQL._UX342_.jpg
https://www.amazon.in/PELICAN-HUB-Printed-Fabric-Grey/dp/B0BQJGW5M7/ref=zg_bs_1967895031_sccl_14/257-0329217-1454160?psc=1,PELICAN HUB,Boy's Printed Lycra Fabric Shirt,₹299,3.5,2,2,"[""The shirt will change the colour after first wash and it is not at all same like above picture according to the prize it's not good"", 'Must buy !!!! 🤍 Like my child loved it so yeah plz buy but order from pelican hub only im not spam']",Amazon,https://m.media-amazon.com/images/W/IMAGERENDERING_521856-T2/images/I/31pm9BL3gQL._UY445_.jpg
https://www.amazon.in/Amazon-Brand-Symbol-Regular-SYMAW22SHR01_Lt/dp/B0BBR54CJG/ref=zg_bs_1967895031_sccl_15/257-0329217-1454160?psc=1,Amazon Brand - Symbol,Boys Shirt,₹613,3.9,14,2,"['Not happy with the Quality....😒😒😒😒', 'Dislike. Shirt not upto the mark. Poor quality']",Amazon,https://m.media-amazon.com/images/W/IMAGERENDERING_521856-T2/images/I/81ich+XlC2L._UX569_.jpg
https://www.amazon.in/Fraus-Kids-Cotton-Readymade-Shirt/dp/B08S73G9JT/ref=zg_bs_1967895031_sccl_16/257-0329217-1454160?psc=1,Fraus Kids,Cotton Readymade Shirt for Boys,₹499,4.0,57,12,"['I want to replace', 'Quality good but size fiting little tight', 'Very good fabric and looks very formal and pretty', 'My kids is comfortable with wear and easy to wash and my kids love to wear and after washing is good and product is perfect fit ...', 'It is a very good quality cotton shirt. It is well stitched, which fits well to my son.', 'Cotton Quality is very good and nice. So soft and smooth. Fitted very perfect and color is fine.', 'Great product\nPerfect fitting\nPremium fabric', 'It’s good product ... good material batter than it’s shown ...fabulous colour ✌️', ""It's good i like it good brand veryy good and good febric\nVary vary good product i am happy, thank you"", 'Fresh color and stitched good. Fitted as expected. Kid is happy with comfortness . Overall quality fabric.']",Amazon,https://m.media-amazon.com/images/W/IMAGERENDERING_521856-T2/images/I/5199BAnIUSS._UX385_.jpg
https://www.amazon.in/Diverse-Floral-Shirt-DCKCH20SC18L37-001_White-3-4Yrs/dp/B097HGG6M9/ref=zg_bs_1967895031_sccl_17/257-0329217-1454160?psc=1,Diverse,Boy's Slim Fit Shirt,₹589,3.9,177,15,"['Good one if you are looking for a vacation for your child. Material is a bit rugged, but not concerning. Fits good.', 'Good dress', 'Very nice', 'I feel rate is costly for this shirt and size we need to get 2 size bigger than actual size.. just ok product shirt looks same as in pic.. cotton material all good but I feel 450+ is not worth high priced shirt', 'Excellent look.', 'The cloth is pure cotton..so good to wear in summers..I bought it in a hurry since I didnt get time to visit a shop or order on other online sites. Since it was urgently required and had next day delivery, I ordered this for my son. Dont think, it should be priced for Rs 500.', 'Fabric is of good quality. Fits as expected. I had to choose a bigger number for my son as per his height.', 'shirt material is good. my son feels very comfortable wearing this shirt. nice and proper stiching.', 'Shirt is of super fine fabric right for summer print is also very good 👍👍', 'Poor quality']",Amazon,https://m.media-amazon.com/images/W/IMAGERENDERING_521856-T2/images/I/A1LggkqYVRL._UX522_.jpg
https://www.amazon.in/Arihant-Kids-Roundneck-Fullsleeve-Regular/dp/B0BG5ZDFF4/ref=zg_bs_1967895031_sccl_18/257-0329217-1454160?psc=1,codeviser,Arihant Craft Neck Fullsleeve Regular Fit Shirts,₹349,0.0,0,0,[],Amazon,https://m.media-amazon.com/images/W/IMAGERENDERING_521856-T2/images/I/418-eQJvJcL._UY500_.jpg
https://www.amazon.in/LEWEL-Stylish-Hooded-Cotton-Checked/dp/B0BTPSD2BG/ref=zg_bs_1967895031_sccl_19/257-0329217-1454160?psc=1,LEWEL,Boy's Stylish Hooded Cotton Checked Slim Fit Shirt (Olive Green),₹398,0.0,0,0,[],Amazon,https://m.media-amazon.com/images/W/IMAGERENDERING_521856-T2/images/I/61skoH0rMsL._UY445_.jpg
https://www.amazon.in/United-Colors-Benetton-Geometric-21P5EW75QKG0G_White/dp/B08RMQ94D9/ref=zg_bs_1967895031_sccl_20/257-0329217-1454160?psc=1,United Colors of Benetton,Boy's Regular Shirt,₹479,0.0,0,0,[],Amazon,https://m.media-amazon.com/images/W/IMAGERENDERING_521856-T2/images/I/71JYsZd8nkL._UX342_.jpg
https://www.amazon.in/Amazon-Brand-Honey-Regular-JHAW22SHR02_Pink/dp/B0BBR6TB59/ref=zg_bs_1967895031_sccl_21/257-0329217-1454160?psc=1,Amazon Brand - Jam & Honey,Boys Shirt,₹581,0.0,0,0,[],Amazon,https://m.media-amazon.com/images/W/IMAGERENDERING_521856-T2/images/I/51TlhUKxqCL._UX385_.jpg
https://www.amazon.in/Amazon-Brand-Symbol-Regular-SYM-K-SS22-SHI-406_Multi/dp/B09TPBX2VF/ref=zg_bs_1967895031_sccl_22/257-0329217-1454160?psc=1,Amazon Brand - Symbol,Boy's Regular Fit Shirt,₹457,3.9,79,5,"['I liked it soo much just stop looking at bad reviews apart of that this product is very nice', 'Nice design but size too small for 13-14 year. Shirt material needs improvement.', 'Awesome product\nGood quality and fitting', 'Nice shirt', 'Simple and Nice style with good quality\nI love the shirt. Very comfortable and soft\nWill definitely will be picking more colors in this']",Amazon,https://m.media-amazon.com/images/W/IMAGERENDERING_521856-T2/images/I/61S75yZemKL._UX385_.jpg
https://www.amazon.in/Amazon-Brand-Honey-Regular-SS19SRT326_Navy_11-12/dp/B07QVLVN93/ref=zg_bs_1967895031_sccl_23/257-0329217-1454160?psc=1,Amazon Brand - Jam & Honey,Boy's Regular Fit Shirt,₹399,4.2,161,12,"[""I like the Material n Disliked the Sizes' Details on Website.\nOne plans the Order on Basis of Sizes mentioned.\nBetter if Sizes Accurately Described or Change the Web according to the Physical Sizes of the Different Parts of the Product."", 'Must buy for kids...good quality', 'Vibrant color, smooth material and fits well. I loved the shirt on my son and he was happy too.', 'Good', 'I ordered the shirt for my 3 yr old....it suits the kid...size is perfect ...not too large or small...', 'Very good product. Fits well. Good quality', 'Fit as expected.fabric is excellent. Overall superb product.', 'Good', 'Best', 'good']",Amazon,https://m.media-amazon.com/images/W/IMAGERENDERING_521856-T2/images/I/81qWlgiJX-L._UX342_.jpg
https://www.amazon.in/Allen-Solly-Junior-Regular-ABSF31901799_White_7-8/dp/B07QM2ZQH4/ref=zg_bs_1967895031_sccl_24/257-0329217-1454160?psc=1,Allen Solly Junior,Boys Shirt,₹859,4.2,681,38,"['Good quality', 'As Exoected, Got The Same as Shown & fitted Accurately..Super Fast Delivery by Amazon.\n.NO. 1 in INDIA..Thanks AMAZON🙏🙌', 'My son love this shirt', 'I had ordered light blue but I got navy blue..\nVery disappointed 😞\nDid not expect this from Amazon\nBut the quality of the product is good...', 'My kid complete 11yrs. I ordered 13-14yrs. Its perfect fit', 'Nice colour nd fabric also good thank you amezon', 'There are dirt', '', 'Nice', ""Exact fit.\nNo need to talk anything about size.\nIt's fitting is very nice with a good look.""]",Amazon,https://m.media-amazon.com/images/W/IMAGERENDERING_521856-T2/images/I/81UNjeny94L._UX342_.jpg
https://www.amazon.in/Amazon-Brand-Regular-Cotton-JHAW19BTSHR2007_White_7-8/dp/B07TSCJFFM/ref=zg_bs_1967895031_sccl_25/257-0329217-1454160?psc=1,Amazon Brand - Jam & Honey,Boy's Regular Fit Shirt,₹519,4.1,804,43,"['Same as advertised!', 'अच्छा है।', 'Had to order 9-10 year old (71cms) for a 7 year old. But the cloth and material is good', 'Superb material...feels like quality product. Thank you seller.', 'The size received is very small as compared to what we had ordered.', 'Happy with this.', 'Quite thick shirt in pure white. Really liked the quality. Even better than most other branded shirts.', ""Very good quality shirt, soft fabric & good fitting , buy it you won't regret at all"", '', 'I like the shirt very much., Perfectly fits to my boy.... Material is cotton with shine.... Liked the product']",Amazon,https://m.media-amazon.com/images/W/IMAGERENDERING_521856-T2/images/I/71NFRga+SaL._UX342_.jpg
https://www.amazon.in/DARKMODE-FASHION-Formal-Plain-Shirt/dp/B0BSQVD6L7/ref=zg_bs_1967895031_sccl_26/257-0329217-1454160?psc=1,DARKMODE FASHION,New Formal Plain Kids Shirt for Boys,₹299,0.0,0,0,[],Amazon,https://m.media-amazon.com/images/W/IMAGERENDERING_521856-T2/images/I/41AXIkcUzxL._UY500_.jpg
https://www.amazon.in/HANUMANT-IMPEX-Gorgeous-Printed-Shirt/dp/B0BSV2GS97/ref=zg_bs_1967895031_sccl_27/257-0329217-1454160?psc=1,HANUMANT IMPEX,Gorgeous Printed Designer Casual Shirt for Boys,₹299,0.0,0,0,[],Amazon,https://m.media-amazon.com/images/W/IMAGERENDERING_521856-T2/images/I/314QzwBn9bL._UY445_.jpg
https://www.amazon.in/PEPILIO-Kids-Stylish-Shirt-Formal/dp/B0BHZ7TW7Q/ref=zg_bs_1967895031_sccl_28/257-0329217-1454160?psc=1,PEPILIO,Kids Stylish Solid Cotton Spread Collar Regular Fit Shirt|| Formal Boys Shirt || Casual Wear Buttoned Shirt for Boys,₹599,0.0,0,0,[],Amazon,https://m.media-amazon.com/images/W/IMAGERENDERING_521856-T2/images/I/31ulfkOIQDL._UX385_.jpg
https://www.amazon.in/Amazon-Brand-Symbol-Regular-SYM-KB-SS22-SHI-457_Multi/dp/B09TPC8CTY/ref=zg_bs_1967895031_sccl_29/257-0329217-1454160?psc=1,Amazon Brand - Symbol,Boy's Regular Fit Shirt,₹418,0.0,0,0,[],Amazon,https://m.media-amazon.com/images/W/IMAGERENDERING_521856-T2/images/I/71VLrRQt17L._UX342_.jpg
https://www.amazon.in/Hopscotch-Cotton-Athletics-Orange-0-3123653/dp/B08GZD6C3X/ref=zg_bs_1967895031_sccl_30/257-0329217-1454160?psc=1,Hopscotch,Boys Shirt,₹974,2.9,38,4,"['Such a cheap product. Will not be worn even once. Bad stitching and bad material. Inner t shirt is only for pic.', 'T shirt not come only meet me shirt , the retune boy not pick the return because he say t-shirts not attach to shirt not come', 'The fit of the shirt is very bad...the shoulderds does not fit properly. Worst product i wver recieved from amazon.', 'No perfection']",Amazon,https://m.media-amazon.com/images/W/IMAGERENDERING_521856-T2/images/I/710M9cFa4pL._UX385_.jpg
https://www.amazon.in/CLOTH-BUCKET-Trending-Formal-Yellow/dp/B0BS6SZXQ9/ref=zg_bs_1967895031_sccl_31/257-0329217-1454160?psc=1,CLOTH BUCKET,Trending Plain Cotton Kids Shirt for Boys,₹299,0.0,0,0,[],Amazon,https://m.media-amazon.com/images/W/IMAGERENDERING_521856-T2/images/I/41ThMok7AIL._UY445_.jpg
https://www.amazon.in/Amazon-Brand-Symbol-Regular-SYM-K-SS22-SHI-452_Multi/dp/B09TPB14LV/ref=zg_bs_1967895031_sccl_32/257-0329217-1454160?psc=1,Amazon Brand - Symbol,Boys Shirt,₹460,3.9,91,7,"['Good Quality at Reasonable Price.', 'This is good product but price is too high', 'Great shirt with vibrant colors and good quality fabric. Fit is as usual\n\nOnly thing is to buy this when on sale otherwise it is overpriced', 'My son size is not there.', 'Good', '👎 dislike', 'Material was nt aa better as i expected.\nIt was kinda rough clothing.. nt suitable for kids. Need better clothing..']",Amazon,https://m.media-amazon.com/images/W/IMAGERENDERING_521856-T2/images/I/51KspGN74RL._UX342_.jpg
https://www.amazon.in/CAVIO-Regular-Cotton-Sleeve-Roundneck/dp/B09QS5BDFT/ref=zg_bs_1967895031_sccl_33/257-0329217-1454160?psc=1,CAVIO,Boys Regular Fit Cotton Full Sleeve Roundneck Shirt Casual,₹710,0.0,0,0,[],Amazon,https://m.media-amazon.com/images/W/IMAGERENDERING_521856-T2/images/I/51npUUBINjL._UX342_.jpg
https://www.amazon.in/J-B-COLLECTION-Black-Plain-Cotton-Casual/dp/B0B5LQ9R23/ref=zg_bs_1967895031_sccl_34/257-0329217-1454160?psc=1,J.B.COLLECTION,Boys Black Plain Cotton Casual Shirt,₹449,4.0,13,2,"[""Good product. It's cotton. Soft feel but material is very transparent. Look wise it's same as shown"", 'Was a little disappointed as it has white buttons. Material is okay. Good for the price']",Amazon,https://m.media-amazon.com/images/W/IMAGERENDERING_521856-T2/images/I/31nfqd2ZpoL._UY445_.jpg
https://www.amazon.in/NIMISHA-Creation-Casual-Regular-Printed/dp/B0BNQNJ1CZ/ref=zg_bs_1967895031_sccl_35/257-0329217-1454160?psc=1,Generic,Creation Kids Boys Casual Regular Fit Printed Cotton Shirt for Boys|Boy's Shirt,₹549,0.0,0,0,[],Amazon,https://m.media-amazon.com/images/W/IMAGERENDERING_521856-T2/images/I/51VU7aM7NsL._UX342_.jpg
https://www.amazon.in/LEWEL-Stylish-Hooded-Cotton-Checked/dp/B0BTPSSXDT/ref=zg_bs_1967895031_sccl_36/257-0329217-1454160?psc=1,LEWEL,Boy's Stylish Hooded Cotton Checked Slim Fit Shirt (White),₹398,0.0,0,0,[],Amazon,https://m.media-amazon.com/images/W/IMAGERENDERING_521856-T2/images/I/71xSt-BT+CL._UY445_.jpg
https://www.amazon.in/PELICAN-HUB-Printed-Fabric-Red/dp/B0BQJHSVFZ/ref=zg_bs_1967895031_sccl_37/257-0329217-1454160?psc=1,PELICAN HUB,Boy's Printed Lycra Fabric Shirt,₹299,0.0,0,0,[],Amazon,https://m.media-amazon.com/images/W/IMAGERENDERING_521856-T2/images/I/41AXIkcUzxL._UY445_.jpg
http://flipkart.com/onecentre-boys-solid-casual-pink-shirt/p/itmd4ff6b1c88e13?pid=SHTGCCPZDVDZWTCN&lid=LSTSHTGCCPZDVDZWTCNKRKB6E&marketplace=FLIPKART&store=clo%2Fash%2Faxc%2Fznf&srno=b_1_1&otracker=browse&fm=organic&iid=en_pTUxB7deUboIJOPo%2BuyFpVwBYmDxDiibXfNcoNYQ%2B2O8GqYgfhtXwwlep4Zj6L%2FF9yWJCO7eE60Oy3Q3AcOxew%3D%3D&ppt=None&ppn=None&ssid=hmz95pgrog0000001679481284251,ONECENTRE ,Boys Regular Fit Solid Mandarin Collar Casual Shirt,₹347,4.0,1426,110,"['Good quality product👌🏻👍🏼', 'Nice product', 'Awesome product. Quality of material is very good']",Flipkart,https://rukminim1.flixcart.com/image/832/832/xif0q/shirt/f/n/d/3-4-years-a2103gmca2511-pl1-baby-pink-one-centre-original-imagguzycfygzvch.jpeg?q=70
http://flipkart.com/smos-boys-solid-casual-yellow-shirt/p/itmad34754ae7851?pid=SHTGNRFES2XE3JGF&lid=LSTSHTGNRFES2XE3JGFMJP3ZU&marketplace=FLIPKART&store=clo%2Fash%2Faxc%2Fznf&srno=b_1_2&otracker=browse&fm=organic&iid=en_pTUxB7deUboIJOPo%2BuyFpVwBYmDxDiibXfNcoNYQ%2B2N8ofSfR5D2i2tCbKoMrZQppPjggoIfXbMI0nuJ2S8%2BPA%3D%3D&ppt=None&ppn=None&ssid=hmz95pgrog0000001679481284251,SMOS ,Boys Regular Fit Solid Curved Collar Casual Shirt,₹399,0.0,0,0,[],Flipkart,https://rukminim1.flixcart.com/image/832/832/xif0q/shirt/w/0/n/3-4-years-s-022-smos-original-imagnrfekkjgehbw.jpeg?q=70
http://flipkart.com/royal-prince-boys-washed-casual-blue-shirt/p/itm0a4ca32c697be?pid=SHTGGZGC247NCGS2&lid=LSTSHTGGZGC247NCGS2XT7OOR&marketplace=FLIPKART&store=clo%2Fash%2Faxc%2Fznf&srno=b_1_3&otracker=browse&fm=organic&iid=fd523c5e-0c91-41ce-8abd-31b5556f4452.SHTGGZGC247NCGS2.SEARCH&ppt=None&ppn=None&ssid=hmz95pgrog0000001679481284251,royal prince ,Boys Regular Fit Washed Casual Shirt,₹393,4.3,12,2,"['Nice product', 'Nice product very nice 👍👍👍👍👍👍😊😊😊']",Flipkart,https://rukminim1.flixcart.com/image/832/832/k7ry3680/shirt/d/t/g/9-10-years-29-royal-prince-original-imafpx44h4hgm5tq.jpeg?q=70
http://flipkart.com/pantaloons-junior-boys-solid-casual-blue-shirt/p/itmedf9189206e2d?pid=SHTGH7CSPXANVYCZ&lid=LSTSHTGH7CSPXANVYCZL68WPT&marketplace=FLIPKART&store=clo%2Fash%2Faxc%2Fznf&srno=b_1_4&otracker=browse&fm=organic&iid=fd523c5e-0c91-41ce-8abd-31b5556f4452.SHTGH7CSPXANVYCZ.SEARCH&ppt=None&ppn=None&ssid=hmz95pgrog0000001679481284251,Pantaloons Junior ,Boys Regular Fit Solid Spread Collar Casual Shirt,₹369,4.3,40,3,"['Nice shirt', 'Very good quality', 'Excellent']",Flipkart,https://rukminim1.flixcart.com/image/832/832/xif0q/shirt/s/c/y/-original-imaggp7edzeguyhf.jpeg?q=70
http://flipkart.com/pantaloons-junior-boys-checkered-casual-green-shirt/p/itmeda79b1089989?pid=SHTGH7CTW4EMWJRG&lid=LSTSHTGH7CTW4EMWJRG1EPJ7R&marketplace=FLIPKART&store=clo%2Fash%2Faxc%2Fznf&srno=b_1_5&otracker=browse&fm=organic&iid=fd523c5e-0c91-41ce-8abd-31b5556f4452.SHTGH7CTW4EMWJRG.SEARCH&ppt=None&ppn=None&ssid=hmz95pgrog0000001679481284251,Pantaloons Junior ,Boys Regular Fit Checkered Spread Collar Casual Shirt,₹409,4.4,88,9,"['Value for money', 'Cloth is good But bigsize', 'Super cool']",Flipkart,https://rukminim1.flixcart.com/image/832/832/xif0q/shirt/n/m/h/-original-imaggjtjzxfdv6uq.jpeg?q=70
