URL,BRAND,NAME,PRICE,STARS,NUMBER OF RATINGS,NUMBER OF REVIEWS,LIST OF REVIEWS,PLATFORM,IMAGE
https://www.amazon.in/Selvia-Womens-Regular-Shirt-329TKN253/dp/B0B28YVN82/ref=zg_bs_1968444031_sccl_1/257-0329217-1454160?psc=1,Selvia,Women's Poly Viscose Solid Regular Fit Shirt,₹279,3.7,67,12,"['Nice fitting, colour as shown in the picture, stitching good.', 'Shirt is very pretty but the packaging was so poor. While opening the shirt got cut by mistake since it was too close to the opening.', 'I ordered dis lavender colour but I got wine colour dats why am nt happy😌😌 with product .', 'Good to wear.', 'The product is perfect without any flaw.', 'The material is polyester. But fitting is very good looks very nice. Comfortable and breathable. Runs small so buy a size larger.', 'av tk refund nahi aaya kya tmasha ab toh acount no v change kr diye hai', 'Amazing product', 'Exactly as the image, worth the price', 'The quality is good and the fits is perfect as it has seams on the front and back making it very professional\nAlthough the length is a bit short according to my height..!']",Amazon,https://m.media-amazon.com/images/W/IMAGERENDERING_521856-T2/images/I/51ThcXgU70L._UY550_.jpg
https://www.amazon.in/Greciilooks-Digital-Printed-Oversized-Beautiful/dp/B0B86C9XKZ/ref=zg_bs_1968444031_sccl_2/257-0329217-1454160?psc=1,GRECIILOOKS,"Western Top for Women - Floral Printed & Split V Neck Short Stand Collar Tee Top for Girls Suitable for Workout, Office, Function, Tracking, Casual Wear (Pack of 1)",₹399,3.2,521,143,"['Bro nice and soft meterial it is. Good for summer', ""I'm happy 😊 lo"", ""It's an average product for the price"", 'He fabric quality is very poor. Bad fit.', 'The colors and the pattern is so beautiful. fitting is perfect.', ""Everything is good except the neck. It's too small to look good. The one in pic isn't how it is in real, so i had to unfortunately return it"", 'Picture n product both are different…. I personally don’t like it', 'Fabric is very comfortable and same as new even after wash.\nFits really well🤩\nMust buy 💸\nReally an cost effective product 😌', 'It doesn’t look that good in real as it is in pictures. The material is of poor quality', 'I like this sirt very much..its material is very nice..and also very comfortable to wear so looks good too.']",Amazon,https://m.media-amazon.com/images/W/IMAGERENDERING_521856-T2/images/I/51YUdTGQZtL._UY500_.jpg
https://www.amazon.in/DIMPY-GARMENTS-Regular-Formal-Medium/dp/B0BT82QTV6/ref=zg_bs_1968444031_sccl_3/257-0329217-1454160?psc=1,DIMPY GARMENTS,Plain Solid Rayon Regular Fit Women Formal Shirt,₹337,3.4,11,4,"['Fits good but Material is not so good 🙂', ""A very beautiful purchase for my daughter on summer days. 🥰🥰🥰It's a very good,comfortable and soft product. Also, the size fits her properly and she looks amazing wearing this shirt.I definitely suggest you all buy it without any second thought. 👌👌👌👌"", ""Over all a perfect buy. Very pocket friendly. Prefer to buy dark colours. One of the best purchases I've ever made🖤 🖤""]",Amazon,https://m.media-amazon.com/images/W/IMAGERENDERING_521856-T2/images/I/61P1cFP+ZvL._UY550_.jpg
https://www.amazon.in/Stylistico-Womens-Embroidered-Cotton-Off-White/dp/B07NNZY155/ref=zg_bs_1968444031_sccl_4/257-0329217-1454160?psc=1,Stylistico,Women's Top,₹584,4.0,4207,551,"['Slight lose...', 'Product is good, fabric is comfortable.', 'Prfect fit and very nice to wear', 'The product quality is good and even the material is good', 'Cloth is okayish. It fades colour like anything. Not bad but not so good as well', 'Good', 'On first glance it was the perfect top. Later I discovered 2 spots near the sleeves. I could not return it as I had already cut off the tag.', 'I like this top but price..... Quality is very good.Same as shown in the picture', 'Top quality is good but it was a bit small to me', ""It's good product. The material is not bad andnits fits and looks good""]",Amazon,https://m.media-amazon.com/images/W/IMAGERENDERING_521856-T2/images/I/71ocRlvxItL._UY550_.jpg
https://www.amazon.in/Style-Quotient-Polycotton-Regular-Formal/dp/B0BG5SSBWC/ref=zg_bs_1968444031_sccl_5/257-0329217-1454160?psc=1,Style Quotient,Women Classic Formal Shirt,₹469,3.9,47,6,"['It is true to pictures and came in good quality. Go for it but, for comfortable do purchase a larger size.', ""The quality is okay\nThere was a small whole in the underarm area after 2nd wash but as far as fit is concerned it's not too bad\nIt looks good though!"", 'Low quality material', 'Good fit .value for money', 'It was super and the cloth material was also good']",Amazon,https://m.media-amazon.com/images/W/IMAGERENDERING_521856-T2/images/I/31aogNf7XeL._UY500_.jpg
https://www.amazon.in/Harpa-Womens-Regular-Blouse-GR6027_White/dp/B08W9V5LLN/ref=zg_bs_1968444031_sccl_6/257-0329217-1454160?psc=1,Harpa,Women's Top,₹465,3.4,1929,208,"[""Look wise it's good but size is overall too small M size is good for for me but this top is runs short on me neck is too deep."", 'Size is not right & looks Cheap', 'button were missing on the right sleeves so i had to replaced it with the same item it looks good but i am disappointed with the sleeves', 'I like the product.. But sheer material.. Should wear proper inner wear', 'Good', 'Good quality and fit.', ""Packaging is very bad...I ordered xs size...it's not fit as expected..too much big and loose"", 'Fabric is good\nOnly drawback is that front neck is too deep', 'Please be careful Your nipples will be visible if your nipples are hard also your cleavage will be visible\nMakes u look sexy and elegant and slim']",Amazon,https://m.media-amazon.com/images/W/IMAGERENDERING_521856-T2/images/I/61iLGEonFzL._UX522_.jpg
https://www.amazon.in/Blue-Ronin-Womens-Regular-White_M/dp/B085W31MD6/ref=zg_bs_1968444031_sccl_7/257-0329217-1454160?psc=1,Blue Ronin,Women's Cotton Regular Fit 3/4 Sleeve Formal/Casual Shirt,₹559,3.7,948,84,"['Cotton mix fabric so 499 price costly', 'Cloth is good but a little transperant.\nFit and look is nice', 'very nice product 👍', ""Quality is good. But it's translucent. Need to wear coat as it is see through type."", 'It was ok', 'Good quality product...fitted as per size', '', ""I'm not really sure about the fabric material but it's better than other shirts I've searched on Amazon for the same price. Also, it fits me perfectly so I don't have any problem with it."", 'Nice product, fitting as required..', 'Great fit. Only problem is even after ironing the shirt looks shabby.']",Amazon,https://m.media-amazon.com/images/W/IMAGERENDERING_521856-T2/images/I/61KVLSg1GIL._UX522_.jpg
https://www.amazon.in/GRECIILOOKS-Digital-Printed-Regular-Classic/dp/B0BLK1MW47/ref=zg_bs_1968444031_sccl_8/257-0329217-1454160?psc=1,GRECIILOOKS,Women Rayon Digital Printed Regular Fit Shirt || Casual Shirt || Classic Formal Shirt,₹349,3.7,48,18,"['So so', 'Ok ok shirt 👍🏻', 'Its a beautiful & stylish crop shirt for casual wear at very minimal price.', ""Simply loved it. Though it's little short for my size, I'd like to have it than returning... It's so good to wear and be comfortable. Very nice fabric and also amazing design. Thanks to the creature. A very well designated one i actually love it."", 'Please increase top length', ""Colours are so beautiful, quality of the shirt is of top notch.\nCan be styled in different ways\nLoved the fabric, high quality material at affordable rate\nCan't wait to wear it outside"", 'loved this top the material is super good and fitting is exactly according to my size.\nprice is so good for this top.', 'Same as shown in the picture. I really love the product. Quality is also too good. Worth the money.', 'Nice fabric.. looking wise is too good..... Attractive and beautiful colour.. quality is good....', 'Fits great. Fabric is good. Liked it.']",Amazon,https://m.media-amazon.com/images/W/IMAGERENDERING_521856-T2/images/I/71X3dbYecuL._UY550_.jpg
https://www.amazon.in/One-femme-Womens-OFTNT012_Green-57_X-L/dp/B0BFDYJV9T/ref=zg_bs_1968444031_sccl_9/257-0329217-1454160?psc=1,One femme,Women's Plaid Check Print Tunic,₹798,3.8,1681,247,"['Good quality', 'Was looking for a top in checks which was not too short. Found this product on Amazon.\n\nThere are several designs available and all look great on the models. Hence, ordered 2 – Multicolor 59 and Multicolor 55. Cloth Material for both was different, so were the prices. Multicolor 59 was very thick, as thick as an apron or even thicker. Multicolor 55 was thin, soft and comfortable. But returned both of them immediately.\n\nReason for return: Multicolor 59 felt and looked like an apron. Multicolor 55 looked a little gaudy as it had big checks.\n\nFinally, have settled with the one shown in the pic, Blu 53. Material is soft and comfortable like Multicolor 55. Due to the dark blue background, doesn’t look gaudy despite the red checks. Got it in 740 Rs.\n\nWill update this review after a few washes.', 'The stitching is clean. The material is surprisingly good.', 'Good one', 'Perfect fit as expected.', 'I wear medium size but this top is too long and loose on the waist area. Quality is good. I have returned it. Refund received. I give 3 stars because the quality is good but the size is not right', 'It’s a very good one', 'Wish the fit was not smaller than the usual size - it is a little smaller than the size chart', 'Really worth buying...Perfect fit and very comfortable..Just go for it...']",Amazon,https://m.media-amazon.com/images/W/IMAGERENDERING_521856-T2/images/I/51fkNynqscL._UX522_.jpg
https://www.amazon.in/Leriya-Fashion-Sleeve-Casual-Crepe/dp/B07HF5B29R/ref=zg_bs_1968444031_sccl_10/257-0329217-1454160?psc=1,Leriya Fashion,Women's Corduroy Button Down Pocket Shirts Casual Long Sleeve Oversized Blouses Tops,₹329,3.4,2166,249,"['Very good', 'Its too small and cloth is dirty its looks like used cloth', 'Bad', 'I like it cloth very soft and very nice looking ❤️❤️', 'Received without tag I want to exchange', ""I don't like this color ...expecting meroon color"", ""I order brown one.. first I order small size bt it's too tight than I ordered medium still it too tight.. now m going to order large.. its size is not accurate otherwise the shirt look really pretty.. hope this time I get prefect fit.. m giving 4 start but bcz of size issue I cut one star"", 'I am trying to return this product because of the size but I noticed that there was no label on the shirt. The delivery guy who was supposed to pick it up refused to do so because there was no label.', 'Nice one', 'Waste fabric. The fabric of the shirt that i received is different from what the product claims']",Amazon,https://m.media-amazon.com/images/W/IMAGERENDERING_521856-T2/images/I/61zb98Bg6QL._UX522_.jpg
https://www.amazon.in/FUNDAY-FASHION-Women-Casual-Medium/dp/B0BV78S283/ref=zg_bs_1968444031_sccl_11/257-0329217-1454160?psc=1,FUNDAY FASHION,Women Boxy Fit Solid Casual Shirt,₹398,0.0,0,0,[],Amazon,https://m.media-amazon.com/images/W/IMAGERENDERING_521856-T2/images/I/61wwLxKN6gL._UY550_.jpg
https://www.amazon.in/FUNDAY-FASHION-Regular-Collered-Casual/dp/B0BVJBHYW8/ref=zg_bs_1968444031_sccl_12/257-0329217-1454160?psc=1,FUNDAY FASHION,Women Regular Fit Solid V Collered Casual Shirt,₹278,0.0,0,0,[],Amazon,https://m.media-amazon.com/images/W/IMAGERENDERING_521856-T2/images/I/51jhzNAPXiL._UY550_.jpg
https://www.amazon.in/Mirana-Regular-Mandarin-Collar-Colours/dp/B0BBRXQ3QH/ref=zg_bs_1968444031_sccl_13/257-0329217-1454160?psc=1,Mirana,Women Regular Fit Mandarin Collar Casual Shirt (All Unique Colours),₹429,4.0,48,11,"['The product is not at all rough to skin or itchy, the fitting is also good😌.', 'The look is good but material is cheap', ""It's absolutely fantastic.It gives perfect professional look."", 'Product is to good and fitting and stiching very well according to price product is worthable .so you can try it .', 'Nice', 'Colour also different', 'I liked the colour n material of this product...it was exactly same as shown in picture.', 'Very nice product and fitting is to great. I like product and Quality is very well. it’s worth-able. Go for purchase 🤟🏻', '', '']",Amazon,https://m.media-amazon.com/images/W/IMAGERENDERING_521856-T2/images/I/610rFwsj8VL._UY550_.jpg
https://www.amazon.in/OOMPH-Womens-Crepe-Tank-Top/dp/B07HGB4WL8/ref=zg_bs_1968444031_sccl_14/257-0329217-1454160?psc=1,OOMPH!,Women's Crepe Tank Top - Scarlet Red,₹199,3.4,7405,1263,"['good', 'Little sheer but ok', 'Quality is good but size is little bit low and product is slightly different from that of product shown in image', 'Nice and looks great', 'Too light & comfortable', 'Nice product', 'Worth for money and so comfortable. A simple tops', 'Quality is not good', 'Quality is not up to the price. Not too bad and not too great either. Dress material is not good also...but the dress looking nice.', 'Good and comfortable']",Amazon,https://m.media-amazon.com/images/W/IMAGERENDERING_521856-T2/images/I/81VkRfni1ML._UX522_.jpg
https://www.amazon.in/Indietoga-Womens-Burgundy-Regular-Longline/dp/B0B11WC43R/ref=zg_bs_1968444031_sccl_15/257-0329217-1454160?psc=1,Indietoga,Women's Plus Size Solid Rayon Longline Casual Shirts (2XL to 7XL),₹849,4.0,40,7,"['Excellent top with correct fitting size. The material is very soft and feel is perfect perfect. The stitching is very good. A little long for me but you can tuck in or add a broad belt for the perfect evening look.', 'Liked the quality & softness of the fabric and the fit is good', 'The material of this tshirt is really good and is comfortable to wear.', 'This shirt suits very well with formal pants and blazer for women. It can be worn for a high class official meeting. The quality of the cloth is just perfect. Planning to buy the burgundy and white shirt too. Will post a photo later.', 'The Shirt was good only to wear 2 times. AFTER I washed it it became a Kids shirt as it shrinked completely. I have not made it a duster. What a waste of money. Stop Cheating people', 'The product got is good', '']",Amazon,https://m.media-amazon.com/images/W/IMAGERENDERING_521856-T2/images/I/516v+B6aYML._UY550_.jpg
https://www.amazon.in/FUNDAY-FASHION-Floral-Casual-X-Large/dp/B0BB1XGCH9/ref=zg_bs_1968444031_sccl_16/257-0329217-1454160?psc=1,FUNDAY FASHION,Women Floral Print Casual Shirt,₹399,3.7,84,14,"['Nice', ""This shirt is fab. it's gonna give you a comfy cool look"", 'Looks good but you can find similar in local markets for better pro', ""I was a little unsure while buying as few reviews had said the cloth isn't well-stiched. But i was obsessed with this design, so i had to try it. To my surprise it was looking great, although the overall quality could be enhanced. But nevertheless, a great buy."", 'Product delivered is of good quality', 'Useful product competitively priced', ""The print is really good and neat. Shirt sizing is also on point. Just that it's not any soft cloth or anything...but for the price it's a very nice flowy summery buy! Go for it"", 'Stiching in a stange manner. Not near arm pits but on the arm. Clearly visible when wearing', 'Nice product', 'Beautiful product']",Amazon,https://m.media-amazon.com/images/W/IMAGERENDERING_521856-T2/images/I/61d35AC+BpL._UY550_.jpg
https://www.amazon.in/Greciilooks-Womens-Summer-Red_Large-X-Large/dp/B09NQB6CJ8/ref=zg_bs_1968444031_sccl_17/257-0329217-1454160?psc=1,GRECIILOOKS,Women Casual Shirts Full Sleeve | Casual Shirts for Women Stylish Western | Official Shirts for Women Formal | Regular fit Tops for Women,₹379,3.5,521,95,"['The rate is high in comparison to cloth.Not worth buying for that cost.', 'After one use the cloth get damage.', 'Superb quality... Good for office college girls .. amazing shirt and fabric quality.. too good .. go for it girls .', 'Good product but quality could have been better', 'Good', 'Love the product ... the cloth material is very soft and beautiful too... simple shirt can be paired with any outfit', ""Why the hell are you reducing 40 rs when am returning this. I had paid 359 rs and m getting back 319. I were returning this coz it was tight and going to order next size.. but I think I won't anymore. so disappointing."", 'Product did not have any Tag. And a bit tight on arms which makes it uncomfortable.', 'Short was good and it worth the price']",Amazon,https://m.media-amazon.com/images/W/IMAGERENDERING_521856-T2/images/I/61EZpScrjcL._UY550_.jpg
https://www.amazon.in/Buynewtrend-Plain-Solid-Regular-Formal/dp/B0BWRB322K/ref=zg_bs_1968444031_sccl_18/257-0329217-1454160?psc=1,Buynewtrend,Plain Solid Rayon Regular Fit Women Formal Shirt,₹337,0.0,0,0,[],Amazon,https://m.media-amazon.com/images/W/IMAGERENDERING_521856-T2/images/I/61P1cFP+ZvL._UY550_.jpg
https://www.amazon.in/Harpa-Womens-Regular-Blouse-GR6201_Blue/dp/B08W8DCSJL/ref=zg_bs_1968444031_sccl_19/257-0329217-1454160?psc=1,Harpa,Women's Regular Fit Blouse,₹433,3.8,611,45,"['Nice', 'Ok product', ""It's perfect for daily use tops ! Go for it."", 'Material looks good initially but after 2-3 wash it just tares off. Used it only 3-4 times and had to discard as it tore', 'Colour and quality as given in the product details,fast delivery and good quality.', 'Nice', 'Nice look good for casual occasions', ""Love this top. Colour is bit different, but it's good though."", ""It's just simple and attractive"", 'Smart looking']",Amazon,https://m.media-amazon.com/images/W/IMAGERENDERING_521856-T2/images/I/310OBwvzCDL._UY500_.jpg
https://www.amazon.in/FUNDAY-FASHION-Women-Solid-Formal/dp/B0BVK5BCK6/ref=zg_bs_1968444031_sccl_20/257-0329217-1454160?psc=1,FUNDAY FASHION,Women Solid Formal Satin Shirt,₹348,0.0,0,0,[],Amazon,https://m.media-amazon.com/images/W/IMAGERENDERING_521856-T2/images/I/61rmD+WTU+L._UY550_.jpg
https://www.amazon.in/Plush-Womens-Shirt-DPL-XL-PT-001-CRRT_Red_XL/dp/B0978TJM56/ref=zg_bs_1968444031_sccl_21/257-0329217-1454160?psc=1,Plush,Women's Long Printed Cotton Round Neck Half Sleeve T-Shirt/Tshirts (DPL-PT-001),₹369,3.9,583,35,"['Superb excellent 👌 👏 👍 very nice', 'Clothe quality is very good\nI suggest to buy', 'It gives you nice look. Happy with this product', 'Excellent product', 'Though material is good but the size varies, if you want to buy XL you have to order xxl because in size there is some mistake.', 'Product is good but order one size bigger', 'Very good quality😍😍😍', 'One can buy, if price is not constraint', 'Nice light and soft fabric , suitable for summer wear. Colour ditto liKe the picture. T shirt perfect for girls, but for older and more curvy women, makes curves too prominent . So order a couple of sizes bigger. I got an L but find it tightish, so will be returning and placing order for larger size.', 'The t-shirt is quite long and comfortable, quality is also adequate as compared to other similar products on Amazon having loose stitches.']",Amazon,https://m.media-amazon.com/images/W/IMAGERENDERING_521856-T2/images/I/61JWwN+JE2S._UY550_.jpg
https://www.amazon.in/FUNDAY-FASHION-Casual-Mandarin-Medium/dp/B07P8DYMSQ/ref=zg_bs_1968444031_sccl_22/257-0329217-1454160?psc=1,FUNDAY FASHION,Women Casual Denim Mandarin Shirt,₹328,3.7,1171,110,"['Nice shirt👕👔 tqu Amazon', 'Nice colour and comfort.However fabric quality and looks are not up to our expectations.', 'Nice shirt', 'चौड़ाई में 4 इंच कम, लंबाई में 4,5 इंच लंबी होती तो मेरे लिए 👍👍👍 रहती but 😭😭😭 अभी यह मेरे किसी काम की नहीं है।।।।\n\nअब क्या करू कि यह शर्ट मेरे काम आ जाए।।।।', 'Kapda bahut achha hai size bhi fir hai 😍😍😍😍', 'Horrible!! Though the size specified is M, but the item seems smaller than S. The product has been once exchanged to get M and size parity is too poor.', 'Awesome shirt, liked it a lot', 'I thought XL will be lengthy than M even if its loose but every sizes have same length and different width. Product quality is excellent and as expected.', 'Material is thick as required and nice quality. Looks elegant.', 'I liked it but very light greyish whitish color good for summers but i wanted blue hence returned']",Amazon,https://m.media-amazon.com/images/W/IMAGERENDERING_521856-T2/images/I/41JMKS4u3jL.jpg
https://www.amazon.in/C-Cozami-Womens-Casual-Sleeves-Double/dp/B0BSTF7G53/ref=zg_bs_1968444031_sccl_23/257-0329217-1454160?psc=1,C.Cozami,Women's Casual Long Sleeves Double Pocket Rayon Shirts for Women/Girls,₹499,3.4,163,15,"[""Quality isn't that great. Fit is gud... Okay for this price"", 'Nice product, material is also very nice, love it.', 'Average quality ..', 'Fitting is good, but cloth is not that good. Moreover colour is going while washing, profusely..', 'There was no holes for button and stitching was coming out while the product was delivered itself.', 'Truely Love this shirt 😘😘😘 color is so good ...exactly what i wanted & fitting is too good . just loved it', 'Poor quality fitting bad looking not good.', 'The value for money.', 'smaller']",Amazon,https://m.media-amazon.com/images/W/IMAGERENDERING_521856-T2/images/I/71eFrujnUFL._UX522_.jpg
https://www.amazon.in/FUNDAY-FASHION-Printed-Casual-XX-Large/dp/B0BVK445T1/ref=zg_bs_1968444031_sccl_24/257-0329217-1454160?psc=1,FUNDAY FASHION,Women Boxy Fit Printed Casual Shirt,₹425,0.0,0,0,[],Amazon,https://m.media-amazon.com/images/W/IMAGERENDERING_521856-T2/images/I/61AxFp0AK8L._UY500_.jpg
https://www.amazon.in/Harpa-Womens-Geometric-Regular-GR6275_Maroon/dp/B09VSQHH48/ref=zg_bs_1968444031_sccl_25/257-0329217-1454160?psc=1,Harpa,Women's Regular Blouse,₹416,3.5,75,6,"[""It's fabric is not good and fitting is also not good."", 'The colour was too dull and it had black stains. Seems like it was used as mop. So i returned it.', 'Nice top', 'This top looks very dull and material n fitting is not good.. I ordered xl but it is not fitting me\n... Very disappointed', 'Amazon didn’t satisfied me this time .product didn’t meet the quality .Color started bleeds.', 'Does not fit well. Inner lining is longer than outside of the top']",Amazon,https://m.media-amazon.com/images/W/IMAGERENDERING_521856-T2/images/I/71+tIHZ5hlL._UX522_.jpg
https://www.amazon.in/FUNDAY-FASHION-Regular-Sleeveless-Button/dp/B0B65NTVZ3/ref=zg_bs_1968444031_sccl_26/257-0329217-1454160?psc=1,FUNDAY FASHION,Women Regular Fit Solid Casual Sleevesless Shirt,₹348,3.5,56,5,"['I brought this for my cosplay and it turned out really good. Can wear it as everyday shirt.', 'It’s good material', 'Too small for the size purchased… quality also cheap. Threads coming out already.', 'Very transparent and low quality product', '']",Amazon,https://m.media-amazon.com/images/W/IMAGERENDERING_521856-T2/images/I/61qd0RGGH6L._UY550_.jpg
https://www.amazon.in/DHRUVI-TRENDZ-Women-Regular-Medium/dp/B09D8D5551/ref=zg_bs_1968444031_sccl_27/257-0329217-1454160?psc=1,DHRUVI TRENDZ,"Women Lycra Half Sleeve Office Wear, Casual Wear, Shirt- Tops for Women Top",₹299,3.7,443,43,"['I like, nice t shirt', 'Cloth is nice.very much comfortable good product during summer.', ""Excellent fabric! Perfect fit! Utmost comfort! You can't get this good tshirt at this price(rs279) ! Go for it! Thank you dhruvi trendz!"", 'I am like this product', 'Good quality top for casual wear', 'Kapda comfortable hai lekin kuch wash ke baad fade ho Gaya colour', 'The fabric of the cloth was good but the colour was not that bright as shown in the picture.', 'Quality is very nice']",Amazon,https://m.media-amazon.com/images/W/IMAGERENDERING_521856-T2/images/I/81sW7nsjYoL._UY550_.jpg
https://www.amazon.in/Janasya-Womens-Mustard-Weaved-Mustard_X-Large/dp/B08RYPWC3J/ref=zg_bs_1968444031_sccl_28/257-0329217-1454160?psc=1,Janasya,Women's Mustard Cotton Woven Design Gathered Tunic,₹468,4.0,329,25,"['The fabric is thick cotton style, colour exact same shown in picture and nice fit.', 'Quality, fit and color of the product is amazing', 'Nice top', ""It's nice.. go one size larger"", ""Buttons can't be opened hence not fit for feeding."", 'Very good satisfying product with perfect fitting ..loved the stitching must try product and affordable.', 'A very comfortable one', ""It's a nice product, happy with purchase."", 'Super 👍', 'Nice fit. Looks good.']",Amazon,https://m.media-amazon.com/images/W/IMAGERENDERING_521856-T2/images/I/81Pmocf7L4L._UY550_.jpg
